date,username,to,replies,retweets,favorites,text,geo,mentions,hashtags,id,permalink
2020-03-17 13:26:19,Sambacolorado,,0,0,0,"With this Coronavirus outbreak, #Samba #Colorado has decided to offer online classes for the month of March. Come dance away your stress and anxiety at our virtual studio every Tue & Wed. Make sure to sign up ahead… https://www.instagram.com/p/B91hyJTFuGK/?igshid=sooivdeawkjf …",,,#Samba #Colorado,1239905910249492481,https://twitter.com/Sambacolorado/status/1239905910249492481
2020-03-17 13:26:09,harleymadhatter,,0,0,1,"I just emailed the principal asking for a detail outline mailed to the parents daily cause this is a massive amount and I am overwhelmed at this point. My anxiety is over the top at this point.",,,,1239905867740459008,https://twitter.com/harleymadhatter/status/1239905867740459008
2020-03-17 13:23:19,LizzyMcGuire419,,0,0,0,"I’m honestly so thankful that this isolation thing hasn’t effect my depression (yet). I’ve had two anxiety attacks in the past few days but they have had nothing to do with what’s going on.",,,,1239905155144957954,https://twitter.com/LizzyMcGuire419/status/1239905155144957954
2020-03-17 13:23:19,HMPBarringer,,0,0,0,"My dog has more anxiety than I do about this. I'm scrubbing everything all the time so she assumes my niece and nephew are coming over at any minute, but they never arrive. She's gonna lose it soon.",,,,1239905152645111809,https://twitter.com/HMPBarringer/status/1239905152645111809
2020-03-17 13:23:19,hap_iii,,1,0,0,"@Citibank, @WellsFargo, @Chase, et al...take the lead and help solve a major anxiety for over 1/2 population who will be out of work b/c of shutdowns: suspend debt payments on CC, auto loans, mortgages, etc. cc: @aoc @KatyTurNBC @chrislhayes @travisakers @BernieSanders @JoeBiden",,@Citibank @WellsFargo @Chase @aoc @KatyTurNBC @chrislhayes @travisakers @BernieSanders @JoeBiden,,1239905151403675649,https://twitter.com/hap_iii/status/1239905151403675649
2020-03-17 13:23:15,Dorsey1967,,1,0,2,"I put a new roll of TP on the holder and it gave me anxiety... we have about 6 rolls left! Waiting on that bidet! #tpshortage #Hoarders",,,#tpshortage #Hoarders,1239905135075241984,https://twitter.com/Dorsey1967/status/1239905135075241984
2020-03-17 13:22:22,BOEIN17,,0,0,1,"“The presence of anxiety is unavoidable. The prison of anxiety is optional”.",,,,1239904914467422208,https://twitter.com/BOEIN17/status/1239904914467422208
2020-03-17 13:22:16,CACKent,,0,0,0,"Planned months ago, and before our shut down, our morale committee planned a shamrock hunt for yesterday. We recognize that the current status of the world is challenging, scary, and leaving many with anxiety. Our… https://www.instagram.com/p/B91hUi3hOBy/?igshid=16qozbn65zut1 …",,,,1239904888731185159,https://twitter.com/CACKent/status/1239904888731185159
2020-03-17 13:22:02,lanikamalani,,0,2,2,"My anxiety has been through the roof",,,,1239904831382290433,https://twitter.com/lanikamalani/status/1239904831382290433
2020-03-17 13:20:17,parkerontweets,KenidraRWoods_,1,0,1,"of my job is f2f contact with my individuals so that is hard. I am also offering social “breaks” for my co-workers where we can video chat and take breaks with each other. As an extrovert with anxiety disorder and depression I am focusing on keeping up my social contact & 2/3",,,,1239904391248953345,https://twitter.com/parkerontweets/status/1239904391248953345
2020-03-17 13:19:47,lilymalaysia,KerriSandberg,0,0,1,"I know! The anxiety behind it all is what's hurting me...",,,,1239904263381364738,https://twitter.com/lilymalaysia/status/1239904263381364738
2020-03-17 13:17:52,Sammie_Montana_,CabernetBay,1,0,1,"My anxiety is flaring up big time. Trying so hard to be positive and grateful I am still employed and can work at home but I have to start over every morning. Hope you, baby, and Jordan stay safe and well.",,,,1239903779656523778,https://twitter.com/Sammie_Montana_/status/1239903779656523778
2020-03-17 13:17:36,TaliBogler,UofTFamilyMed,1,9,18,"We’re doing the same @UnityHealthTO FHT as we switch to #virtualcare. Also setting protected time from 9-11 AM for our vulnerable and well (I.e elderly, pregnant, newborns) which has really lessened the anxiety for these patients @PhamTia @davidkaplanmd @TorontoStar @DrJPeransonhttps://twitter.com/UofTFamilyMed/status/1239899936902258688 …",,@UnityHealthTO @PhamTia @davidkaplanmd @TorontoStar @DrJPeransonhttps,#virtualcare,1239903715408203779,https://twitter.com/TaliBogler/status/1239903715408203779
2020-03-17 13:17:20,pembelizabeth,,0,0,0,"My anxiety has been through the roof and I want to cry. Wtf?! What if I just wanted to work part-time?",,,,1239903647837847553,https://twitter.com/pembelizabeth/status/1239903647837847553
2020-03-17 13:17:15,bernierockson,RealSteveCox,0,0,0,"Cannabis would ease a lot of the anxiety out there right now https://twitter.com/RealSteveCox/status/1239793876178632705 …",,,,1239903626337935360,https://twitter.com/bernierockson/status/1239903626337935360
2020-03-17 13:12:44,jaydestro,,21,2,16,"My anxiety is having anxiety today can you help me with positive messages and photos of good pets or whatever?",,,,1239902490113572865,https://twitter.com/jaydestro/status/1239902490113572865
2020-03-17 13:08:58,GreenLawndesign,,0,0,1,"For all those #selfemployed - Put all that frustration fear anxiety into a project. Think outside the box. Adapt to the crisis to make $$.",,,#selfemployed,1239901542733529091,https://twitter.com/GreenLawndesign/status/1239901542733529091
2020-03-17 13:08:23,piptal,christyzen,2,1,11,"A PSA for everyone really I’ve been wondering how on earth I can keep up with work from home while dealing with kids out of school (teens, but still) and my own anxiety and not having access to my office resources https://twitter.com/christyzen/status/1239884725118009347 …",,,,1239901396318781440,https://twitter.com/piptal/status/1239901396318781440
2020-03-17 13:06:42,picknorthvb,,0,0,2,"Good Morning Panthers! As we adjust to this new norm many of us are experiencing sadness, stress and anxiety. Just remember that this too shall pass! #wearebettertogetherpic.twitter.com/CKx5SMRmw3",,,#wearebettertogetherpic,1239900970445914112,https://twitter.com/picknorthvb/status/1239900970445914112
2020-03-17 13:06:20,bailhatch,Jodhums14,0,0,1,"and people don't understand when I'm telling them I'm social distancing! of course I want to hang out but my anxiety is killing me knowing anything could happen, anyone can get it and you don't even know.",,,,1239900879656046593,https://twitter.com/bailhatch/status/1239900879656046593
2020-03-17 13:05:19,BRVNDIN,,0,0,0,"My anxiety is terrible after last night.",,,,1239900623493103616,https://twitter.com/BRVNDIN/status/1239900623493103616
2020-03-17 13:03:25,CaskAleKev,,0,0,3,"Day 1 recap of my kids out of school for #COVID19 14yo- slept most of the day and made the dough for a brioche that she will bake off tonight 12yo- exhibiting signs of extreme anxiety for not finishing all of the assignments her teachers sent for the next month yet.",,,#COVID19,1239900146797883393,https://twitter.com/CaskAleKev/status/1239900146797883393
2020-03-17 13:03:19,mslizlord,TheDeadBeatBros,0,0,1,"The best anxiety cure.",,,,1239900118117224454,https://twitter.com/mslizlord/status/1239900118117224454
2020-03-17 13:01:30,Leahhh_biaa,,0,0,0,"I’m prepared, but I’m nervous. Out of work from a job that I’m super passionate about for at least 2 weeks. All of the sudden I’m a homeschool teacher. 1 that drinks vodka and OJ for breakfast because it eases the anxiety that comes from not knowing wtf is gonna happen next...",,,,1239899663177785349,https://twitter.com/Leahhh_biaa/status/1239899663177785349
2020-03-17 13:01:10,New_Mercy_BH,,0,0,0,"Big Ole #FACTS #2020 #NewMercyBehaviorialHealth #JacksonMS #mississippi #coping #clarity #mentalhealth#mentalwealth #counseling #mentalhealthawareness #mentalillness #support #therapy #counseling #depression #bipolar #anxiety #PTSDpic.twitter.com/jgWdsJOv3Q",,,#FACTS #2020 #NewMercyBehaviorialHealth #JacksonMS #mississippi #coping #clarity #mentalhealth #mentalwealth #counseling #mentalhealthawareness #mentalillness #support #therapy #counseling #depression #bipolar #anxiety #PTSDpic,1239899580864618500,https://twitter.com/New_Mercy_BH/status/1239899580864618500
2020-03-17 13:01:07,lindsaycnnbs,morganbean_,0,0,0,"People showing aggression and selfishness rn is really disappointing I feel so hard for you! I struggle with lots of anxiety too",,,,1239899566947721217,https://twitter.com/lindsaycnnbs/status/1239899566947721217
2020-03-17 12:56:41,RC_Reacts,,0,0,0,"ALWAYS start your day off with a #smile no matter what, don't let #depression or #anxiety get in the way of anything. I hope all of y'all have a good day. #Handsome #Sexy #instagram #Roanoke #RoanokeVA @Villa… https://www.instagram.com/p/B91eZKhJJAV/?igshid=gccg41ok2ka …",,@Villa,#smile #depression #anxiety #Handsome #Sexy #instagram #Roanoke #RoanokeVA,1239898452265500673,https://twitter.com/RC_Reacts/status/1239898452265500673
2020-03-17 12:55:37,WhiteLegalAtl,,0,0,1,"Amidst a season of national anxiety, fear, uncertainty, and social isolation ... I celebrated my 40th birthday and the number of texts, phone calls, DMs, flowers, gifts, social media… https://www.instagram.com/p/B91eRRjBZdN6QQiTWZqGXIdtT5tS0KES8YoFrs0/?igshid=19unc7ztoml4j …",,,,1239898182781415426,https://twitter.com/WhiteLegalAtl/status/1239898182781415426
2020-03-17 12:54:29,joedlc71,,0,0,0,"I have to try and maintain some normalcy to my days and running is something that calms my anxiety and stress, so I got my 4 miles in this morning even though the tracks are now pretty empty #runbabyrunpic.twitter.com/Bcd26cvVPC",,,#runbabyrunpic,1239897899108098048,https://twitter.com/joedlc71/status/1239897899108098048
2020-03-17 12:53:02,krisdiaz42,JeanniePrinsen,1,0,1,"I didn’t join for fear of that exact situation. I don’t need to add to my anxiety",,,,1239897530894184449,https://twitter.com/krisdiaz42/status/1239897530894184449
2020-03-17 12:51:35,kurt_inthe_city,,2,0,14,"I’m so glad I waited for this period of social distancing to binge Live is Blind. Now I can suspend my anxiety for my community and channel it into my anxiety for Mark.",,,,1239897167017508866,https://twitter.com/kurt_inthe_city/status/1239897167017508866
2020-03-17 12:50:20,richardrancou12,,0,0,0,"What is wrong with our journalists? Instead of helping our service providers they add to the anxiety with their blaming questions",,,,1239896852021096451,https://twitter.com/richardrancou12/status/1239896852021096451
2020-03-17 12:48:18,elizacranepoet,,1,0,2,"Today at work they are having paras label and organize books, it just seems so silly to even go in for little projects when our anxieties are high and our hearts are full of sadness",,,,1239896341087649792,https://twitter.com/elizacranepoet/status/1239896341087649792
2020-03-17 12:48:10,HawkeyeCoffee,,0,0,0,"I think part of my anxiety is that the Federal government is no where to be found in this crisis. It’s all local. Better than nothing, but not good and not impactful enough.",,,,1239896306572767233,https://twitter.com/HawkeyeCoffee/status/1239896306572767233
2020-03-17 12:48:06,bradylabs,,9,0,31,"Anyone else out there having horrible nightmares? Clearly the constant mid-grade anxiety I’m experiencing is having an effect.",,,,1239896291829661698,https://twitter.com/bradylabs/status/1239896291829661698
2020-03-17 12:46:16,LarryMadowo,PaulMungaiW,0,0,5,"I can’t imagine the anxiety their work brings them",,,,1239895830888357888,https://twitter.com/LarryMadowo/status/1239895830888357888
2020-03-17 12:45:27,AToastwithDom,,0,0,0,"My anxiety is operating from another place. I’m still commuting to work and I doubt our office will close unless we’re forced to. I don’t want to say that those of you who are working from home are “fortunate” but I definitely feel more vulnerable than ever rn.",,,,1239895625178796036,https://twitter.com/AToastwithDom/status/1239895625178796036
2020-03-17 12:45:25,AlexzandriaCori,,0,0,2,"protip; don’t be an absolute cunt to patients who are concerned about their medicine being covered by new insurance. thanks for the anxiety attack!!",,,,1239895615565369345,https://twitter.com/AlexzandriaCori/status/1239895615565369345
2020-03-17 12:45:11,chooky_504,kushqueenO,1,0,1,"I hate it here! My anxiety ain’t built for this world! It’s killing me softly, no Roberta Flack",,,,1239895556090138624,https://twitter.com/chooky_504/status/1239895556090138624
2020-03-17 12:44:30,adacecelia,,0,0,0,"I wake up every day around this time w so much anxiety",,,,1239895384027049984,https://twitter.com/adacecelia/status/1239895384027049984
2020-03-17 12:43:36,DrErinReynolds,Headspace,0,0,0,"@Headspace is providing their #meditation app for free for US healthcare providers working in public health settings to help reduce #anxiety and increased #stress. Every little bit helps. #selfcare #COVID19https://twitter.com/Headspace/status/1239588833013813248 …",,@Headspace,#meditation #anxiety #stress #selfcare #COVID19https,1239895157207699458,https://twitter.com/DrErinReynolds/status/1239895157207699458
2020-03-17 12:41:03,beardedphotog24,ChrisOB413,0,0,1,"Yea I know I’m just a stickler for punctuality and if times are thrown off it messes with my anxiety",,,,1239894518264205314,https://twitter.com/beardedphotog24/status/1239894518264205314
2020-03-17 12:39:30,Praeditos_ish,,0,0,0,"Times like this apart from the importance of stay cautious & safe, your Mental health is also important, because the things fear anxiety + panic & paranoia can do to a mind.",,,,1239894126918807552,https://twitter.com/Praeditos_ish/status/1239894126918807552
2020-03-17 12:38:08,hbiggsrochester,jorah,0,0,1,"I’ve had terrible times with my anxiety. Everything is closed now. My neighborhood, which is a vibrant, artsy one, is silent. All I hear are cars going by, an occasional siren. It’s creepy",,,,1239893780435795970,https://twitter.com/hbiggsrochester/status/1239893780435795970
2020-03-17 12:37:09,SatraFierce,,0,1,34,"made my tea, turned on cranes in the sky, and finally in the head space to crank out this writing. whew, make sure you check on your friends with anxiety folks!",,,,1239893536075649024,https://twitter.com/SatraFierce/status/1239893536075649024
2020-03-17 12:36:06,SheilaBoudreau,myonlinelifenow,0,0,1,"I was thinking about that, these kids already have climate anxiety. Now this?!",,,,1239893272765640704,https://twitter.com/SheilaBoudreau/status/1239893272765640704
2020-03-17 12:33:17,LTKnS,,0,0,0,"#conserve stay #grounded keep your distance... Be grateful for these moments of #peace amidst the fluxes of #covid_19 anxiety and panic. There is opportunity in every threat. There is a door that opens every… https://www.instagram.com/p/B91btxUhFDD/?igshid=vnag8y5wy8hn …",,,#conserve #grounded #peace #covid_19,1239892561613017089,https://twitter.com/LTKnS/status/1239892561613017089
2020-03-17 12:32:28,mike_yassa,TWBredy,0,0,1,"False. Students’ degraded mental health puts more lives and livelihood at stake than coronavirus. Depression, anxiety and suicidal ideation have increased substantially. Also, I’m not saying graduation should have proceeded. But delaying it to the fall could have been an option.",,,,1239892357421522945,https://twitter.com/mike_yassa/status/1239892357421522945
2020-03-17 12:32:22,chrizzy_duhhh,blakedmorton,0,0,6,"Puts my anxiety on a million https://twitter.com/blakedmorton/status/1239027197249232901 …",,,,1239892329915453442,https://twitter.com/chrizzy_duhhh/status/1239892329915453442
2020-03-17 12:31:33,sprad3s,,1,0,1,"day 3 of my yoga studio closing and my anxiety has decided to quarantine with me ha ha ha I hate it here",,,,1239892125040422913,https://twitter.com/sprad3s/status/1239892125040422913
2020-03-17 12:30:33,DGSpeaks,,0,0,0,"These are my favorite #stress and #anxiety supplements. What are some of your favorite #supplements to maintain #health and #wellbeing? @youtheory @NaturesBounty @naturalvitality #CoronavirusOutbreak #CoronavirusUSApic.twitter.com/1sr5Uwp5t1 – at Stanton Park",,@youtheory @NaturesBounty @naturalvitality,#stress #anxiety #supplements #health #wellbeing #CoronavirusOutbreak #CoronavirusUSApic,1239891875005378567,https://twitter.com/DGSpeaks/status/1239891875005378567
2020-03-17 12:28:19,Pic_ACardNeCard,,1,0,2,"Quarantine results: - A lot of babies - Everyone will gain 5-10 pounds - Stock Market will crash - A couple of businesses will shut down - Anxiety/Depression for some",,,,1239891309948735489,https://twitter.com/Pic_ACardNeCard/status/1239891309948735489
2020-03-17 12:27:51,StylishScambino,,1,33,38,"i’m such a planner. the anxiety of not knowing what’s what & things changing every 30 minutes is really fucking with me as a person",,,,1239891195192659968,https://twitter.com/StylishScambino/status/1239891195192659968
2020-03-17 12:27:37,ohiometfan,,0,0,0,"Know the Lord is with you at all times. Keep Him close to your heart. 1 Peter 5:7 says, ""Cast all your anxiety on him because he cares for you.""",,,,1239891136770162688,https://twitter.com/ohiometfan/status/1239891136770162688
2020-03-17 12:26:46,jacklovestv,davidsirota,0,0,1,"Turning 30 in May; can confirm. I have not known peace. My anxiety is justified. https://twitter.com/davidsirota/status/1239739216679976963 …",,,,1239890921077878787,https://twitter.com/jacklovestv/status/1239890921077878787
2020-03-17 12:26:11,SusanGapka,,0,0,0,"1 Thought for Today: I am fine tuning my social distancing techniques this week after years of practice. In a heightened state of anxiety I have encountered a few people who seemed over excited about the pandemic.",,,,1239890774214541314,https://twitter.com/SusanGapka/status/1239890774214541314
2020-03-17 12:25:28,DBHS_Counseling,,0,7,12,"Students, parents and school community. If you are experiencing stress or anxiety during this time, slow down and try this method to relax. to our Tribe! pic.twitter.com/70VoemaGlb",,,,1239890592823422976,https://twitter.com/DBHS_Counseling/status/1239890592823422976
2020-03-17 12:22:55,KeishaRiley,,0,0,0,"The drastic reduction in mom-ing (as far as coordinating schedules and having two kids in ten places at the same time) is helping with my anxiety",,,,1239889954349682694,https://twitter.com/KeishaRiley/status/1239889954349682694
2020-03-17 12:22:13,philwahba,moorehn,1,1,4,"Wonderful thread from @moorehn on dealing with the anxiety from this situation. https://twitter.com/moorehn/status/1239879511166136320 …",,@moorehn,,1239889778922881027,https://twitter.com/philwahba/status/1239889778922881027
2020-03-17 12:21:30,KarisRogerson,,1,0,9,"Yesterday was day 1 of our new work from home reality and it did not do good things for my mental health. I'm hoping things like reading, journaling, and TV I love will help soothe my anxiety before each shift...",,,,1239889594755223555,https://twitter.com/KarisRogerson/status/1239889594755223555
2020-03-17 12:20:50,TWazo11,AreaDownstairs,0,0,0,"Downstairs Area, I’m the same way. I will occasionally listen. I decided that I need a life besides KMS. But I do appreciate their efforts. Can I DM you? I’d like your opinion of some anxiety and anti-social behaviors I’ve been dealing with. I think you’d be interested.",,,,1239889429688442881,https://twitter.com/TWazo11/status/1239889429688442881
2020-03-17 12:20:21,profpatch,RPR_Agile,1,0,2,"Yes! And that hyper-productive type of anxiety is rampant in academia. Mine plays out differently. pic.twitter.com/YFWCNPAAXh",,,,1239889306912768002,https://twitter.com/profpatch/status/1239889306912768002
2020-03-17 12:16:02,EDWARDS85L,,0,0,0,"CEOs video message being met with understandable anxiety but it was inevitable in a revenue generated business. We wait for news at a local level.",,,,1239888221435199489,https://twitter.com/EDWARDS85L/status/1239888221435199489
2020-03-17 12:15:43,lindsaycnnbs,,0,0,2,"Cuddling with my dog takes all my anxiety away",,,,1239888142745755649,https://twitter.com/lindsaycnnbs/status/1239888142745755649
2020-03-17 12:15:19,ellepops_,taytaybreezy,0,0,0,"Very true, but also if my anxiety was ever rational/logical it wouldn't be a problem",,,,1239888039255724040,https://twitter.com/ellepops_/status/1239888039255724040
2020-03-17 12:14:41,satanicbaek,,1,0,1,"WELL i've been in a constant state of hardcore anxiety over the past four days because i work for an eye surgeon and we're apparently not closing but at least my mf kpop albums coming 2 days early??? pic.twitter.com/VZMudHzvNV",,,,1239887882569027590,https://twitter.com/satanicbaek/status/1239887882569027590
2020-03-17 12:11:29,1of2vics,,1,11,20,"Fear and anxiety about #COVID19 can be overwhelming and cause strong emotions and anxiousness. If you, or someone you care about, are feeling overwhelmed with emotions like sadness, depression, anxiety, or feel like you want to harm yourself seek help. #StopSuicide #1800273TALKpic.twitter.com/ChGE0RvGoK",,,#COVID19 #StopSuicide #1800273TALKpic,1239887075564019713,https://twitter.com/1of2vics/status/1239887075564019713
2020-03-17 12:10:55,essayhughes,MoppyOpps,0,0,0,"I have one cat, many movies, more books, and anxiety/chronic pain meds, but no smoking hot British man. Do you think I could ship myself one? The company would be nice. My cat is an attention whore. https://twitter.com/MoppyOpps/status/1239695246310572032 …",,,,1239886932961832960,https://twitter.com/essayhughes/status/1239886932961832960
2020-03-17 12:08:29,AgustDeesnutz,yoongibulge,0,0,1,"This tweet gives me anxiety",,,,1239886321230819328,https://twitter.com/AgustDeesnutz/status/1239886321230819328
2020-03-17 12:06:59,CupofMoJoe,,0,0,0,"Good Morning ! Happy Tues-YAY !! The second tip from my Coronavirus Care Kit is: EAT WELL! The body’s immune system is directly and adversely affected when under constant duress (e.g., excess anxiety, distress,… https://www.instagram.com/p/B91YTFIgogG/?igshid=7zn0jrapi8yd …",,,,1239885944054067201,https://twitter.com/CupofMoJoe/status/1239885944054067201
2020-03-17 12:06:48,proudboymomX3,,1,0,0,"Tuesday Tip #confidence #confident #hope #peace #peaceofmind #anxiety #anxietyrelief #faith #bible #biblestudy #godfirst #jesus @Chicago, Illinois https://www.instagram.com/p/B91Yr8aApWD/?igshid=rkvtodjmxumk …",,@Chicago,#confidence #confident #hope #peace #peaceofmind #anxiety #anxietyrelief #faith #bible #biblestudy #godfirst #jesus,1239885897656668161,https://twitter.com/proudboymomX3/status/1239885897656668161
2020-03-17 12:02:25,tiffuhhh1,,0,0,0,"Not my anxiety giving me dreams I don’t want!!!",,,,1239884792096870401,https://twitter.com/tiffuhhh1/status/1239884792096870401
2020-03-17 12:02:05,RandyySavage_,,0,0,2,"i’m more worried about the panic than anything. panic is more contagious. anxiety will kill you. i feel bad for ppl who don’t have a any control over their anxiety",,,,1239884711297769472,https://twitter.com/RandyySavage_/status/1239884711297769472
2020-03-17 12:00:24,MrsBrainbow,,0,0,2,"When my anxiety is bad, I hold mr.brainbow's hand and snuggle the pup Bruno! I'm so tired from the worry so it's time to write and draw. Get in a good headspace. . . . . . #selfquarantine #lowerthecurve… https://www.instagram.com/p/B91X9DrncwE/?igshid=5wgn4bgrrsu0 …",,,#selfquarantine #lowerthecurve,1239884287005974528,https://twitter.com/MrsBrainbow/status/1239884287005974528
2020-03-17 11:58:58,lakanen,jamenta,0,0,1,"Yeah, I had some anxiety several times while watching it.",,,,1239883926698692609,https://twitter.com/lakanen/status/1239883926698692609
2020-03-17 11:58:48,gregory_finney,,1,0,0,"What's everyone doing now? At home? Watching Netflix, listening to iTunes & Netflix while the majority of us who create this art for times like this are living in real states of anxiety and insecurity",,,,1239883885640482818,https://twitter.com/gregory_finney/status/1239883885640482818
2020-03-17 11:54:57,tacolla,,0,0,0,"I bought ice cream. And chocolate lava cake. #coronavirus #anxiety #QuarentineLife",,,#coronavirus #anxiety #QuarentineLife,1239882912914432003,https://twitter.com/tacolla/status/1239882912914432003
2020-03-17 11:54:41,CounselorClarke,,0,0,11,"Morning workout done The one thing I can control right now. Exercise keeps my anxiety in check! What will you do for self-care today? #strongmama #anxietywarrior #wevegotthis #covid_19pic.twitter.com/I0OtIrDxtV",,,#strongmama #anxietywarrior #wevegotthis #covid_19pic,1239882849312034816,https://twitter.com/CounselorClarke/status/1239882849312034816
2020-03-17 11:51:52,cindymoore7988,,0,0,6,"Be a good neighbor and practice compassion for others. In a time of fear and anxiety, be their calm and reassurance #teamkentuckypic.twitter.com/infl3vKjEo",,,#teamkentuckypic,1239882140646506502,https://twitter.com/cindymoore7988/status/1239882140646506502
2020-03-17 11:51:18,petergrayatc,,0,1,1,"If you are a healthcare professional, you can redeem your subscription using your NPI number and email. @Headspace offers guided meditation for Work, Kids, Sleep, Focus, Stress, & Anxiety. Let’s be #Mindful during this time",,@Headspace,#Mindful,1239881995406266368,https://twitter.com/petergrayatc/status/1239881995406266368
2020-03-17 11:51:16,petergrayatc,,1,1,1,"What’s going on right now is a challenge and many may be feeling overwhelmed by stress & anxiety - especially healthcare professionals @Headspace is offering all US healthcare professionals free access to Headspace Plus through 2020.https://www.headspace.com/health-covid-19?fbclid=IwAR3Xct_gIsKmQkyWy2_536Cr5BjYLXeNNwojC_v5VsLwAld0CvqMIq8kaeU …",,@Headspace,,1239881989982953481,https://twitter.com/petergrayatc/status/1239881989982953481
