date,username,to,replies,retweets,favorites,text,geo,mentions,hashtags,id,permalink
2020-03-17 16:11:04,CoriellePhoto,,1,0,1,"Quotes from kids the thread 1) ms Cori will you marry me? 2) anxiety comes kicking in about thousand times a day( @UnknownToxin_) 3) no one likes you me Cori except me",,@UnknownToxin_,,1239947368721715200,https://twitter.com/CoriellePhoto/status/1239947368721715200
2020-03-17 16:10:58,ihultquist,,1,0,12,"The amount of fear, anxiety & guilt (!!) I’m having about possibly going to the grocery store is absurd. What has life become?",,,,1239947343559979008,https://twitter.com/ihultquist/status/1239947343559979008
2020-03-17 16:08:38,analydiamonaco,,26,0,53,"Health update: coughed all night long. I had verh little sleep. My temperature was checked by the hubs every couple of hours. 96.6. No fever. But no sleep and anxiety is not a good combo. I do have work to do with #lolasjourney and the little paid work that I have.",,,#lolasjourney,1239946757603123202,https://twitter.com/analydiamonaco/status/1239946757603123202
2020-03-17 16:08:21,theslopebarbers,,0,0,0,"While staying alert With the pandemic I’m enjoying a shot of @MartellCognacUS to calm down the anxiety #BIGNEST @theslopebarbers #KEEPYOURHANDSCLEAN #STILLOPEN @MartellCognacUS #MakeYourStatement #TheMartellWay… https://www.instagram.com/p/B910U_igoXU/?igshid=kudldeow7uao …",,@MartellCognacUS @theslopebarbers @MartellCognacUS,#BIGNEST #KEEPYOURHANDSCLEAN #STILLOPEN #MakeYourStatement #TheMartellWay,1239946686983700480,https://twitter.com/theslopebarbers/status/1239946686983700480
2020-03-17 16:07:18,NaomiSantana45,StephenGlickman,0,0,0,"Happy birthday! Take some time to relax and get away from things that scare you or give you anxiety. Enjoy your day.",,,,1239946421077307393,https://twitter.com/NaomiSantana45/status/1239946421077307393
2020-03-17 16:07:09,gritandddgrace,katiervse,0,0,0,"this is literally a Dx, anxiety + depression + OCD’s worst nightmare. praying for us all. https://twitter.com/katiervse/status/1239570422334664704 …",,,,1239946381789483008,https://twitter.com/gritandddgrace/status/1239946381789483008
2020-03-17 16:04:22,angytxx,,0,0,0,"Groups of cops walking round making sure that no one tries anything on Ezra isn’t helping my anxiety. Like, in the slightest.",,,,1239945683672674308,https://twitter.com/angytxx/status/1239945683672674308
2020-03-17 16:01:57,josh_radosh,LenaTina99,0,0,0,"Make art with your kids or grandkids, even if it’s a pretty landscape painting. Landscapes paintings are a good educational exercise. Other than that, they just look pretty which doesn’t accomplish much in my opinion Sorry I’m a snob sometimes... I feel bad? I have anxiety atm https://twitter.com/LenaTina99/status/1239267264144211974 …",,,,1239945074567340035,https://twitter.com/josh_radosh/status/1239945074567340035
2020-03-17 16:01:46,mollie_mayfield,,0,0,0,"Currently hating everyone that panic bought thermometers...hoping this I’m just having anxiety rn pic.twitter.com/qdLjxRzbo0",,,,1239945030242091008,https://twitter.com/mollie_mayfield/status/1239945030242091008
2020-03-17 16:01:32,gracion,,0,0,0,"Best advice from a psychologist for staying sane: 7 science-based strategies to cope with coronavirus anxiety http://theconversation.com/7-science-based-strategies-to-cope-with-coronavirus-anxiety-133207 …",,,,1239944971253211147,https://twitter.com/gracion/status/1239944971253211147
2020-03-17 16:01:31,billy_rosa_,,1,0,3,"I personally do this twice a day. Amazing for your nervous system, lung strengthening, and overall sense of well-being. Take good care friends. Observe your level of anxiety before starting and once finishing... any decrease is a beautiful thing. https://m.youtube.com/watch?v=gz4G31LGyog&t=102s …",,,,1239944963951075328,https://twitter.com/billy_rosa_/status/1239944963951075328
2020-03-17 16:01:26,MakeHerWay,,0,1,3,"Ya know, if pot and edibles were legal in MN, there would be a lot less anxiety...",,,,1239944943021568001,https://twitter.com/MakeHerWay/status/1239944943021568001
2020-03-17 16:00:10,ajaygirl,,0,0,0,"@Chris_Hodges can you do a daily scripture read on Instagram? I’m using the Bible through the year on the app but would love just an encouraging scripture from you daily. Struggling with anxiety and know it’s not against flesh and blood. Praying for you.",,@Chris_Hodges,,1239944625688805381,https://twitter.com/ajaygirl/status/1239944625688805381
2020-03-17 15:57:45,Becca_Fit_,,0,0,0,"I should explicitly disclose to never go up 67th unless you want me to have an anxiety attack in 2.5 seconds",,,,1239944016885690374,https://twitter.com/Becca_Fit_/status/1239944016885690374
2020-03-17 15:56:42,nleson747,Criss_Chi,0,0,0,"Wow that’s what Bill Clinton said how he relieved his Presidential tension and anxiety https://twitter.com/Criss_Chi/status/1238468216835444736 …",,,,1239943751361069058,https://twitter.com/nleson747/status/1239943751361069058
2020-03-17 15:56:07,monica_leavell,,0,0,0,"Yesterday was my break down day. Something just switched and I broke the heck down. I’ve been trying my best to keep myself together and combat my anxiety in new ways, but the emotions and the weight of this stress… https://www.instagram.com/p/B91y7OaDLWd/?igshid=cv8jsujmrr3h …",,,,1239943606506606594,https://twitter.com/monica_leavell/status/1239943606506606594
2020-03-17 15:55:19,firexlordzuko,,0,0,1,"reading psalms 91 never fails to calm my anxiety even if it’s just for a little, it gives me peace.",,,,1239943406870302723,https://twitter.com/firexlordzuko/status/1239943406870302723
2020-03-17 15:54:57,jaydestro,Adron,1,0,0,"Uh anxiety?",,,,1239943314796875777,https://twitter.com/jaydestro/status/1239943314796875777
2020-03-17 15:52:33,216Homer,,7,0,9,"Was just told I can’t work I begged but until we get the all clear I won’t be paid. I’ve got kids, the line is out the door for testing so I’m getting bitched at for that. It can take a week, I’m so overwhelmed with this I don’t know what to do Anxiety is killing me ugh",,,,1239942707780431874,https://twitter.com/216Homer/status/1239942707780431874
2020-03-17 15:52:17,EvelynErives,,1,1,12,"Trying to give the local updates on @991KGGI AND sprinkle in some fun for the kids in every report. I understand what it’s like for parents trying to manage anxiety and maybe even some boredom.",,@991KGGI,,1239942640562401280,https://twitter.com/EvelynErives/status/1239942640562401280
2020-03-17 15:50:47,DakotaStevenss,,0,0,4,"Y’all wanna know how bad my anxiety has been??? I’ve pulled out all my fucking eyelash extensions. Every single one of them... pic.twitter.com/Cf0qZMvtRs",,,,1239942262420799488,https://twitter.com/DakotaStevenss/status/1239942262420799488
2020-03-17 15:50:29,JillManrique,UgoOkere,0,0,0,"If my current level anxiety had a twitter account, this would be the pinned tweet. https://twitter.com/UgoOkere/status/1239941685649514496 …",,,,1239942187040813060,https://twitter.com/JillManrique/status/1239942187040813060
2020-03-17 15:50:22,autriya_manesh,,0,0,1,"Big shoutout to @DomjValent for showing us his cute doggo yesterday and calming down all of our anxieties #305Valente",,@DomjValent,#305Valente,1239942160360689664,https://twitter.com/autriya_manesh/status/1239942160360689664
2020-03-17 15:50:19,ArturoZaragoza_,,0,0,1,"Being around here gives me so much anxiety...",,,,1239942145626144768,https://twitter.com/ArturoZaragoza_/status/1239942145626144768
2020-03-17 15:47:22,vivaglam91,,2,0,4,"Going to work gives me anxiety",,,,1239941406635909122,https://twitter.com/vivaglam91/status/1239941406635909122
2020-03-17 15:47:12,laliefauxreal,,0,0,3,"My family & fiancé have all commented on how strangely calm I have been throughout the chaos that has been unfolding. I told them “I have been training for this my entire life.” The stuff ppl are stressing about now is the stuff that has caused me daily anxiety for 20+ years.",,,,1239941362818134016,https://twitter.com/laliefauxreal/status/1239941362818134016
2020-03-17 15:46:16,Pr3ttyFlaca,,0,0,1,"This has been giving me anxiety so much anxiety my apartment looks like a brand new unit",,,,1239941127467225088,https://twitter.com/Pr3ttyFlaca/status/1239941127467225088
2020-03-17 15:45:01,KristenSmith_SW,,0,0,1,"Mixed responses from my clients re: telehealth. Some are all about it, but others opted to reschedule citing lack of internet access, quiet spaces, discomfort with the platform. Checking in on my most high risk, but really worried about my folks with anxiety. This is a nightmare.",,,,1239940812831633408,https://twitter.com/KristenSmith_SW/status/1239940812831633408
2020-03-17 15:44:06,itsclearlysamm,,1,0,2,"The only thing the hotline does is gather your symptoms and information to submit it as an application. I’m a little upset because I live down the block from the testing center and I have no idea when I’ll get tested. I’ve had anxiety about this since the issue came about",,,,1239940583524794368,https://twitter.com/itsclearlysamm/status/1239940583524794368
2020-03-17 15:43:53,awillis,,2,0,19,"For months I’ve been panicking about losing my favorite doctor because we switched insurance, today she showed up as in network. Physical appointment made. Anxiety down one notch. It shouldn’t be like this.",,,,1239940527723872257,https://twitter.com/awillis/status/1239940527723872257
2020-03-17 15:43:05,lunaliloma,,1,1,4,"Anyone else’s anxiety really up there lately? Yeah, me neither.",,,,1239940326267039744,https://twitter.com/lunaliloma/status/1239940326267039744
2020-03-17 15:41:01,hannahcrileyy,,21,3,32,"this has already been a very anxiety ridden week+ and I’m not sleeping so well. then there was an APD shootout outside my building this morning. again, I humbly seek your working from home pet pics. I am a mess.",,,,1239939806769164288,https://twitter.com/hannahcrileyy/status/1239939806769164288
2020-03-17 15:39:41,Shef_Stone,,2,0,1,"I'm stupid fucking anxious now, I'm like 98% sure it's bronchitis because I've had it before and I'm experiencing it like I do everytime, but my anxiety is through the roof.",,,,1239939471589748743,https://twitter.com/Shef_Stone/status/1239939471589748743
2020-03-17 15:38:54,papinovaa,inda_creease,0,0,1,"Lmao yo that movie killed my nerves, man. Anxiety thru the roof.",,,,1239939272213397511,https://twitter.com/papinovaa/status/1239939272213397511
2020-03-17 15:37:43,madzlifecrisis,,0,0,1,"me, already getting anxiety over the thought of not leaving my house for anything other than work pic.twitter.com/T9JlmXkA38",,,,1239938974702915584,https://twitter.com/madzlifecrisis/status/1239938974702915584
2020-03-17 15:37:34,Writer003,mandylawson7,0,0,1,"I wish I could help you overcome your anxiety today. Just know there are many of us you feel better soon.",,,,1239938938187497474,https://twitter.com/Writer003/status/1239938938187497474
2020-03-17 15:37:09,CEOCSWSENTINC,,0,0,0,"(ANXIETY) Co-roommate next to the trash bin talking about the guy downstairs should come upstairs to take the trash out, I've explain to him heading out to the store; yo brother fam, not that serious packed that… https://www.instagram.com/p/B91wwfNFfXy/?igshid=1d687bv8iqkaz …",,,,1239938831916257280,https://twitter.com/CEOCSWSENTINC/status/1239938831916257280
2020-03-17 15:32:36,FHSAPUSHER,,0,0,1,"Reduce Student Anxiety (and Your Own) During Uncertain Times https://www.commonsense.org/education/articles/reduce-student-anxiety-and-your-own-during-uncertain-times … via @CommonSenseEd",,@CommonSenseEd,,1239937689127809024,https://twitter.com/FHSAPUSHER/status/1239937689127809024
2020-03-17 15:32:02,TheeWolfe,,1,1,0,"If you need some escapist podcasts to soothe some of that mounting anxiety here’s a list of some of #KCRW’s finest https://open.spotify.com/playlist/1IVoMQcZKNEhukW7cUZAP5?si=8bAmRJ7JReKhfY5otUN-ng …",,,#KCRW,1239937545196077056,https://twitter.com/TheeWolfe/status/1239937545196077056
2020-03-17 15:28:48,SharonAzar,,0,1,7,"Two words resonating with me this morning: Resilience and Clarity Building Resiliency with our students who are frightened, whose anxieties are topped out. Also, their parents are worried about them becoming ill. Many of our learners have compromised immune systems.",,,,1239936733829005313,https://twitter.com/SharonAzar/status/1239936733829005313
2020-03-17 15:26:50,mallon_khan,,0,0,2,"When people with crippling anxiety tell you that you should be worried. pic.twitter.com/z5chq4kVKH",,,,1239936235201675264,https://twitter.com/mallon_khan/status/1239936235201675264
2020-03-17 15:26:46,Tidmarsh_in_ID,Tidmarsh_in_ID,3,0,3,"Having granddaughters doesn't magically grant you permission to touch girls, btw. I don't know what point you're trying to make but honestly it's pretty gross.",,,,1239936219808559104,https://twitter.com/Tidmarsh_in_ID/status/1239936219808559104
2020-03-17 15:26:25,SydneeWick,,0,0,1,"Is it shortness of breath, or anxiety? The duality of covid-19.",,,,1239936134186139651,https://twitter.com/SydneeWick/status/1239936134186139651
2020-03-17 15:26:04,SportsWorldInc,,0,0,0,"Students if you are struggling with anything our team at Sports World is here to help 24 hours a day 7 days a week via text chat! Simply text the word CHOICE to 494949 We care about you!!! #ineedhelp #mentalhealth #hope #depression #help #anxiety #yournotalonepic.twitter.com/Ui7a5MTqqC",,,#ineedhelp #mentalhealth #hope #depression #help #anxiety #yournotalonepic,1239936043404664838,https://twitter.com/SportsWorldInc/status/1239936043404664838
2020-03-17 15:26:03,biscuitsxgravy,,0,0,0,"Patience and understanding are crucial during this time. Try not to let panic or anxiety rule your world. You’ve faced many things in your life, this just happens to be another. Remain peaceful, loving, and sane during this time. This moment sucks. Not life itself. Just Breathe.",,,,1239936041273843715,https://twitter.com/biscuitsxgravy/status/1239936041273843715
2020-03-17 15:23:41,BorxDMercurial,,0,0,0,"There seems to be no middle ground with this epidemic. Either people are crowded cheek to jowl on the beaches in FL, or they are cowering in their basements wearing respirators and having anxiety attacks.",,,,1239935444416188417,https://twitter.com/BorxDMercurial/status/1239935444416188417
2020-03-17 15:23:37,flakyamandafae,,0,0,1,"Being in the house all day = anxiety and depression",,,,1239935426498093056,https://twitter.com/flakyamandafae/status/1239935426498093056
2020-03-17 15:22:47,Tidmarsh_in_ID,Tidmarsh_in_ID,0,0,2,"And since you brought up Trump, I doubt you'd have the same stance if these pictures were of him instead of Biden. Stop playing for a team and call out disgusting behavior whenever you see it.",,,,1239935217801949184,https://twitter.com/Tidmarsh_in_ID/status/1239935217801949184
2020-03-17 15:21:29,lukeslens,,0,0,5,"Today is my wife’s birthday. She’s the most amazing person I’ve ever met. She gives so much of herself to everybody. But, like many, her anxiety & ocd are flaring & making it hard to cope. So, if you’re able to send her a friendly word it would brighten @kebophoto’s day.",,@kebophoto,,1239934889530712067,https://twitter.com/lukeslens/status/1239934889530712067
2020-03-17 15:21:00,dlynnbergs,dlynnbergs,0,0,0,"There is a 21 year old, but hourly and in school. We have four retail shops in hotels, all of which have been moved to shortened hours and reduced staff. Nothing about this is remotely easy...and now there’s anxiety about both economic ramifications and any decision we make.",,,,1239934770827554816,https://twitter.com/dlynnbergs/status/1239934770827554816
2020-03-17 15:20:58,TheNotoriouskk,,0,0,4,"Also very blessed my job accepted my anxiety as an excuse to be absent for work.",,,,1239934762824994816,https://twitter.com/TheNotoriouskk/status/1239934762824994816
2020-03-17 15:20:15,BossRVA,,1,0,0,"Day 2 of social distancing... had to go see my psychiatrist today. They took care to ask how my mental health is doing in the midst of the extra stress of the pandemic. Keep in mind that anxiety will flare with the news. Depression will flare with isolation. Check on friends.",,,,1239934579873648641,https://twitter.com/BossRVA/status/1239934579873648641
2020-03-17 15:18:05,1965vmjw,tedlieu,1,0,0,"What a good time for those folks who own 3-D printers then to fabricate them... Truth is DoomsayerMilano is you throw yrself into EVERYTHING that helps you feel self important and relevant to ward off those anxiety attacks/depression due to yr non relevancy in Hollywood pic.twitter.com/lAGxe6lv7H",,,,1239934035281039361,https://twitter.com/1965vmjw/status/1239934035281039361
2020-03-17 15:18:05,careschroeder,,0,2,14,"I made a doctors appointment (unrelated to corona) and when I called the nurse was like ""are you running a fever, coughing, or having trouble breathing?"" and I'm like ""yes I'm having trouble breathing but I have anxiety so what's new""",,,,1239934034161041409,https://twitter.com/careschroeder/status/1239934034161041409
2020-03-17 15:15:59,Dallas_Albury,,0,0,0,"@leannrimes having severe trouble breathing as I’m stuck in Florida, praying it’s just the humidity combined w/ my asthma, but my Dr is calling in a breathing machine and medication to be safe. Could really use some prayers! Trying not to let my anxiety take over",,@leannrimes,,1239933507587264512,https://twitter.com/Dallas_Albury/status/1239933507587264512
2020-03-17 15:15:24,AnneWelchDayap,,0,0,0,"My Harry Potter might be channeling everyone's anxiety right now. #covid_19 @Home of Books and Pups https://www.instagram.com/p/B91uRNPACKP/?igshid=2ztrfbc6s9zd …",,@Home,#covid_19,1239933359645528066,https://twitter.com/AnneWelchDayap/status/1239933359645528066
2020-03-17 15:15:15,hell_cat_maggie,,0,0,0,"An activity that’s always worked for me when in paralyzed with anxiety is to sing songs from Sweeney Todd very dramatically. You can duet with yourself. Use your hands for theatric emphasis. Nobody to stop me from pretending to be a murderous barber in quarantine.",,,,1239933322249342981,https://twitter.com/hell_cat_maggie/status/1239933322249342981
2020-03-17 15:14:25,katdiggity,,0,0,0,"The 3 schools that I also work at are all closed now & obviously I’m very grateful to have some hours left.. it’s just such a strange, anxiety inducing time rn. I’m happy I get to be there for my kids tho",,,,1239933114119376897,https://twitter.com/katdiggity/status/1239933114119376897
2020-03-17 15:13:40,south_kyann,,0,0,5,"Say a prayer for the people who struggle with anxiety on a NORMAL day. We are not okay right now",,,,1239932922993479681,https://twitter.com/south_kyann/status/1239932922993479681
2020-03-17 15:13:10,0mgia,,1,0,0,"Joe and Jay Elec going back and forth on my TL is giving me anxiety pic.twitter.com/6XVaUcIgbI",,,,1239932795943825408,https://twitter.com/0mgia/status/1239932795943825408
2020-03-17 15:12:51,mike_the_bridge,,0,0,4,"S/o to everyone, myself included, who finally felt they had a grip on controlling their anxiety until now. The feeling of helplessness mixed with the feeling of failure to control something you felt you had control over is exhausting.",,,,1239932716642185219,https://twitter.com/mike_the_bridge/status/1239932716642185219
2020-03-17 15:11:53,READLakota,TheSharkDaymond,0,0,0,"So happy to see this! It’s important to note how structure can help combat anxiety. I’m running outdoors everyday, doing an online learning course, and baking/cooking new recipes. Cuddling with 3 dogs is added bonus!",,,,1239932476740558849,https://twitter.com/READLakota/status/1239932476740558849
2020-03-17 15:11:52,i_am_kt,SELColaisteB,0,0,2,"For anyone who deals with Anxiety about the coronavirus. https://twitter.com/SELColaisteB/status/1239091550195462144 …",,,,1239932472084791296,https://twitter.com/i_am_kt/status/1239932472084791296
2020-03-17 15:09:04,Chubalopagus,,0,0,7,"Dear anxiety, You’re a cunt. Sincerely, Hunter",,,,1239931766498103297,https://twitter.com/Chubalopagus/status/1239931766498103297
2020-03-17 15:08:05,DrRachaelF,,8,1,56,"Soooo...this is what anxiety is like: I have a tiny throat tickle, since last night. Some congestion. No fever, cough just to clear my throat. Symptoms that would say “cold” most winters. I’m working really hard not to think what my kids’ lives would be like without me.",,,,1239931519474388998,https://twitter.com/DrRachaelF/status/1239931519474388998
2020-03-17 15:06:57,NayaPhilosophy,,2,3,10,"Y'all expected HUMANS? Social creatures (despite y'alls lil anti-social anxiety posts)??? to be good at SOCIAL DISTANCING??? tuh.....",,,,1239931232458342400,https://twitter.com/NayaPhilosophy/status/1239931232458342400
2020-03-17 15:04:30,msjburch,,1,0,7,"Maybe I should just be an online teacher. My mood has been so much better and my skin looks great. Despite my weirdo rapture triggers and anxiety",,,,1239930615916527617,https://twitter.com/msjburch/status/1239930615916527617
2020-03-17 15:04:12,Thekidsarealri2,wavewentz,0,0,1,"He’s so freaking cute. I can’t feel anxiety when I look at him",,,,1239930540855181313,https://twitter.com/Thekidsarealri2/status/1239930540855181313
2020-03-17 15:02:08,rj_mccauley,,0,0,1,"We have gone exclusively online with our Magnolia Students services and sermons. Check out our first message on anxiety and COVID-19. Anthem of Hope Series - Anthem Over Anxiety https://youtu.be/O01BQOQS5QM #AnthemOfHope",,,#AnthemOfHope,1239930023261306880,https://twitter.com/rj_mccauley/status/1239930023261306880
2020-03-17 15:01:32,OTheGod_,,0,0,0,"Check out our New #VibeMastersMedia page. Providing practical systems to best deal with social anxiety and depreesion. https://youtu.be/ifwELXz77BQ",,,#VibeMastersMedia,1239929870714634241,https://twitter.com/OTheGod_/status/1239929870714634241
2020-03-17 15:01:20,mayorcantrell,,2,11,8,"During the #covid19 response if you find yourself experiencing worry and anxiety there is help. Text TALKWITHUS to 66746/ En Espanol Text HABLANOS to 66746 for 24/7 help. Remember to be kind and support one another. @nolaready @nolahealthdeptpic.twitter.com/Eh1LG98ork",,@nolaready @nolahealthdeptpic,#covid19,1239929820814942214,https://twitter.com/mayorcantrell/status/1239929820814942214
2020-03-17 15:01:05,KevontaeK,tyrahchampagne,0,0,1,"No cap!!! Separation anxiety, attachment, comfortability",,,,1239929757866876929,https://twitter.com/KevontaeK/status/1239929757866876929
2020-03-17 15:00:08,__trine_,,0,1,7,"My anxiety has been through the roof , maybe I should stop only drinking coffee all day",,,,1239929519978487808,https://twitter.com/__trine_/status/1239929519978487808
2020-03-17 14:59:43,WoodrowNepa,USMCSDI,0,0,0,"Some anxiety at a minimum.",,,,1239929411949953025,https://twitter.com/WoodrowNepa/status/1239929411949953025
2020-03-17 14:59:42,LikeImTommyLee,LikeImTommyLee,1,5,5,"Please share even if this does not apply to you. I see a lot of people struggling with Twitter increasing their anxiety and many do not realize Twitter offers this feature. https://twitter.com/LikeImTommyLee/status/1239813771788316674 …",,,,1239929410783870977,https://twitter.com/LikeImTommyLee/status/1239929410783870977
2020-03-17 14:58:45,manbearkitten,Caseyagil,0,0,1,"And only able to interact with people without anxiety online.",,,,1239929169749868545,https://twitter.com/manbearkitten/status/1239929169749868545
2020-03-17 14:57:49,AShooterShoots,,0,0,0,"ANXIETY GOT ME FEELING STUCK, ANXIETY GOT ME FEELING FUCKED",,,,1239928932809330688,https://twitter.com/AShooterShoots/status/1239928932809330688
2020-03-17 14:56:55,daggertrout,,0,0,2,"Canceled a job interview I was supposed to have tomorrow because of everything. First response I’ve gotten in months. My anxiety is spiking exponentially.",,,,1239928707239813121,https://twitter.com/daggertrout/status/1239928707239813121
2020-03-17 14:56:32,theregoesdejj,,1,3,10,"People with bad depressing and anxiety cannot function in the house bruh idc what y’all say , especially if we don’t have no medication .",,,,1239928613174226948,https://twitter.com/theregoesdejj/status/1239928613174226948
2020-03-17 14:56:05,ClaxtonPak,,0,0,0,"First day of alert in place. Already having much anxiety. Decided to start a Twitter diary for posterity. Was able to go hiking a couple weeks ago, past tranquility. pic.twitter.com/jnzFJtd1OJ",,,,1239928499084750849,https://twitter.com/ClaxtonPak/status/1239928499084750849
2020-03-17 14:55:25,blartish,,0,1,2,"Anxiety level: 4.6 trillion",,,,1239928331753213952,https://twitter.com/blartish/status/1239928331753213952
2020-03-17 14:54:18,Laelaps,,3,0,78,"I have depression and ptsd. Jet helps with that. Jet has separation anxiety. I help with that. pic.twitter.com/9O8inJip8q",,,,1239928048708775936,https://twitter.com/Laelaps/status/1239928048708775936
2020-03-17 14:52:57,MorrisAnimal,BitchestheCat,1,23,55,"Sweet senior kitty girl Swimmy is pretty freaked out, especially since the Refuge’s now closed to the public. She needs tips for dealing with anxiety AND a foster or forever home ASAP. Her adoption fee’s waived through 3/20. See how to help: https://www.morrisanimalrefuge.org/adopt/swimmy or please RT!pic.twitter.com/TldvTBXeSx – at Morris Animal Refuge",,,,1239927710589337601,https://twitter.com/MorrisAnimal/status/1239927710589337601
2020-03-17 14:52:18,AnaliciaMonique,,0,0,3,"Don’t forget to brush your teeth, wash your face, and eat! Times might seem scary but hopefully maintaining a routine can help ease some of your anxiety.",,,,1239927545862094850,https://twitter.com/AnaliciaMonique/status/1239927545862094850
