date,username,to,replies,retweets,favorites,text,geo,mentions,hashtags,id,permalink
2020-03-17 19:46:45,AbuChowdhury12,,0,0,0,"Coronavirus has taken over the whole world. Everything turned upside down in just a matter of week; so much confusion,chaos panic and anxiety among ppl. People fighting over daily necessaries. It’s a lot take in. But at the very moment of time we need to stay unite and fight it!",,,,1240001645561462784,https://twitter.com/AbuChowdhury12/status/1240001645561462784
2020-03-17 19:46:21,kawaiicaitlin,,2,0,9,"Having IBS and an anxiety disorder sucks during a toilet paper shortage",,,,1240001545527123968,https://twitter.com/kawaiicaitlin/status/1240001545527123968
2020-03-17 19:44:11,_cristinatudor,,0,0,0,"Art will not be canceled! As we are spending more time indoors and experiencing increased anxiety during these difficult times, I would like to bring more joy and peace into our daily lives with my artwork.… https://www.instagram.com/p/B92NB3qFz_E/?igshid=eau98893j5b9 …",,,,1240001001928744961,https://twitter.com/_cristinatudor/status/1240001001928744961
2020-03-17 19:43:51,still_l0ad1ng,,0,0,0,"Vitamin C, Zinc, Fish Oil, Multi-vit for my daily immunity. Double dosage of Melatonin for my nightly anxiety.",,,,1240000916650106880,https://twitter.com/still_l0ad1ng/status/1240000916650106880
2020-03-17 19:43:22,bad_stronger,Jozzzlyn1,0,0,4,"maybe try the student service center and get a clearance for disability services?? On anxiety? That way you get more time for ur work?? I’m sorry about your situation:((",,,,1240000793836687362,https://twitter.com/bad_stronger/status/1240000793836687362
2020-03-17 19:43:18,wolffeyess,,0,0,0,"I’m a nervous wreck. Like I’m a sober away from throwing up because I can’t shake this anxiety. And it didn’t help that when I ordered groceries online and I thought they took the money out but instead xfinity swooped in and took the money I’m not gonna survive",,,,1240000778657382401,https://twitter.com/wolffeyess/status/1240000778657382401
2020-03-17 19:42:34,jammyisLEGIT,,1,0,0,"Feeling sick to my stomach with anxiety.",,,,1240000596481982464,https://twitter.com/jammyisLEGIT/status/1240000596481982464
2020-03-17 19:41:09,ohKAYx33,,0,0,2,"I had a dream last night that I fell in love with a white male cop and if that doesn’t tell you my anxiety has been on overdrive idk what does.",,,,1240000236795432968,https://twitter.com/ohKAYx33/status/1240000236795432968
2020-03-17 19:40:51,normamilagroo,Dreamershuo,0,0,0,"why did this video give me anxiety https://twitter.com/Dreamershuo/status/1239803830088249345 …",,,,1240000162489159680,https://twitter.com/normamilagroo/status/1240000162489159680
2020-03-17 19:39:24,PacoDiBango,,0,0,0,"Swear being on twitter earlier gave me anxiety",,,,1239999796254871553,https://twitter.com/PacoDiBango/status/1239999796254871553
2020-03-17 19:39:18,ezzzmee,,0,0,1,"My fucking anxiety rn",,,,1239999771160588293,https://twitter.com/ezzzmee/status/1239999771160588293
2020-03-17 19:35:59,maria_pellyy,,1,0,4,"UPDATE!! “We will continue to stay open unless there is a federal order to close. To help with anxiety levels, it will be casual dress until further notice” well thank GOD because I heard wearing a business clothes makes you more susceptible to COVID",,,,1239998936229842947,https://twitter.com/maria_pellyy/status/1239998936229842947
2020-03-17 19:35:54,jocelyn_joyy,,0,0,2,"why is my anxiety so bad today :(",,,,1239998916541677569,https://twitter.com/jocelyn_joyy/status/1239998916541677569
2020-03-17 19:35:50,DesirreAndrews,,0,0,3,"Weights and elliptical beat the anxiety into submission...almost",,,,1239998899500150784,https://twitter.com/DesirreAndrews/status/1239998899500150784
2020-03-17 19:35:43,chassyyxo,,0,1,1,"can y’all just stay home and practice social distancing please this covid19 is getting out of hand and it’s really starting to trigger my health anxiety I have a lupus/ kidney disease. quit being selfish please! staying indoors for a little while isn’t going to hurt y’all",,,,1239998869829812225,https://twitter.com/chassyyxo/status/1239998869829812225
2020-03-17 19:35:23,jazzyjazzg,KatKillahKills,1,0,0,"I’m having major anxiety while working from home, does that count?",,,,1239998787944189953,https://twitter.com/jazzyjazzg/status/1239998787944189953
2020-03-17 19:31:56,jammyisLEGIT,,0,0,0,"Anxiety doesn’t seem to be getting any better over the last few days.",,,,1239997919823986694,https://twitter.com/jammyisLEGIT/status/1239997919823986694
2020-03-17 19:30:39,_hourglassmedia,,0,0,0,"Mental Health Moments: Handling Anxiety During the Coronavirus Pandemic https://www.hourglassomnimedia.com/behindthehourglassblog/mental-health-moments-handling-anxiety-during-the-coronavirus-pandemic …",,,,1239997595730264064,https://twitter.com/_hourglassmedia/status/1239997595730264064
2020-03-17 19:24:37,celester,,0,0,0,"I just have a normal supply of toilet paper. Now I’m starting to get anxiety.",,,,1239996076658221056,https://twitter.com/celester/status/1239996076658221056
2020-03-17 19:24:26,sunlightyoga,,0,0,0,"To help my community with stress management, anxiety relief, and healing: I’m re-airing my Cable TV shows on @cmcm_tv Marin TV , 3x each (9x in March!): “Yoga with Stacie: yoga for everyone!” show: ~Chair Yoga (2… https://www.instagram.com/p/B92KxGsHr-v/?igshid=yln1txub3qfd …",,@cmcm_tv,,1239996030269128711,https://twitter.com/sunlightyoga/status/1239996030269128711
2020-03-17 19:24:14,_denisetx,ThatDakari,0,0,0,"this is so pretty but my anxiety.. yea, no.. https://twitter.com/ThatDakari/status/1239702991252459521 …",,,,1239995979413311490,https://twitter.com/_denisetx/status/1239995979413311490
2020-03-17 19:23:28,paraph8,,1,0,3,"i have to set up work from home now and my anxiety has peaked",,,,1239995789876887555,https://twitter.com/paraph8/status/1239995789876887555
2020-03-17 19:23:24,TealeBurford,,1,0,7,"Day 2: I've decided that I will get dressed and put on minimal makeup each day in order to keep my routine. It's important for me to feel put together because it helps me keep depression at bay. Anxiety is combated by keeping busy, and I plan to continue teaching my courses...",,,,1239995773003104263,https://twitter.com/TealeBurford/status/1239995773003104263
2020-03-17 19:23:11,maaaaarrrrryyyy,virginia_tech,0,0,13,"The weird, off-balance side angle shot that they kept zoom-cutting to isn’t exactly helping my anxiety lmao https://twitter.com/virginia_tech/status/1239993337689538560 …",,,,1239995716606611457,https://twitter.com/maaaaarrrrryyyy/status/1239995716606611457
2020-03-17 19:22:19,YandaShabazz22,,0,0,0,"I’m overwhelmed and my anxiety is thru the roof rn",,,,1239995500138545152,https://twitter.com/YandaShabazz22/status/1239995500138545152
2020-03-17 19:22:19,paulatcr,,1,0,3,"Instead of CR meeting on campus tonight, join us on Facebook Live for an online alternative at 6:45. All are welcome. Topic of #stress & anxiety #fblex #CelebrateRecovery",,,#stress #fblex #CelebrateRecovery,1239995498431381504,https://twitter.com/paulatcr/status/1239995498431381504
2020-03-17 19:21:43,MoscoRose,tyler_casper,0,0,0,"I'm having anxiety...thank God for Effexor!!!",,,,1239995346769543168,https://twitter.com/MoscoRose/status/1239995346769543168
2020-03-17 19:20:16,nada4wisconsin,GovEvers,0,0,6,"Forever grateful for the strong leadership of @GovEvers . These past few days have been anxiety filled, as my mom is in a high risk group for #COVID19. But to know we have leadership we can trust with the health of our community keeps me sane.https://twitter.com/GovEvers/status/1239994614192304128 …",,@GovEvers,#COVID19,1239994980837490689,https://twitter.com/nada4wisconsin/status/1239994980837490689
2020-03-17 19:20:12,laiirr,sophdoeslife,2,0,4,"Wow so happy I’m not the only one. My #1 sign of anxiety is shortness of breath really been messing with my head https://twitter.com/sophdoeslife/status/1239558616820129800 …",,,#1,1239994966463647745,https://twitter.com/laiirr/status/1239994966463647745
2020-03-17 19:19:59,11kat_,,1,0,3,"im getting social anxiety bc imma go workout at a gym that ive never been to before",,,,1239994911593648128,https://twitter.com/11kat_/status/1239994911593648128
2020-03-17 19:18:37,ThatLaserGame,trim_often,0,0,1,"I get that feeling too. But half of me thinks it’s just my anxiety talking. It’s actually already bad imo but hopefully things will take a positive turn",,,,1239994566255747073,https://twitter.com/ThatLaserGame/status/1239994566255747073
2020-03-17 19:18:32,aboyandhismom1,,0,0,1,"If you’re feeling a little prickly these days, it’s ok, I think we’re all on edge a bit these days. All the uncertainty and anxiety is to be expected as no one has ever been through this before. Try to avoid all the… https://www.instagram.com/p/B92KF8ZAffz/?igshid=1rxhz8qx6ense …",,,,1239994546563551233,https://twitter.com/aboyandhismom1/status/1239994546563551233
2020-03-17 19:16:35,Praeditos_ish,,1,0,0,"We all want to stay home or work from home as we should, but let’s not forget a large group of people who uses going to work, their business, or anything else that’s cancelled to cope with their Mental Health. Whether it’s anxiety, depression, PTSD, this time of isolation........",,,,1239994056446480391,https://twitter.com/Praeditos_ish/status/1239994056446480391
2020-03-17 19:16:12,ericthulhu,HorrorDeaths,2,1,15,"This scene singlehandedly caused my driving anxiety https://twitter.com/HorrorDeaths/status/1239555797283147781 …",,,,1239993959193235458,https://twitter.com/ericthulhu/status/1239993959193235458
2020-03-17 19:15:33,JimsBT510,,0,0,0,"@realDonaldTrump passing out $1000 and spending $870b will have no economic boast as long as people are quarrenteened and not out spending and back at work earning, suspending credit card, mortgage, utility, medicare, insurance payments 90 days will eliminate fear and anxiety!",,@realDonaldTrump,,1239993795862642688,https://twitter.com/JimsBT510/status/1239993795862642688
2020-03-17 19:15:06,madisonegarcia,,0,0,1,"Social media has given me the most anxiety I’ve had in a long time over the coronavirus",,,,1239993684399206400,https://twitter.com/madisonegarcia/status/1239993684399206400
2020-03-17 19:15:02,ChrunicDubs,,0,0,2,"I’m so glad I got off my antidepressant and anxiety medication last summer..... I am so fearful for the people who are going to run out of their supply of mental health meds before the quarantine ends..... I can’t even imagine the fear of losing your mind!! Stay stong one love",,,,1239993667172982785,https://twitter.com/ChrunicDubs/status/1239993667172982785
2020-03-17 19:14:24,ItTowels,,0,0,1,"Looking for a creative outlet for you & your kiddos during this #quarantine? Visit our site for details on our sunnier days ahead design contest. Proceeds from winning designs benefit @Got_Anxiety. #Covid_19 #StayHome #CoronavirusOutbreak #bethegood #stayhomechallengepic.twitter.com/rJdddIy5wE",,@Got_Anxiety,#quarantine #Covid_19 #StayHome #CoronavirusOutbreak #bethegood #stayhomechallengepic,1239993505583222784,https://twitter.com/ItTowels/status/1239993505583222784
2020-03-17 19:12:25,doodleattack,,1,0,2,"Bright side of quarantines: China's pollution is at an all time low. Ultimately the pandemic will be good for the planet and help slow global warming. Thank you for reading my anxiety-induced tweet.",,,,1239993006712926213,https://twitter.com/doodleattack/status/1239993006712926213
2020-03-17 19:09:38,CiaranGBoyle,,0,0,0,"@AerLingus wanted to give you some positive feedback, staff and everyone involved with flight EI 121 from Dublin to Orlando yesterday was on point with professionalism and positivity despite their obvious anxiety with the world's developments",,@AerLingus,,1239992305265803264,https://twitter.com/CiaranGBoyle/status/1239992305265803264
2020-03-17 19:09:23,shadieeerose,,0,0,1,"Literally the only time my anxiety disorder comes in clutch, when pandemics and national emergencies happen I’m so chill bc I’ve adapted to acting calm in times of personal panic",,,,1239992242078531585,https://twitter.com/shadieeerose/status/1239992242078531585
2020-03-17 19:09:03,Myennnn,,1,1,1,"ik her ass is asleep rn BUT THE SEPARATION ANXIETY IS MF REAL I MISS MY WHORE/ OTHER HALF/ CORONA JAN/ ALL DAT @sonya_mohseni",,@sonya_mohseni,,1239992160872587264,https://twitter.com/Myennnn/status/1239992160872587264
2020-03-17 19:08:43,TJMattf,Hannasuewilson,0,0,0,"Praying for your Fear and Anxiety",,,,1239992076831469568,https://twitter.com/TJMattf/status/1239992076831469568
2020-03-17 19:08:05,Winnkk182,,1,0,9,"Manager: you alright? You seem not yourself. Me: oh I’m fine the pharmacy hasn’t refilled my anxiety medicine in over a week so I’m just disassociating heavily & overthinking about how nothing even matters anymore :) Manager: you’re taking an early lunch today.",,,,1239991915992485893,https://twitter.com/Winnkk182/status/1239991915992485893
2020-03-17 19:07:30,alcareyyy,,0,0,14,"why’s my anxiety calm during all of this, you ask??? UH bc i literally don’t have to leave the house for weeks. that’s our dream come true",,,,1239991770127175683,https://twitter.com/alcareyyy/status/1239991770127175683
2020-03-17 19:07:29,cyril_white,,0,0,0,"HAPPY ST PATRICKS DAY!! THANK YOU FOR ALL YOUR SUPPORT!! WE ARE NOT JUST A GYM!! Do you want to win your day everyday? If you want to overcome anxiety, lose weight and tone up with our proven solution contact us at… https://www.instagram.com/p/B92InUYBWv2/?igshid=1e6rpdr8pa1cv …",,,,1239991764527783936,https://twitter.com/cyril_white/status/1239991764527783936
2020-03-17 19:04:39,PGeorgeMD,,0,4,10,"Hey #medtwitter friends, my favorite mindfulness app Ten Percent Happier is offering free 6 months subscriptions for healthcare workers. Maybe a little bit to help during these anxiety-provoking times. Email care@tenpercent.com for instructions Thank you, @10percent",,@tenpercent @10percent,#medtwitter,1239991053983166464,https://twitter.com/PGeorgeMD/status/1239991053983166464
2020-03-17 19:04:39,CoachYosie,,0,0,0,"Chocolate kind of day As someone who suffers from anxiety these times could be scary. Here is what I’m doing that may help you too: . 1-Staying informed but not staying stuck to the news, once a day to stay… https://www.instagram.com/p/B92IgMljDSo/?igshid=1swc2x7dahwes …",,,,1239991053945430016,https://twitter.com/CoachYosie/status/1239991053945430016
2020-03-17 19:04:39,Love94Up,JeffreeStar,0,0,0,"I'm freaking out a little over this epidemic but I have really bad Anxiety and idk I just cant calm down",,,,1239991052712448000,https://twitter.com/Love94Up/status/1239991052712448000
2020-03-17 19:03:48,Deeshmurdaa,,0,2,17,"I am facing my daily demon with this isolation because I HATE feeling unproductive. It springs up anxiety, jitters, and my ADHD is bouncin off the walls. This is a challenge to find stillness but I’m trying.",,,,1239990839390031872,https://twitter.com/Deeshmurdaa/status/1239990839390031872
2020-03-17 19:02:12,StephanieMintz1,,0,0,0,"What can you do to help? Ask people how they are doing. Allow people to talk about their anxiety. Allow people to vent. Don’t panic. Reassure people that it will be okay. Offer to help. Share what you have. Do what is within your control.",,,,1239990434887319553,https://twitter.com/StephanieMintz1/status/1239990434887319553
2020-03-17 19:00:07,JimsBT510,,0,2,3,"Best way to get relief to working class is suspend credit card, utility and mortgage payments for 3 months, eliminate interest, penalties during that time, remove fear and anxiety as people worry about their family and health @realDonaldTrump @marklevinshow @MsAvaArmstrong",,@realDonaldTrump @marklevinshow @MsAvaArmstrong,,1239989911001780224,https://twitter.com/JimsBT510/status/1239989911001780224
2020-03-17 18:56:35,ImThatNee,,0,0,0,"My mom is literally so anxious/has an anxious attachment style I cannotttttttt!!!!!! She’s sends me at least once a month! This chronic anxiety shit is INSANE",,,,1239989023751516160,https://twitter.com/ImThatNee/status/1239989023751516160
2020-03-17 18:56:26,ajv_97,,1,3,3,"If you’re stressed out and have anxiety from all this corona shit hit my DM’s I got you! I have CBD flower too for the smokers pic.twitter.com/DkL5CNOvLL",,,,1239988983226081281,https://twitter.com/ajv_97/status/1239988983226081281
2020-03-17 18:55:32,shaughnessy_jr,Hayley_Harmon,0,0,1,"Did not succumb to MSM therefore no anxiety. #HeadInSand",,,#HeadInSand,1239988757861990401,https://twitter.com/shaughnessy_jr/status/1239988757861990401
2020-03-17 18:52:44,Ashleagh5,,0,0,2,"For anyone who has depression/ anxiety/ mental illnesses like me when not being constantly busy, remember that the weather outside is turning to spring, and with that sun! If you can, go outside your door or crack a window for a breath of fresh warm air #COVID19 #mentalhealth",,,#COVID19 #mentalhealth,1239988055110569984,https://twitter.com/Ashleagh5/status/1239988055110569984
2020-03-17 18:49:41,yessyblue27,TroIISports,0,0,4,"Idk why but this is giving me anxiety https://twitter.com/TroIISports/status/1239598780577529857 …",,,,1239987286894243840,https://twitter.com/yessyblue27/status/1239987286894243840
2020-03-17 18:47:45,kakelly65,ProudOhioNative,0,0,0,"It’s nice to read a tweet with some humor. Stay positive and keep praying. Don’t let the media or social media cause you anxiety! Take care of you... mind, body, soul, and spirit!",,,,1239986801562906624,https://twitter.com/kakelly65/status/1239986801562906624
2020-03-17 18:46:28,adair1946,tonyschwartz,0,0,0,"E: intense anxiety.",,,,1239986478169485312,https://twitter.com/adair1946/status/1239986478169485312
2020-03-17 18:43:57,indi_srs,netw3rk,0,0,0,"I am too and have a pretty dry cough any time I have allergies. Which is now it’s pretty awful on my anxiety",,,,1239985843604987910,https://twitter.com/indi_srs/status/1239985843604987910
2020-03-17 18:42:31,messwithamic,,0,0,1,"Not Edden serenading my anxiety attack with a song he made up on the spot",,,,1239985483041492992,https://twitter.com/messwithamic/status/1239985483041492992
2020-03-17 18:41:42,sxmmy_leee,,0,0,5,"These quarantine tweets are shedding light on a stressful situation lol. Deleted all my other social media because that shit was causing anxiety but Twitter has me ugly laughing at my desk.",,,,1239985278435155971,https://twitter.com/sxmmy_leee/status/1239985278435155971
2020-03-17 18:41:16,felicia_nicole,,0,0,1,"who’s to say I won’t contract germs and take them home to my grandma during Easter? I get needing to be there for the community but this is above my pay grade. And my anxiety about it just gets worse every day cause like also, bills..so I can’t just stay home..",,,,1239985166052995072,https://twitter.com/felicia_nicole/status/1239985166052995072
2020-03-17 18:41:01,FarahlovesMark,,0,0,1,"@NYGovCuomo in anxiety ridden times like this,my governor Andrew Cuomo is serving as the epitome of reason,reality and hope in one remarkable person. #GovCuomo",,@NYGovCuomo,#GovCuomo,1239985106057601035,https://twitter.com/FarahlovesMark/status/1239985106057601035
2020-03-17 18:40:28,Bananadogs3,bubbagump324,0,1,1,"I was much better off before I was educated, before I became a news junkie, aware of the world, our global society, politics, human suffering. But it wasn’t overnight... Now all I do is worry. Insomnia and anxiety are my constant companions. And then Coronavirus...",,,,1239984965443629057,https://twitter.com/Bananadogs3/status/1239984965443629057
2020-03-17 18:39:10,CurtKeyz,,1,0,0,"This was the first time he’d ever said that. So I wa - was taken aback because last year when my stuff (keyboard’s, live show gear, etc) was stolen and told him I had been experiencing anxiety like never before - he scoffed at the notion.",,,,1239984638082285568,https://twitter.com/CurtKeyz/status/1239984638082285568
2020-03-17 18:39:09,CurtKeyz,,1,0,0,"One of my homies called me and said writing a paper for his master’s application was giving him anxiety.",,,,1239984633380511746,https://twitter.com/CurtKeyz/status/1239984633380511746
2020-03-17 18:37:50,nickwarnersbr,,0,0,4,"Never thought I’d see the day when social anxiety came in clutch",,,,1239984305859952648,https://twitter.com/nickwarnersbr/status/1239984305859952648
2020-03-17 18:37:29,tajmccoywrites,,8,2,39,"The acts of cooking and baking soothe me when anxieties run high. Have cheese? Make magic. Grilled brie, honeycrisp apple, prosciutto sandwich with raw honey on fresh sourdough. #CookinWithTajpic.twitter.com/pmaAaJaXpj",,,#CookinWithTajpic,1239984216093294594,https://twitter.com/tajmccoywrites/status/1239984216093294594
2020-03-17 18:34:17,YorkMccrea,,2,0,0,"Our family doctor was due to give our 2 month old her vaccinations on the 19th (2 days from now). I had anxiety about it due to #COVID19 #Covidtoronto and our previous bad luck having our two yr old be gruesomely treated for the wrong leukaemia, so I asked a few questions...",,,#COVID19 #Covidtoronto,1239983411634331649,https://twitter.com/YorkMccrea/status/1239983411634331649
2020-03-17 18:33:52,DaniMcSmith,lindsiecanton,1,0,1,"Made a big pot of anxiety cream of broccoli soup over here today!",,,,1239983307313631238,https://twitter.com/DaniMcSmith/status/1239983307313631238
2020-03-17 18:33:41,JrodELCANTANTE,,1,0,1,"Why people imposing their anxiety on you? It is what is is. We staying home. Get you a bag of Doritos and watch a movie.",,,,1239983260152799234,https://twitter.com/JrodELCANTANTE/status/1239983260152799234
2020-03-17 18:33:24,myaathedon,JosiahHyacinth,0,0,0,"This giving me anxiety https://twitter.com/JosiahHyacinth/status/1239860192403247105 …",,,,1239983189969506305,https://twitter.com/myaathedon/status/1239983189969506305
2020-03-17 18:32:30,SupervisorAlejo,,7,17,41,"BREAKING! Monterey County Supervisors UNANIMOUSLY approve a moratorium on evictions based on a “failure to pay rent” due to impacts of the #Coronavirus! We want to alleviate stress &amp; anxiety that our families may face during these challenging times #MontereyCountyLeadspic.twitter.com/uWHnm0kjCb",,,#Coronavirus #MontereyCountyLeadspic,1239982960130117634,https://twitter.com/SupervisorAlejo/status/1239982960130117634
2020-03-17 18:32:07,blairybearrr,,0,0,0,"Day 5 of social distancing/isolating and I have online purchased a facial steamer, 3 face masks, and 2 new face cleansers. Clearly I have a specific way of dealing with anxiety/stress.",,,,1239982865959374848,https://twitter.com/blairybearrr/status/1239982865959374848
2020-03-17 18:31:07,TFSill,,0,0,0,"#wfhlife Shout to to everyone doing their best to stay safe during this wild ride. My advice, make a routine, take breaks, get fresh air, virtually connect w your people, and #washyourhands Yesterday my anxiety… https://www.instagram.com/p/B92EqiJDiHQ/?igshid=12jyjj7hu6off …",,,#wfhlife #washyourhands,1239982611872784387,https://twitter.com/TFSill/status/1239982611872784387
2020-03-17 18:30:27,HeyJenocide,,0,0,2,"You really want to know why people are buying toilet paper in bulk? Because anxiety makes people shit.",,,,1239982443874172930,https://twitter.com/HeyJenocide/status/1239982443874172930
2020-03-17 18:29:10,TrimBodyMD,,0,0,0,"Feeling run down? Fatigue got the best of you? Or the chaos now is giving you anxiety? Then our Myers Cocktails is for you. Strengthen your immune system with Myers' Cocktail IV therapy. Through infusion, vitamins… https://www.instagram.com/p/B9192GpFOjZ/?igshid=1aic04smukp4e …",,,,1239982123777503239,https://twitter.com/TrimBodyMD/status/1239982123777503239
2020-03-17 18:28:33,amb396,,0,0,2,"Does rationing improve efficiency and welfare? Do individuals create ‘internalities’ on themselves due to anxiety or are they just risk-averse? A few things to think about.... pic.twitter.com/l0s1UUza0L – at Gelson's Market",,,,1239981966369251328,https://twitter.com/amb396/status/1239981966369251328
2020-03-17 18:27:49,xFashion_Killa,,0,1,3,"this virus is really making my anxiety go insane. i’m bout to kill myself cause wtffffff",,,,1239981781316747264,https://twitter.com/xFashion_Killa/status/1239981781316747264
2020-03-17 18:27:47,kaylakibodeaux,,1,0,2,"is it bad that the only “childhood home” I ever had gives me anxiety?",,,,1239981773423030274,https://twitter.com/kaylakibodeaux/status/1239981773423030274
2020-03-17 18:26:43,leah5324,,0,0,0,"Happy St Paddy’s Day. Great time to buy and try. Use my link for an extra 5% discount. http://CbdBioCare.com/leahmcnamara #cbd #QuarantineLife #anxiety pic.twitter.com/TwJ9zIgTUZ",,,#cbd #QuarantineLife #anxiety,1239981505167921153,https://twitter.com/leah5324/status/1239981505167921153
2020-03-17 18:25:04,AnnieLeTho,,0,0,0,"heyyyy @my body, this whole 1+ anxiety attacks really isn’t going to work out if you keep it up for the next month or so",,@my,,1239981092951687168,https://twitter.com/AnnieLeTho/status/1239981092951687168
2020-03-17 18:23:48,jesusbighead,,0,0,5,"For us people with anxiety Who tryna make a groupchat? ! SERIOUS INQUIRYS !",,,,1239980774369173510,https://twitter.com/jesusbighead/status/1239980774369173510
2020-03-17 18:23:39,ravennlindseyy,juslatrice,1,1,0,"I’m not gonna lecture you about isolating yourself , but I do hope you find a safe space to express yourself — isolated or with others . I want you to feel your very best and I know juggling anxiety & depression is a very hard balance to strike . Love you",,,,1239980733525041154,https://twitter.com/ravennlindseyy/status/1239980733525041154
