date,username,to,replies,retweets,favorites,text,geo,mentions,hashtags,id,permalink
2020-03-20 19:48:55,NataliaMoczy,,0,0,1,"ope & my anxieties back it was a good 4 days.",,,,1241089355722174466,https://twitter.com/NataliaMoczy/status/1241089355722174466
2020-03-20 19:48:20,evajannotta,,0,0,0,"Eeeeep THIS WAS GREAT! It’s very, very difficult to choose between #ADukeByDefault and this one as my favorite in the #ReluctantRoyals so far. In particular, protagonist Johan’s overwhelming anxiety about being left… https://www.instagram.com/p/B9974ugBd05/?igshid=1wtz0yc8990qw …",,,#ADukeByDefault #ReluctantRoyals,1241089208552480769,https://twitter.com/evajannotta/status/1241089208552480769
2020-03-20 19:47:52,alliod5,,0,0,7,"Are you ever chillen and your anxiety goes “DID U PAY RENT THIS MONTH????”",,,,1241089090939793408,https://twitter.com/alliod5/status/1241089090939793408
2020-03-20 19:47:26,ladybaguettee,,1,1,23,"PSA- Stay active everyone! I know we’re all quarantining ourselves but don’t forget to physically stay active. Isolation is hard and a great way to combat that anxiety and stress is to work out! Parks are still open and people are encouraged to hike etc. Stay moving!!",,,,1241088982307356674,https://twitter.com/ladybaguettee/status/1241088982307356674
2020-03-20 19:46:40,CareyLohrenz,,0,1,6,"We are in the trenches of sheer unpredictability, which means different levels of fear & anxiety among your team. So, what should be your priority as a fearless leader? I shared 3 tips for leading teams thru adversity @TrainingIndustr #FearlessLeadershiphttp://tinyurl.com/vpn2ds4",,@TrainingIndustr,#FearlessLeadershiphttp,1241088790409682957,https://twitter.com/CareyLohrenz/status/1241088790409682957
2020-03-20 19:46:26,itsbarbielx,,0,1,4,"My anxiety has always been pretty bad but today it came out of NO WHERE. Nothing is wrong. Literally nothing but this anxiety attack I had made me feel like I was about to die.",,,,1241088731047776260,https://twitter.com/itsbarbielx/status/1241088731047776260
2020-03-20 19:45:08,HeidiCondon,HeidiCondon,0,0,0,"No offense taken. However if Trump wanted to ease the anxieties I don't think dressing down the reporter was the way to do it. He should have either passed the question off to one of the experts or answered the question.",,,,1241088402725969920,https://twitter.com/HeidiCondon/status/1241088402725969920
2020-03-20 19:45:06,drewwarner,,0,0,0,"While dogs can’t speak openly about it or share with the people they love, they feel the anxiety that many of us are experiencing. Just because the world is stopping, doesn’t mean your dog doesn’t need you to be… https://www.instagram.com/p/B997hPxAX3h/?igshid=19p20941q4pgn …",,,,1241088396988203008,https://twitter.com/drewwarner/status/1241088396988203008
2020-03-20 19:44:52,DeniseTamez,,1,3,17,"Mateo making a glitter bottle to help with anxiety. Shake it up and take deep breaths while the glitter settles! #Homeschooling2020 #WhenYourMomIsACounselor pic.twitter.com/saUmG9ySvb",,,#Homeschooling2020 #WhenYourMomIsACounselor,1241088338154737667,https://twitter.com/DeniseTamez/status/1241088338154737667
2020-03-20 19:44:38,KatelynRST,notjulen,0,0,0,"Not great lol. Anxiety and boredom getting to me",,,,1241088277123231745,https://twitter.com/KatelynRST/status/1241088277123231745
2020-03-20 19:44:36,cleardawn88,LiberalCEO,0,0,4,"Actually, my dog senses my anxiety! So, attempting to keep him calm by playing with him and walking him more!!!",,,,1241088271230185472,https://twitter.com/cleardawn88/status/1241088271230185472
2020-03-20 19:43:54,pembelizabeth,,0,0,0,"New anxiety meds making me suuuper sleeepy and not really less anxious and kinda out of it and my back hurts :((",,,,1241088095342264320,https://twitter.com/pembelizabeth/status/1241088095342264320
2020-03-20 19:43:43,noble_touch,,0,0,0,"Community Healing clinics will be popping up at various times during the week! _____ There will be two areas of focus. 1) To reduce your fear, stress and anxiety that is feeding the virus and making it… https://www.instagram.com/p/B997W6kBVDc/?igshid=xmzfrtmk220a …",,,,1241088046658977797,https://twitter.com/noble_touch/status/1241088046658977797
2020-03-20 19:43:39,AndrewDikens,,0,0,0,"PSA: Check on your friends with anxiety during these #Covid_19 times... We are not okay.",,,#Covid_19,1241088030108254209,https://twitter.com/AndrewDikens/status/1241088030108254209
2020-03-20 19:42:27,Austin1Petersen,,0,0,1,"So now Koko and I are at the vet because her separation anxiety is insane",,,,1241087729720602626,https://twitter.com/Austin1Petersen/status/1241087729720602626
2020-03-20 19:41:40,YaBoiFurion,,0,0,0,"Why is work a thing why can’t I go home and play ANXIETY RELIEF NEW HORIZONS",,,,1241087532064026631,https://twitter.com/YaBoiFurion/status/1241087532064026631
2020-03-20 19:40:24,rachbaness,,1,0,2,"When you’re not sure if your shortness of breath is from anxiety or corona virus... and that’s giving you even more anxiety... ha ha help ha ha I’m dying ha ha",,,,1241087212701118464,https://twitter.com/rachbaness/status/1241087212701118464
2020-03-20 19:39:59,JerzeyNelz,,0,0,0,"My anxiety is crazy rn",,,,1241087108124721163,https://twitter.com/JerzeyNelz/status/1241087108124721163
2020-03-20 19:39:44,Austin1Petersen,guskenworthy,1,0,2,"I’m at @Banfield pet hospital right now with my dog because she’s already got anxiety and throwing up. She’s waiting for her meds now pic.twitter.com/521ryc1W8O",,@Banfield,,1241087043230367749,https://twitter.com/Austin1Petersen/status/1241087043230367749
2020-03-20 19:39:00,vanvleets,,0,0,1,"The inconsistent info from every level of everything is only fueling the confusion and anxiety. The State of Virginia reports zero cases in Albemarle yet NBC29 reports that there are three (from the TJHD). pic.twitter.com/1LtNAmcpEo",,,,1241086860413358080,https://twitter.com/vanvleets/status/1241086860413358080
2020-03-20 19:38:22,gay_vasco,themitchcase,0,0,5,"Dude this is me. Anxiety one hour, then thinking about traveling in the next https://twitter.com/themitchcase/status/1241053972313538563 …",,,,1241086702824722432,https://twitter.com/gay_vasco/status/1241086702824722432
2020-03-20 19:36:46,NatNelsonLopez,,0,0,0,"Nova keeps covering her face with the blanket and it’s giving me anxiety but I can’t move it or she’ll wake up",,,,1241086298326216704,https://twitter.com/NatNelsonLopez/status/1241086298326216704
2020-03-20 19:35:48,oxmene,,0,0,2,"Okay but having an anxiety attack while dreaming ain’t it. Didn’t even think that was possible.",,,,1241086056054706177,https://twitter.com/oxmene/status/1241086056054706177
2020-03-20 19:34:10,brisixnine,cruzabel_,0,0,0,"OK ok that but I want ALL of them deleted it gives me anxiety Ik anyone who looks at my dms gets traumatized",,,,1241085644375339008,https://twitter.com/brisixnine/status/1241085644375339008
2020-03-20 19:33:22,4lifeagator,PresidentFuchs,0,0,0,"Meghan and President Fuchs, No words can easy the pain, stress, or anxiety at this time. Gator Nation feels the pain, stress and anxiety to for students, Athletes, Graduates, Staff and Administration. Prayers for health, ease of stress, and getting back to normal. Greater Good! https://twitter.com/PresidentFuchs/status/1240989412307025925 …",,,,1241085441799008257,https://twitter.com/4lifeagator/status/1241085441799008257
2020-03-20 19:33:21,dfwcitizen,,0,1,2,"Gotta be honest as a long term fan of @DRUDGE, this platform has turned into @PageSix or @Enquirer. The #clickbait headlines and bat-sh** crazy headlines fuels anxiety. Irresponsible at best. Shame on you Matt. #fakenews #drudgereport #rumors",,@DRUDGE @PageSix @Enquirer,#clickbait #fakenews #drudgereport #rumors,1241085440498769920,https://twitter.com/dfwcitizen/status/1241085440498769920
2020-03-20 19:33:21,renae_evelece,JohnsonHildy,0,1,0,"On behalf of the part of Gen Z that has SENSE we and our stress induced anxiety are in our homes WITH OUR PETS, or with our parents. It’s the Ignorant Gen Z you want. https://twitter.com/JohnsonHildy/status/1240486720929439744 …",,,,1241085439727013888,https://twitter.com/renae_evelece/status/1241085439727013888
2020-03-20 19:32:55,kazuhikaru_,,0,0,1,"me and tony are laying down with my dog and he says ""rocket anxiety level is 1000 rn"" lmaooo",,,,1241085330461208576,https://twitter.com/kazuhikaru_/status/1241085330461208576
2020-03-20 19:32:27,ljudnic,oliverdarcy,0,0,0,"What a sad, sad person Trump is. Don’t watch him if you have any anxiety and concerns. He still lies. He’s still #NotFitToBePresident #coronavirushttps://twitter.com/oliverdarcy/status/1241041500936568838 …",,,#NotFitToBePresident #coronavirushttps,1241085212722974720,https://twitter.com/ljudnic/status/1241085212722974720
2020-03-20 19:31:32,totally_lexi,,0,0,2,"Am I the only one scared for online classes being MANDATORY? Anxiety is building up real quick...",,,,1241084982816169984,https://twitter.com/totally_lexi/status/1241084982816169984
2020-03-20 19:29:14,LauraAdams73,,0,1,1,"Okay, I decided to go all the way and get more access to the thetappingsolution app. If you have anxiety I HIGHLY recommend tapping. It is literally mind blowing how tapping has help me in just the short amount of… https://www.instagram.com/p/B995s6CJjUR/?igshid=1smkr80fv9tlq …",,,,1241084403780124680,https://twitter.com/LauraAdams73/status/1241084403780124680
2020-03-20 19:26:43,A_dumbdumb,izzzzx_,0,0,0,"I dont get anxiety just annoyed and aggravated lol",,,,1241083767604666368,https://twitter.com/A_dumbdumb/status/1241083767604666368
2020-03-20 19:25:22,Mamakind420,,2,0,13,"“Your mind is a powerful tool to help fight anxiety.” Um... isn’t your mind is the powerful tool that created the anxiety in the first place?",,,,1241083429153730560,https://twitter.com/Mamakind420/status/1241083429153730560
2020-03-20 19:24:30,vingrao,,2,0,21,"If another g*g* song leaks will one of u gays plz let me know because this bird app doesn’t help my anxiety levels so I am not logging on as much and will be spending time on my island in animal crossing. posting my friend code in bio. add me then come visit and say hi",,,,1241083212241104899,https://twitter.com/vingrao/status/1241083212241104899
2020-03-20 19:21:07,LyonelNicholas,,0,0,1,"idk if it’s just me, but my anxiety has been on 1000000000000000",,,,1241082360273276929,https://twitter.com/LyonelNicholas/status/1241082360273276929
2020-03-20 19:21:00,AnnieTangent,,3,0,12,"Slept in till 1pm. My Fitbit says I slept 12 hours, 26 min. Getting myself sick & waking myself up in the middle of the night through anxiety proved to be unsustainable. Be well, y'all, and figure out what matters. As @joelfrominwood says, ""what'll it matter a week from now?""",,@joelfrominwood,,1241082329071837194,https://twitter.com/AnnieTangent/status/1241082329071837194
2020-03-20 19:20:53,ELIHUMBLEPOET_,,1,0,0,"I’m standing in line at dollar tree and it’s a longgggg line. And my anxiety is so high right now.",,,,1241082302496636929,https://twitter.com/ELIHUMBLEPOET_/status/1241082302496636929
2020-03-20 19:20:52,AJ_Alvarado,,0,0,8,"Having to play therapist the last few days . Reach out to those dealing with trauma and anxiety . Even if it means just listening .",,,,1241082296976855040,https://twitter.com/AJ_Alvarado/status/1241082296976855040
2020-03-20 19:20:17,dawn_bristow,joselouis4077,4,3,6,"Omg- I feel your pain. My mom died last March. My depression has been terrible. Also anxiety. I can only be on Twitter for a while at a time these days. It's nice to have some peeps to meet up with here that make you laugh or share something other than our current mess...",,,,1241082149853204481,https://twitter.com/dawn_bristow/status/1241082149853204481
2020-03-20 19:18:16,local_dude69,,0,0,1,"they say don’t pay rent and hold out but my anxiety level will go through the roof if I don’t tbh. What is normal now?",,,,1241081642392879104,https://twitter.com/local_dude69/status/1241081642392879104
2020-03-20 19:17:59,ndeajanae,,0,0,0,"I keep reading the news and it’s giving me anxiety but I’m anxious when I haven’t read it. I’m in prison.",,,,1241081570313809923,https://twitter.com/ndeajanae/status/1241081570313809923
2020-03-20 19:14:16,trutheresme,jodidanziger,0,0,0,"people and their anxiety",,,,1241080634614915074,https://twitter.com/trutheresme/status/1241080634614915074
2020-03-20 19:11:00,Travel_MSW,,3,1,12,"The anxiety r/t not knowing what the next hour will bring feels like a slow death.",,,,1241079814892773378,https://twitter.com/Travel_MSW/status/1241079814892773378
2020-03-20 19:08:33,BarbCardell,,2,0,2,"On a really fabulous webinar with @thereunionproject. Feeling my anxiety bleed away...I am happy to listen to @DMalebranche and David Fawcett all damned day Community leads and provides",,@thereunionproject @DMalebranche,,1241079197994373122,https://twitter.com/BarbCardell/status/1241079197994373122
2020-03-20 19:07:53,mjbeers1,GovMikeDeWine,0,0,9,"Thank you, @GovMikeDeWine. Fear can bring out the worst in people. We cannot let ourselves be ruled by fear. Choose to be kind & think of others. Stay home, check on neighbors, think outside yourself. It will amaze you how much that helps your own anxiety. https://twitter.com/GovMikeDeWine/status/1241073398727487488 …",,@GovMikeDeWine,,1241079027756130305,https://twitter.com/mjbeers1/status/1241079027756130305
2020-03-20 19:07:40,carameldevil98,,0,0,0,"Please #read and #share ... THANK YOU! — The following piece by @shadesmagazine1 Publisher @talk2mfc is the first in a series of #mentalhealth #stories and #resources ##NewsYouCanUse #selfcare #anxiety #covid_19http://bit.ly/shadesmh1",,@shadesmagazine1 @talk2mfc,#read #share #mentalhealth #stories #resources # #NewsYouCanUse #selfcare #anxiety #covid_19http,1241078975637553157,https://twitter.com/carameldevil98/status/1241078975637553157
2020-03-20 19:07:22,IMterriblyvexed,,0,0,0,"Though today is a much better anxiety day so far I stress chewed my lip so much yesterday that I have a fat lip today. Ouch!",,,,1241078898185527296,https://twitter.com/IMterriblyvexed/status/1241078898185527296
2020-03-20 19:06:54,BotanicGoddess,137pm,0,0,0,"CBD is the the best!! It’s helped with my pain, anxiety, insomnia, PTSD, ADD, PMS, cramps, skin issues & so much more .",,,,1241078782267539458,https://twitter.com/BotanicGoddess/status/1241078782267539458
2020-03-20 19:06:35,shadesmagazine1,,0,2,3,"Please #read and #share ... THANK YOU! — The following piece by @shadesmagazine1 Publisher @talk2mfc is the first in a series of #mentalhealth #stories and #resources ##NewsYouCanUse #selfcare #anxiety #covid_19 http://bit.ly/shadesmh1",,@shadesmagazine1 @talk2mfc,#read #share #mentalhealth #stories #resources # #NewsYouCanUse #selfcare #anxiety #covid_19,1241078704740024321,https://twitter.com/shadesmagazine1/status/1241078704740024321
2020-03-20 19:05:56,AldenSocialWork,,0,0,5,"Yoga for Anxiety- try it out! https://m.youtube.com/watch?v=bJJWArRfKa0 …",,,,1241078537416826883,https://twitter.com/AldenSocialWork/status/1241078537416826883
2020-03-20 19:05:13,AfrikaG72,,0,0,0,"Happy Friday! Yoga can help you reduce stress and relief anxiety. And it also has some great physical benefits to improve your over all health and quality of life. Much of all of this is needed at this time. #FlattenTheCurve #StaySafeStayHome #keepmoving #GoWithTheFlowpic.twitter.com/OyiOLOwYUF",,,#FlattenTheCurve #StaySafeStayHome #keepmoving #GoWithTheFlowpic,1241078356650704898,https://twitter.com/AfrikaG72/status/1241078356650704898
2020-03-20 19:05:05,eriq49,tinapittaway,0,0,1,"Did I mention Anxiety Eating? I made 12 muffins. They came out of the oven at 8 last night. I gave 2 away (at a safe distance). I have 2 left. How many muffins did Eric eat?",,,,1241078326141292554,https://twitter.com/eriq49/status/1241078326141292554
2020-03-20 19:02:39,AngelaNightRN,JessLZWatson,0,0,0,"I am in awe of how these young men and women say NOPE to something bigger than all of us and instead, they stay committed and focused. I am sure this eases their anxiety some",,,,1241077713856802819,https://twitter.com/AngelaNightRN/status/1241077713856802819
2020-03-20 19:01:35,JohnWesleyShipp,,2,0,10,"“Earlier this week, Washington Post reporters and editors shared the momentsand acts of kindness that have lifted their spirits and kept them smiling during this anxiety-inducing time...join the conversation” https://s2.washingtonpost.com/camp-rw/?e=am9obndlc2xleXNoaXBwQGhvdG1haWwuY29t&s=5e74f917fe1ff6038ce046ad&linknum=4&linktot=46 …pic.twitter.com/fa8qqMIpWU",,,,1241077445287182337,https://twitter.com/JohnWesleyShipp/status/1241077445287182337
2020-03-20 19:01:05,ginalynn012,,1,0,2,"Love is blind makes my anxiety reach a whole new level with this wedding episode #LoveIsBlind",,,#LoveIsBlind,1241077319017603078,https://twitter.com/ginalynn012/status/1241077319017603078
2020-03-20 19:01:05,komenmd,,0,0,2,"Komen’s Breast Care Helpline can provide information, social support & help w/ coping strategies related to anxiety or concerns during these uncertain times. The helpline is answered by a trained & caring staff member in English/Spanish, M-F 9A-10P ET. 1-877-GO-KOMEN (465-6636) pic.twitter.com/tH59e8mA7Y",,,,1241077318170415106,https://twitter.com/komenmd/status/1241077318170415106
2020-03-20 19:00:58,YeahHeyItsSteve,kshumanesociety,0,0,2,"GET A DOG!!!! OR A CAT!!! GET A PET!!! IT HELPS WITH ANXIETY!! WHY AM I YELLING? https://twitter.com/kshumanesociety/status/1241075743972642817 …",,,,1241077287321247745,https://twitter.com/YeahHeyItsSteve/status/1241077287321247745
2020-03-20 19:00:08,eriq49,tinapittaway,1,0,2,"I made social isolation cornbread muffins. Anxiety Baking is now a Thing.",,,,1241077078965006337,https://twitter.com/eriq49/status/1241077078965006337
2020-03-20 19:00:05,phreekhowse,thesouthern,0,0,0,"I would think it's expected. High anxiety situation, people with drink or smoke or pray.",,,,1241077066495385602,https://twitter.com/phreekhowse/status/1241077066495385602
2020-03-20 18:59:41,hannaedits,,1,0,3,"“FRESH AIR HELPS WITH ANXIETY,” she says, throwing open all her windows, drinking her third cup of coffee.",,,,1241076966771634176,https://twitter.com/hannaedits/status/1241076966771634176
2020-03-20 18:59:40,nourawanders,,1,0,9,"I completed my high school education fully online because I have anxiety and it’s much easier for me to learn at home. I understand not everyone is like that and I hope we can all get through this semester together",,,,1241076959980945409,https://twitter.com/nourawanders/status/1241076959980945409
2020-03-20 18:59:15,eat_it_offme,CamSoFuNny__,0,0,0,"EHEM *clears throat* People need to understand, that everyone has anxiety. NATURALLY. you wouldnt be human if you didnt. now, there are people with overwhelming amounts of anxiety, that are being overlooked cause u natural anxiety hoes be SO DAMN LOUD with how u have it. NO SHIT https://twitter.com/CamSoFuNny__/status/1240291219948941312 …",,,,1241076856314630145,https://twitter.com/eat_it_offme/status/1241076856314630145
2020-03-20 18:58:33,RawSwagger,,0,1,21,"Rubbed my eye for a solid 10seconds then had a damn anxiety attack for 20min....they gotta wrap this up",,,,1241076679117664257,https://twitter.com/RawSwagger/status/1241076679117664257
2020-03-20 18:58:09,tessatastic,,0,0,1,"conference calls at work give me enough anxiety as it is, and now they’ve decided to do video cc so i’ll just go dIE",,,,1241076578848628736,https://twitter.com/tessatastic/status/1241076578848628736
2020-03-20 18:56:15,KellRaiser26,oliverdarcy,0,0,3,"There’s not enough eye roll emojis. No wonder my anxiety has been through the roof the past week. https://twitter.com/oliverdarcy/status/1241041500936568838 …",,,,1241076100492640256,https://twitter.com/KellRaiser26/status/1241076100492640256
2020-03-20 18:56:00,DemiiNichole,,0,1,0,"just gotta let the stress and crippling anxiety set in",,,,1241076039595560960,https://twitter.com/DemiiNichole/status/1241076039595560960
2020-03-20 18:54:14,fmassa88,LeoRautins,1,0,2,"The best part is I know we will win. My anxiety level should be down about a thousand percent from last year!",,,,1241075592948264962,https://twitter.com/fmassa88/status/1241075592948264962
2020-03-20 18:53:48,ChelseaCirruzzo,,1,21,124,"me as soon as I think my anxiety is under control pic.twitter.com/4XVv9A8MyS",,,,1241075486693961731,https://twitter.com/ChelseaCirruzzo/status/1241075486693961731
2020-03-20 18:52:28,lowilliamss,,0,3,4,"anxiety levels have never been higher :)",,,,1241075150096908289,https://twitter.com/lowilliamss/status/1241075150096908289
2020-03-20 18:52:02,JupiterMedCtr,,0,0,0,"Taking care of yourself, your friends, and your family can help you cope with stress. Helping others cope with their stress can also make your community stronger. Visit the @CDCgov website for additional resources for managing anxiety and stress. https://bit.ly/39UVoEj pic.twitter.com/GGmrEyO2bx",,@CDCgov,,1241075039723757568,https://twitter.com/JupiterMedCtr/status/1241075039723757568
2020-03-20 18:49:52,Rachel_Harman,,0,0,4,"me every day this week: do i have muscle aches or did i sleep wrong? also me: is my throat dry or do i need to drink more water? me again: is my chest tight or do i have anxiety? my brain is sick of my shit at this point.",,,,1241074494464307208,https://twitter.com/Rachel_Harman/status/1241074494464307208
2020-03-20 18:49:52,delajed,,0,0,0,"To anyone suffering from anxiety because of what’s happening, I’ve got three words: The Voice Kids.",,,,1241074493830893570,https://twitter.com/delajed/status/1241074493830893570
2020-03-20 18:47:56,DrDaveNChicago,,1,0,5,"@jimrome having been dealing with this pandemic and the anxiety ot brings, please everyone be smart and safe. Kudos to all my colleagues on the front line",,@jimrome,,1241074009204305920,https://twitter.com/DrDaveNChicago/status/1241074009204305920
2020-03-20 18:47:25,brandalintipton,hayleysmith_77,0,0,0,"I know right. Not usual for me lately though, I’ve been managing my anxiety so well I don’t want to lose all of that progress",,,,1241073880866799616,https://twitter.com/brandalintipton/status/1241073880866799616
2020-03-20 18:46:49,KathrynAnnette,,0,1,12,"Social distancing does not mean social isolating. The quarantine has made this introvert more intentional about regularly connecting with friends and family. It also helps with the stress and anxiety of this season.",,,,1241073730287063040,https://twitter.com/KathrynAnnette/status/1241073730287063040
2020-03-20 18:45:35,fatimavmejia,JohnsonHildy,0,0,0,"“We and our anxiety issues” lmfao seriously. https://twitter.com/JohnsonHildy/status/1240486720929439744 …",,,,1241073417392136192,https://twitter.com/fatimavmejia/status/1241073417392136192
2020-03-20 18:45:31,BetterBodyByBk,,1,0,0,"5 Top Foods to help Combat Stress and Anxiety: 5. Oats Whole grains, like oats, are high in magnesium and are complex carbohydrates, which means they're digested more slowly, preventing quick spikes of blood sugar that can impact moods and stress. pic.twitter.com/1k6rhcloFP",,,,1241073401365577728,https://twitter.com/BetterBodyByBk/status/1241073401365577728
2020-03-20 18:45:29,BetterBodyByBk,,1,0,0,"5 Top Foods to help Combat Stress and Anxiety: 4. Turmeric Curcumin, the active ingredient in turmeric, has a plethora of promising research about its health benefits. It helps increase DHA synthesis in the brain and liver, which can have a calming effect. pic.twitter.com/Yv9NGfr0rC",,,,1241073391659913216,https://twitter.com/BetterBodyByBk/status/1241073391659913216
2020-03-20 18:45:27,BetterBodyByBk,,1,0,0,"5 Top Foods to help Combat Stress and Anxiety: 3. Avocado Avocados are a good source of monounsaturated fats, as well as brain boosting minerals like folate and magnesium. They also have vitamins c&e that help counteract stress. pic.twitter.com/xlKbPSzjos",,,,1241073383749455872,https://twitter.com/BetterBodyByBk/status/1241073383749455872
2020-03-20 18:45:22,BetterBodyByBk,,1,0,0,"5 Top Foods to help Combat Stress and Anxiety: 1. Try to choose fatty fish like Salmon and mackerel which are high in DHA and EPA which helps promote healthy brain function and can reduce inflammation. pic.twitter.com/1TY4YvhUll",,,,1241073361834242048,https://twitter.com/BetterBodyByBk/status/1241073361834242048
2020-03-20 18:45:19,BetterBodyByBk,,1,0,0,"Answer: I understand that this is a very stressful time for us all. But try to stay away from the junk food and choose these 5 foods to help combat stress and anxiety. SWIPE LEFT NOW.... pic.twitter.com/zYGvZdR4DB",,,,1241073352606793729,https://twitter.com/BetterBodyByBk/status/1241073352606793729
2020-03-20 18:44:52,MicahRucci,,0,0,2,"nothing gives me more anxiety than the restaurant scene in Mrs. Doubtfire",,,,1241073235439075328,https://twitter.com/MicahRucci/status/1241073235439075328
2020-03-20 18:43:34,ErikaDominici5,,0,0,0,"Im getting anxieties de tar tranca",,,,1241072911244505088,https://twitter.com/ErikaDominici5/status/1241072911244505088
2020-03-20 18:43:18,TheXplosiveEdge,,0,3,4,"6 Foods To Help Battle Stress & Anxiety 1. Fatty Fish - 2. seeds - mood 3. Chia seeds - ALA, omegas, stabilization of blood sugar 4. Avocado - healthy fat 5. Leafy greens - protects from cell damage 6. Oats -complex fiber rich carbs 7. Greek Yogurt= +probiotics pic.twitter.com/79evdrZJTi",,,,1241072845213634566,https://twitter.com/TheXplosiveEdge/status/1241072845213634566
2020-03-20 18:40:34,AlexaChanelle,,0,0,3,"Honestly huge s/o to @NYGovCuomo! He’s showing up and out like a LEADER should during this crisis. Thanks to you and your team for easing [my] anxiety and brining NYS together",,@NYGovCuomo,,1241072157112840192,https://twitter.com/AlexaChanelle/status/1241072157112840192
