date,username,to,replies,retweets,favorites,text,geo,mentions,hashtags,id,permalink
2020-03-20 13:59:05,ktranda8,,0,0,0,"Up early for my #Selfcare to manage my #COVID19 anxiety, did Flow with @SumitsYogaSPGFD on @YouTube-HIGHLY recommended! Don’t forget to take care if YOU! #wellness #MindbodyandSpirit #tweetiatrician @somedocspic.twitter.com/JMEXtYPrVD",,@SumitsYogaSPGFD @YouTube @somedocspic,#Selfcare #COVID19 #wellness #MindbodyandSpirit #tweetiatrician,1241001317260279808,https://twitter.com/ktranda8/status/1241001317260279808
2020-03-20 13:56:07,IrenieReynoso,,0,0,5,"anybody else wake up every morning with so much anxiety about getting the corona? stressful. anxious. scared. whhhyyyyy",,,,1241000569436692480,https://twitter.com/IrenieReynoso/status/1241000569436692480
2020-03-20 13:53:56,BruceHagen,,0,0,0,"@varney Just has to turn you off this morning. Your ongoing hysterical questions on hitting the bottom and mall closings only accelerates crazy computer trading and general anxiety. Positive uplifting commentary of any kind would go a long way. By the way how’s your Boeing stock?",,@varney,,1241000019932721152,https://twitter.com/BruceHagen/status/1241000019932721152
2020-03-20 13:50:25,KiddSiscoTV,MissLoxXD,0,0,0,"well my dad called me and talked to me for forever but i still don’t know if i would’ve streamed anxiety & depression sucks",,,,1240999138436755456,https://twitter.com/KiddSiscoTV/status/1240999138436755456
2020-03-20 13:49:44,JaredWMatthews,,2,3,26,"I'm seeing a lot of people going through anxiety & depression from all of this stuff going on including myself. You are not alone. Get off the internet for a little bit. Go out & take a walk, take some photos, smile at those passing by. It's the best medication at the moment.",,,,1240998963404308483,https://twitter.com/JaredWMatthews/status/1240998963404308483
2020-03-20 13:48:41,Abovejb3,,0,0,0,"Anxiety attacks at 5 am",,,,1240998701855727621,https://twitter.com/Abovejb3/status/1240998701855727621
2020-03-20 13:48:35,clevolution,,0,0,0,"WHEN YOU MUST KNOW Some demand to know when this crisis will be over. Understandable as that is the ego working overtime to avoid anxiety and not looking good. Ego hates ambiguity, uncertainty. So for those… https://www.instagram.com/p/B99SuCJpo1W/?igshid=1ldvtgkqiixv2 …",,,,1240998677344169985,https://twitter.com/clevolution/status/1240998677344169985
2020-03-20 13:47:57,arinnicole04,,1,1,9,"when i tell yall with everything going on my anxiety is SKY ROCKET, my chest feels like its caving.. i hope all this dies down n things go back to normal very soon",,,,1240998515272224768,https://twitter.com/arinnicole04/status/1240998515272224768
2020-03-20 13:47:52,JustMeKWR,NYGovCuomo,0,0,0,"And there goes my way to cope with anxiety. https://twitter.com/NYGovCuomo/status/1240983500553158656 …",,,,1240998495722627072,https://twitter.com/JustMeKWR/status/1240998495722627072
2020-03-20 13:47:40,ASlightSprite,,2,0,19,"I can’t risk giving him the virus in case I have it in an asymptomatic way...but I’m also the only person who takes care of him. I’m here for anyone else struggling with this Also open to any tips re: groceries, meds, my anxiety... (2/2) #Covid_19 #SocialDistancing",,,#Covid_19 #SocialDistancing,1240998443176169472,https://twitter.com/ASlightSprite/status/1240998443176169472
2020-03-20 13:47:25,HarrietCammock,,0,0,0,"What i advise you to do is not to be unhappy- your mind is the perfect antidote to anxiety- #FearNot as the Bible says- hope y’all ready to be encouraged through this- . . . . #podcast #downtoearthwithharrietcammock… https://www.instagram.com/p/B99SlfiJuX2/?igshid=9uuad8nlvsh5 …",,,#FearNot #podcast #downtoearthwithharrietcammock,1240998381792755712,https://twitter.com/HarrietCammock/status/1240998381792755712
2020-03-20 13:47:20,DrPowersKHS,,0,4,23,"During this time of transitioning to distance learning this from @casas_jimmy really resonates w/me. The truth is I worry we have forgotten what it feels like to be a student & the anxieties that come with it. Now, more than ever, we must extend grace to our students & teachers! pic.twitter.com/C1JFS6008D",,@casas_jimmy,,1240998359705489409,https://twitter.com/DrPowersKHS/status/1240998359705489409
2020-03-20 13:43:51,AyeshaBoyce,,0,0,26,"Have I mentioned how proud I am to be a part of the @UNCG @UNCGSchoolofEdu community?! Pics of part of a message sent from our Provost. Some of my anxiety has definitely gone down. Also shout out to the Ohio State for setting an amazing precedent. #tenuretrack #tenureseekingpic.twitter.com/XZg4hcb8NJ",,@UNCG @UNCGSchoolofEdu,#tenuretrack #tenureseekingpic,1240997482433257474,https://twitter.com/AyeshaBoyce/status/1240997482433257474
2020-03-20 13:43:14,CMHAWECB,,0,8,9,"Limit news, be careful what you read if experiencing OCD and anxiety. Focus on your care programs - feeling anxious is normal. So be aware and what tools to help minimize. What are triggers ... be aware & adjust when possible. @Jennyleealmeida @am800cklw @danmac800 #YQGpic.twitter.com/XlPiouYtqG",,@Jennyleealmeida @am800cklw @danmac800,#YQGpic,1240997328485572608,https://twitter.com/CMHAWECB/status/1240997328485572608
2020-03-20 13:42:57,Lifeiskitsch,,6,36,150,"Noticing that healthy folks are finally understanding a *tiny* bit of what cancer patients feel on the daily: blame, fear, anxiety: “is it my fault?” “is it coming back?” “is this just a normal symptom of whatever or is this the cancer?” Etc #btsm #scanxiety #cancer #coronavirus",,,#btsm #scanxiety #cancer #coronavirus,1240997255705956353,https://twitter.com/Lifeiskitsch/status/1240997255705956353
2020-03-20 13:42:44,julie__archer,hcarroll138,1,0,1,"I don’t have a cough, but last night my throat was getting dry and I didn’t want to get water so I was coughing a little bit and it started giving me anxiety.",,,,1240997201448513536,https://twitter.com/julie__archer/status/1240997201448513536
2020-03-20 13:41:28,ClareFieseler,,1,3,11,"The American Psychological Association reports that 50% of adults and 90% of young adults are “constant checkers” of screens. My own checking has skyrocketed under #COVID19. This is a reminder that studies show spending time by water (even showering) counters anxiety. pic.twitter.com/Zqb6W9jovB",,,#COVID19,1240996883788640256,https://twitter.com/ClareFieseler/status/1240996883788640256
2020-03-20 13:41:21,Gbgstageright,,0,0,2,"End of week one. Frustration, anxiety and Phantom pic.twitter.com/H5QO5FlrFG",,,,1240996854546018305,https://twitter.com/Gbgstageright/status/1240996854546018305
2020-03-20 13:39:41,kstahl,,0,0,0,"How's your anxiety level today? If you need a calm, soothing, meditative soundtrack for your day try this album of HOURS of relaxing and serene soundscapes by me and @denisdiblasio. http://kstahl.me/meditation . #COVID19 #coronavirus #meditation #yoga #mindfullness #QuarentineLife",,@denisdiblasio,#COVID19 #coronavirus #meditation #yoga #mindfullness #QuarentineLife,1240996433991536641,https://twitter.com/kstahl/status/1240996433991536641
2020-03-20 13:39:28,Starr_Tweets,,0,0,0,"@KeishaBottoms Are you going to implement some sort of delay on rent and mortgage payments like NY did for their residents. Anxiety is at an all time high with all that’s go on.",,@KeishaBottoms,,1240996382149836800,https://twitter.com/Starr_Tweets/status/1240996382149836800
2020-03-20 13:39:26,gina_d_ceramics,in_shambles,0,0,1,"I feel it. My allergies are horrible and temp shifts get me. On Zyrtec and have the humidifier going. But my anxiety sends me into tail spin",,,,1240996372771471360,https://twitter.com/gina_d_ceramics/status/1240996372771471360
2020-03-20 13:38:24,alethia_q,,0,0,2,"am i sick or do i have anxiety?",,,,1240996111537418241,https://twitter.com/alethia_q/status/1240996111537418241
2020-03-20 13:34:19,conniehamilton,markbarnes19,0,1,4,"In typical @10publications style, #AnxiousBook provides the what and how to help students cope with anxiety. @RavesiWeinstein shares practical information that outlines what to do and what NOT to do when trying to assist others in managing their anxiety. Easy and important read! https://twitter.com/markbarnes19/status/1240768177098940416 …",,@10publications @RavesiWeinstein,#AnxiousBook,1240995086126718981,https://twitter.com/conniehamilton/status/1240995086126718981
2020-03-20 13:34:17,marcellam,,0,4,27,"Hey @CBCNews love your work; long time fan, former producer here. Please during this #COVID19 time stop covering the markets opening like some kind of game. It’s probably not helping with people’s anxiety. Opening bell is not a must see event.",,@CBCNews,#COVID19,1240995074735058945,https://twitter.com/marcellam/status/1240995074735058945
2020-03-20 13:32:58,backtobradio,,1,4,14,"We as God's people should not be in a panic or filled with anxiety. We serve Almighty God and our responsibility is to trust Him and know that He is able. @BrianBrodersen on Trying To Help God in Genesis 16 https://backtobasicsradio.com/listen-watch/",,@BrianBrodersen,,1240994745544921088,https://twitter.com/backtobradio/status/1240994745544921088
2020-03-20 13:31:52,thedallasjai,,1,0,0,"My anxiety is giving me so much hell today i hate going through this alone.",,,,1240994470344167424,https://twitter.com/thedallasjai/status/1240994470344167424
2020-03-20 13:31:38,pkhorn,,1,0,0,"4 Books That Are Not Too Sad or Anxiety Provoking https://ninabadzin.com/2020/03/19/4-books-that-are-not-too-sad-or-anxiety-provoking/ … via @NinaBadzin",,@NinaBadzin,,1240994410680254465,https://twitter.com/pkhorn/status/1240994410680254465
2020-03-20 13:29:27,byoutfulbyahnab,,0,0,0,"Hang in there everyone. I know this is hard, but don’t let anxiety get the best of you Take good care of you. Indulge in something that brings you joy! @San Francisco Bay Area https://www.instagram.com/p/B99Qh4BJrAW/?igshid=rayyl0w43x0v …",,@San,,1240993859326410752,https://twitter.com/byoutfulbyahnab/status/1240993859326410752
2020-03-20 13:28:04,OJIBAJO,,3,0,8,"I have about 8 days of PTO banked and someone informed my last night that because I am immunocompromised I may be eligible for 2 weeks paid leave. So I will be looking into that today, because my anxiety about being at working is overwhelming.",,,,1240993513774424065,https://twitter.com/OJIBAJO/status/1240993513774424065
2020-03-20 13:27:48,TampaEFL,,0,0,1,"Just when I was about to fall into a pit of depression and anxiety over no sports and acting or filming ...: along came more webinars , made my heart beat out of my chest. Latch it. Are you doing brief nudity or anything. Kidding",,,,1240993447110205440,https://twitter.com/TampaEFL/status/1240993447110205440
2020-03-20 13:25:46,Elisa_Raffa,,5,1,19,"GUYS, #TGIF! Toilet paper is worth gold right now & I dropped a WHOLE ROLL into my toilet trying to shake a spider off it Spider held on like Rose in Titanic, even as it continued to soak up & sink...& my spider anxiety grew He did get flushed in the end #iwin pic.twitter.com/U6dWuJzesu",,,#TGIF #iwin,1240992935224709120,https://twitter.com/Elisa_Raffa/status/1240992935224709120
2020-03-20 13:24:54,jennifernvictor,,1,13,24,"Feeling anxious about disease and the government response? The researchers who literally wrote the book about how anxiety affects politics have helpful insights to share, @sgadarian @AlbertsonB2 @washingtonpost @monkeycagebloghttps://www.washingtonpost.com/politics/2020/03/20/were-all-anxious-about-pandemic-who-do-americans-want-hear/ …",,@sgadarian @AlbertsonB2 @washingtonpost @monkeycagebloghttps,,1240992714063319041,https://twitter.com/jennifernvictor/status/1240992714063319041
2020-03-20 13:23:40,kadarsmall,,0,0,2,"Being trapped inside has really been fucking with my anxiety bro. It’s like I get so worried and nervous. Shaking, stuck sitting on my bed.",,,,1240992405169541121,https://twitter.com/kadarsmall/status/1240992405169541121
2020-03-20 13:23:23,RaValDavis,,0,0,0,"Guess who's bizack? After 4 months of social (media) distancing your girl is back and all it took was a whole pandemic and a quarantine....Instagram was giving me anxiety for real.... But I'm back and of course I'm… https://www.instagram.com/p/B99P1VopwEa/?igshid=jqfe32y1t2ra …",,,,1240992333644038144,https://twitter.com/RaValDavis/status/1240992333644038144
2020-03-20 13:21:24,tigerdave16,,0,0,0,"Coronavirus Check-in: Managing Anxiety in Uncertain Times (3.18.2020) https://youtu.be/m43eY6ZbZU4 via @YouTube",,@YouTube,,1240991833615990784,https://twitter.com/tigerdave16/status/1240991833615990784
2020-03-20 13:20:46,MountainSilver1,,0,0,1,"All of my children work in “essential” jobs. 3/4 are still commuting. They live in 4 different cities. My anxiety is way up. I cried all night. Im off to my mat to calm down in the T-shirt I made yesterday. #coronacrazy #worriedmama #coronacrafts #cricutcrafts #cricut #meditatepic.twitter.com/wYzGMNHeFQ",,,#coronacrazy #worriedmama #coronacrafts #cricutcrafts #cricut #meditatepic,1240991677113872384,https://twitter.com/MountainSilver1/status/1240991677113872384
2020-03-20 13:19:22,ChrisLindberg,,0,0,1,"What do you do when all HELL breaks loose? What do you do when you’re filled with anxiety, fear, worry, grasping for hope? How do you have peace in the midst of utter chaos and uncertainty? . This Sunday Life… https://www.instagram.com/p/B99PYF7FyHn/?igshid=pxb2qv3y6unu …",,,,1240991324146458624,https://twitter.com/ChrisLindberg/status/1240991324146458624
2020-03-20 13:18:37,RxDrAvant,ChaseSupport,0,0,2,"I called. Chase is only waiving payments but the interest still accrues. Waiving the interest would be extremely helpful in mitigating anxiety during this unprecedented, uncertain, once every 100 years time.",,,,1240991135427952640,https://twitter.com/RxDrAvant/status/1240991135427952640
2020-03-20 13:18:15,papinovaa,,0,0,5,"Ay man. Between this damn rona shit and my allergies, my anxiety is thru the roof. Every 5mins I think something’s wrong w me",,,,1240991042985394178,https://twitter.com/papinovaa/status/1240991042985394178
2020-03-20 13:17:43,Jessmasta,,0,0,0,"what do people with anxiety disorders do in this time because i feel fkn terrible mate #help",,,#help,1240990906045681666,https://twitter.com/Jessmasta/status/1240990906045681666
2020-03-20 13:16:22,LadyNeeko,matokah,1,0,1,"Andrew, no. I have anxiety on your behalf",,,,1240990568190271488,https://twitter.com/LadyNeeko/status/1240990568190271488
2020-03-20 13:15:08,theuppitynegro,,1,1,5,"Seriously, Barack Obama’s twitter timeline is surely a bright spot in these times of anxiety and uncertainty.",,,,1240990256524144643,https://twitter.com/theuppitynegro/status/1240990256524144643
2020-03-20 13:15:00,myonlysecret,,0,0,3,"Good morning y'all. Had a hard time sleeping last bought due to stress. I completely forgot I have some anxiety medication left...",,,,1240990223443431424,https://twitter.com/myonlysecret/status/1240990223443431424
2020-03-20 13:13:06,treytrottersofc,,0,0,0,"Anxiety/depression can take their toll. See a therapist while honoring social distancing via smart phone/computer. Accepting “virtual” referrals all over OK. (580)716-0655 https://www.treytrotter.com/therapy #anxiety #depression #trotter #counseling #therapy #remedies #covid #pandemic",,,#anxiety #depression #trotter #counseling #therapy #remedies #covid #pandemic,1240989745347465217,https://twitter.com/treytrottersofc/status/1240989745347465217
2020-03-20 13:10:27,rotsennonato,,0,0,0,"A lot of people on that other platform talking about turning off the news updates to quell anxiety. #weak",,,#weak,1240989077861625857,https://twitter.com/rotsennonato/status/1240989077861625857
2020-03-20 13:10:23,SusanSchoppe,sera_desu,0,0,0,"It’s very scary here, high anxiety from people loosing jobs due to everything being shut down & worry about getting sick",,,,1240989060602245121,https://twitter.com/SusanSchoppe/status/1240989060602245121
2020-03-20 13:08:40,LilleV1985,,0,0,0,"Had to get some air and change of scenery since my anxiety is at a higher level than is ideal for my #mentalhealth thanks to @duckdonuts for giving me a little normalcy in this #uncharted world we now exist in… https://www.instagram.com/p/B99OJobD79H/?igshid=hox245g5iyw8 …",,@duckdonuts,#mentalhealth #uncharted,1240988631533326336,https://twitter.com/LilleV1985/status/1240988631533326336
2020-03-20 13:05:29,WILDMAN333,,0,0,0,"We have Edibles for Anxiety, Pain, Sleep Get medicated today!!! Gummies Gushers Sour Dabs Skiddles and more Get a Consultation on Alternative Health Options. serious inquiries 775-773-8133 We will Deliver $$$@… https://www.instagram.com/p/B99NyT5B5jy/?igshid=1b4pjhmlprdb4 …",,@,,1240987827451637762,https://twitter.com/WILDMAN333/status/1240987827451637762
2020-03-20 13:04:41,KellyGC411,,6,2,101,"*NEW BLOG POST* “Anxious in isolation” In writing Ive focused on Adelaide steering clear of my own, sometimes debilitating, condition: anxiety. This week has been rough, I know I’m not alone. Who’s up for some mental health intimacy while social distancing?http://Www.kellycervantes.com/blog/anxious",,,,1240987628503252992,https://twitter.com/KellyGC411/status/1240987628503252992
2020-03-20 13:00:33,TheArtOfCharm,,5,1,18,"9 days of Quarantine, stress, anxiety and disbelief. I feel like I aged 30 years pic.twitter.com/h8Z3l8G8iz",,,,1240986589032935425,https://twitter.com/TheArtOfCharm/status/1240986589032935425
2020-03-20 12:59:47,AlastairVance,,3,0,7,"I feel a level of anxiety that can only be calmed by nine fresh rolls of Quilted Northern.",,,,1240986393238790144,https://twitter.com/AlastairVance/status/1240986393238790144
2020-03-20 12:59:19,kikikanbraid,,0,0,0,"I have terrible anxiety or PTSD idk wtf it is but it’s weighing me down",,,,1240986277153058816,https://twitter.com/kikikanbraid/status/1240986277153058816
2020-03-20 12:58:36,MissHenwood1,,1,3,13,"Below are some resources that I’ve gathered about how to help kids (and yourself) deal with stress and anxiety about the current situation. Research proves that kids who live under constant stress for 4-6 weeks can develop PTSD symptoms and, in some cases, full blown PTSD. (1/4) pic.twitter.com/yZQm9yKVRU",,,,1240986097045340160,https://twitter.com/MissHenwood1/status/1240986097045340160
2020-03-20 12:57:24,WILDMAN333,,0,0,0,"We have Edibles for Anxiety, Pain, Sleep Get medicated today!!! Gummies Gushers Sour Dabs Skiddles and more Get a Consultation on Alternative Health Options. serious inquiries 775-773-8133 We will Deliver $$$@… https://www.instagram.com/p/B99M3Cthfg2/?igshid=14d1hdqw8vxzg …",,@,,1240985795076513792,https://twitter.com/WILDMAN333/status/1240985795076513792
2020-03-20 12:52:39,dan_londe,LeonaLioness6,0,1,1,"I've had 2 open heart surgeries in the last 6 months. Now this virus. Let me tell you about anxiety. But this ain't about me, and I'm not alone. I pray everyone stay safe and STRONG.",,,,1240984599397838848,https://twitter.com/dan_londe/status/1240984599397838848
2020-03-20 12:51:34,PastorSterling,,0,0,0,"You are my covering... You keep watch over me, protecting me from anxiety... You encircle me with your songs of rescue... Selah... Psalm 32:7 (my translation) pic.twitter.com/dTrsSjYgNX",,,,1240984324717019139,https://twitter.com/PastorSterling/status/1240984324717019139
2020-03-20 12:51:13,ROCKJERSEYSHR82,,4,1,13,"G'morning FROM grumpy Hallow #WereInThisTogether a @SPCAwestchester RESCUE who's NOT only been by my side through this but has helped me w/ my anxiety I'm beyond blessed to call him my #mancrusheveryday #CatsOfTwitter #CaturdayEve #TuxedoCatspic.twitter.com/G2mxOzQVVF",,@SPCAwestchester,#WereInThisTogether #mancrusheveryday #CatsOfTwitter #CaturdayEve #TuxedoCatspic,1240984236544458753,https://twitter.com/ROCKJERSEYSHR82/status/1240984236544458753
2020-03-20 12:50:49,titinamom,jaclynroth,0,0,0,"@jaclynroth good morning my anxiety is undercontroll still need your advice tho https://twitter.com/jaclynroth/status/1239645982356357128 …",,@jaclynroth,,1240984137642782721,https://twitter.com/titinamom/status/1240984137642782721
2020-03-20 12:50:23,susanvalentine,,0,0,0,"“His suggestion, by asking you to speak up about your private anxieties, many of them financial, is that you . . . will begin to see your struggles not as personal failings, but systemic ones,” https://www.newyorker.com/news/campaign-chronicles/most-people-never-saw-the-best-of-bernie-sanderss-campaign …",,,,1240984030151049217,https://twitter.com/susanvalentine/status/1240984030151049217
2020-03-20 12:48:48,TheRobertaShow,,0,0,1,"It’s been an overwhelming week, but we can still celebrate FRIDAY! We’ve made it this far. Your fear & anxiety haven’t got the best of you. This new temporary normal won’t last forever. let’s focus on coming out as… https://www.instagram.com/p/B99L4BOpMYR/?igshid=1lld07qwbbk0l …",,,,1240983632250011649,https://twitter.com/TheRobertaShow/status/1240983632250011649
2020-03-20 12:44:43,nikkibabeyx,briittmariie,1,0,0,"Britt me too. Everyone’s anxiety is at an all time high it’s INSANE",,,,1240982603244744705,https://twitter.com/nikkibabeyx/status/1240982603244744705
2020-03-20 12:40:43,BrittB2685,,0,0,0,"I had an anxiety attack this morning before work. Becoming extremely anxious about getting in sick. And in general just feel exhausted 24-7 bc of so much uncertainty",,,,1240981596678828034,https://twitter.com/BrittB2685/status/1240981596678828034
2020-03-20 12:39:16,heenastat,,0,1,3,"6/10 There is also our #RealFamily. We can’t hunker down with them to mitigate their #anxiety or ease #socialdistancing. So now I will expose the breaks in the #invisiblecoatofarmor that typically helps me thrive in a physically and emotionally challenging profession.",,,#RealFamily #anxiety #socialdistancing #invisiblecoatofarmor,1240981229375291392,https://twitter.com/heenastat/status/1240981229375291392
2020-03-20 12:39:15,mrladd,AmBdSurg,0,1,5,"Thank you @AmBdSurg as this relieves a lot anxiety about completing training this year. https://twitter.com/AmBdSurg/status/1240810133585887233 …",,@AmBdSurg,,1240981225516523520,https://twitter.com/mrladd/status/1240981225516523520
2020-03-20 12:37:56,WichitaCindy,,1,0,0,"If I focus on changing the thought channel to more helpful programming that includes thoughts like, “There are many capable people working on this. We will get through this,” my body will respond by dialing down the anxiety and stress.",,,,1240980895886200832,https://twitter.com/WichitaCindy/status/1240980895886200832
2020-03-20 12:37:56,WichitaCindy,,1,0,0,"For example, what if my constant thought is “This is bad! What is this world coming to?” Not surprisingly, my emotions will more likely skew to significant anxiety. My behaviors also will be less productive.",,,,1240980895101865984,https://twitter.com/WichitaCindy/status/1240980895101865984
2020-03-20 12:37:55,WichitaCindy,,1,0,0,"“Anxiety and stress are normal even in the absence of a pandemic. And clearly they are likely to intensify in such a moment as we are now experiencing. But there are approaches and behaviors that can be effective in managing them and preventing fear from becoming incapacitating.”",,,,1240980890123198466,https://twitter.com/WichitaCindy/status/1240980890123198466
2020-03-20 12:37:54,WichitaCindy,,1,0,1,"1. Limit intake of media 2. Anchor yourself in daily routines 3. Do things that bring you happiness or pleasure 4. Reality-test your thought patterns #coronavirus #COVID19 #anxiety #depressionhttps://www.baltimoresun.com/opinion/op-ed/bs-ed-op-0317-coronavirus-stress-cope-20200316-u5vacvgy6zbqvdun2roa3dkdoe-story.html …",,,#coronavirus #COVID19 #anxiety #depressionhttps,1240980888567103490,https://twitter.com/WichitaCindy/status/1240980888567103490
2020-03-20 12:32:22,THEbobbybrooks,,0,0,3,"Yesterday was a pretty rough & dark mental day for me. Fear. Not letting that happen today. Germaphobe. Hypochondriac. Anxiety-laden. Some of my characteristics. But today, I’m choosing this word: Alive. #coronovirus will not take my sanity. #quarantinelife #pandemiclife",,,#coronovirus #quarantinelife #pandemiclife,1240979496427233280,https://twitter.com/THEbobbybrooks/status/1240979496427233280
2020-03-20 12:25:11,nicrealmsn,,0,0,0,"@IngrahamAngle Dr Fauci was on CNN last night spreading doom and gloom last night. He is spreading panic. The anxiety level is off the charts",,@IngrahamAngle,,1240977687667187713,https://twitter.com/nicrealmsn/status/1240977687667187713
2020-03-20 12:24:00,SteepMeACup,,0,0,0,"Stay strong and healthy through these tough times! We lift almost daily and it really helps keep focus and mental anxiety at bay! #stayhealthy #steepmeacupoftea #steepme #teafixeseverything #wehaveateaforthat… https://www.instagram.com/p/B99JCklgcoo/?igshid=ow3cpq92chx9 …",,,#stayhealthy #steepmeacupoftea #steepme #teafixeseverything #wehaveateaforthat,1240977389204766720,https://twitter.com/SteepMeACup/status/1240977389204766720
2020-03-20 12:22:34,quilantx,,0,0,1,"I don’t know if having the Citizen app downloaded during a pandemic is a good idea, crime is getting significantly more violent and closer to my house since self isolation started and it’s only adding to my anxiety",,,,1240977030616944641,https://twitter.com/quilantx/status/1240977030616944641
2020-03-20 12:22:34,__jenniferx3,_aziam_,0,0,1,"Facts, I faint every time I have an anxiety attack bc that shit is bad https://twitter.com/_aziam_/status/1240324364848885760 …",,,,1240977028800827393,https://twitter.com/__jenniferx3/status/1240977028800827393
2020-03-20 12:18:04,Irishroots115,sbaumgardner16,0,0,1,"It’s an entirely new level of anxiety https://twitter.com/sbaumgardner16/status/1240802633226555393 …",,,,1240975894598090753,https://twitter.com/Irishroots115/status/1240975894598090753
