date,username,to,replies,retweets,favorites,text,geo,mentions,hashtags,id,permalink
2020-03-20 23:59:57,doujouDC,,0,0,0,"The only time my anxiety goes up is when I go grocery shopping. Specifically when I gently suggest that the person behind me move the fuck back",,,,1241152529783758849,https://twitter.com/doujouDC/status/1241152529783758849
2020-03-20 23:59:30,sahsassy__,,0,0,0,"Everything that is not apart of my purpose gives me BIG anxiety how imma figure this shit out",,,,1241152417409925125,https://twitter.com/sahsassy__/status/1241152417409925125
2020-03-20 23:59:28,ktb213,,0,0,0,"NBC News: Coronavirus is a 'personal nightmare' for people with OCD and anxiety disorders. https://www.nbcnews.com/news/us-news/coronavirus-personal-nightmare-people-ocd-anxiety-disorders-n1164066?cid=googlenews-usnews … via @GoogleNews",,@GoogleNews,,1241152411139530757,https://twitter.com/ktb213/status/1241152411139530757
2020-03-20 23:59:21,markusgrupp,unbrelievable,1,0,0,"IMO there’s nothing bad about sharing your own struggles and anxieties. Being vulnerable makes you human, something your team likely need more this week than brave face & rallying cry. I’m sure they’ll understand these circumstances are affecting you, like it’s affecting them",,,,1241152381200580611,https://twitter.com/markusgrupp/status/1241152381200580611
2020-03-20 23:59:09,Cr8DigitalAsset,,1,2,6,"People are so focused on avoiding this virus by physically avoiding people ... yet they don’t avoid people on the Internet digitally and the social anxiety is actually more contagious. Are you distancing yourself from that? You have to protect yourself mentally, too.",,,,1241152329619030017,https://twitter.com/Cr8DigitalAsset/status/1241152329619030017
2020-03-20 23:58:46,capontedehanna,CentennialPres,0,0,0,"Answering Ss emails to lessen anxiety",,,,1241152232239910912,https://twitter.com/capontedehanna/status/1241152232239910912
2020-03-20 23:57:50,KingThelonious,,7,12,174,"My anxiety is SHIT. I’ve made like one beat on quarantine lockdown. My mind has literally been elsewhere the entire time.",,,,1241151997883101184,https://twitter.com/KingThelonious/status/1241151997883101184
2020-03-20 23:57:26,colleencrank,,0,0,1,"Also man this shit sucks for people with allergies. I know today my allergies are acting up cuz of how warm it is, but my anxiety says otherwise.",,,,1241151897706336256,https://twitter.com/colleencrank/status/1241151897706336256
2020-03-20 23:56:54,Tronk22,AngrierWHStaff,0,0,0,"Perfectly legit question @PeterAlexander A real President would have taken the time to answer and try to settle some of the anxiety Americans are feeling.",,@PeterAlexander,,1241151761634787328,https://twitter.com/Tronk22/status/1241151761634787328
2020-03-20 23:56:14,melc97,,0,0,0,"I was having a straight horrible day w anxiety yesterday and felt so anxious so i sat in my car to cry... and then my best friends texted me out of the blue and quickly I knew God sent me angels. Karlee and Bailey will always be my angels. I’m so blessed.",,,,1241151595225575424,https://twitter.com/melc97/status/1241151595225575424
2020-03-20 23:54:39,melissamconley,,0,0,1,"*dad sitting at our kitchen table* “ I have anxiety, can I go home?”",,,,1241151199077752832,https://twitter.com/melissamconley/status/1241151199077752832
2020-03-20 23:53:57,trongminhhoang,,1,6,30,"the future is uncertainty, desire, anxiety, open space, and perhaps destiny we can live towards it and shape it because it does not yet exist everything is still possible",,,,1241151021499457537,https://twitter.com/trongminhhoang/status/1241151021499457537
2020-03-20 23:53:50,Cynteaahh,,0,0,3,"Does anyone else stop drinking coffee and then get anxiety and heart palpations once they drink it again?!? Lmao is this normal",,,,1241150991946231808,https://twitter.com/Cynteaahh/status/1241150991946231808
2020-03-20 23:52:29,racistpresiden2,,0,0,1,"Hey @NBCNews (also @MSNBC). Remember earlier when @realDonaldTrump called out one of your reporters for spreading fear and anxiety with his line of questioning?? Yeah, clearly he was in the right based on this article you literally just sent me. Stop pushing fear!! #FakeNewspic.twitter.com/Sy6LH3yxPS",,@NBCNews @MSNBC @realDonaldTrump,#FakeNewspic,1241150652417531905,https://twitter.com/racistpresiden2/status/1241150652417531905
2020-03-20 23:52:00,hiiinicoleee,,0,0,5,"at this deli ordering a veggie wrap and the guy was like ..” you smell nice.” I go.go “thanks, it’s anxiety” and he goes..” well you wear it well” Day 5. #coronavirus #Covid_19 #FridayFeeling #CoronavirusPandemic",,,#coronavirus #Covid_19 #FridayFeeling #CoronavirusPandemic,1241150531445215232,https://twitter.com/hiiinicoleee/status/1241150531445215232
2020-03-20 23:51:48,9misslou,,0,0,0,"them messages that be on dnd fw my anxiety bad",,,,1241150480832700416,https://twitter.com/9misslou/status/1241150480832700416
2020-03-20 23:51:44,Oziel_Was_Here,,0,0,1,"Almost had an anxiety attack shopping around so many people at H-E-B. Most of them sneezing and coughing. . Guess I will be doing curbside pickup from now on.",,,,1241150462608408576,https://twitter.com/Oziel_Was_Here/status/1241150462608408576
2020-03-20 23:48:27,_YOUNGBABY_,,32,56,874,"Have u noticed that ppl w depression and or anxiety are handling this crisis better than the rest of y’all?",,,,1241149637395984385,https://twitter.com/_YOUNGBABY_/status/1241149637395984385
2020-03-20 23:47:43,smule77,,0,2,87,"My mom was “shocked” when I told her I didn’t want to come home? Sorry Bridget but I can only handle one person’s anxiety and that’s my own",,,,1241149453672816641,https://twitter.com/smule77/status/1241149453672816641
2020-03-20 23:47:27,rangelrubbish,,0,0,1,"It’s one of the ways I manage my anxiety, and it was really really nice to do it all online. And it was at my doorstep in like an hour! Just..haha leaving the house is harder rn.",,,,1241149383258722304,https://twitter.com/rangelrubbish/status/1241149383258722304
2020-03-20 23:47:26,Pretty_Brown100,,0,0,2,"My anxiety is on 1000",,,,1241149381346279425,https://twitter.com/Pretty_Brown100/status/1241149381346279425
2020-03-20 23:46:12,KNOWASONG,,1,1,3,"Currently listening to @echodmusic to calm my anxiety brb.",,@echodmusic,,1241149068937551872,https://twitter.com/KNOWASONG/status/1241149068937551872
2020-03-20 23:43:21,__saesha,,0,0,2,"I hate that having anxiety makes you find comforts certain people cus it’s usually people you should t find comfort in",,,,1241148355016658944,https://twitter.com/__saesha/status/1241148355016658944
2020-03-20 23:42:00,thekristinkey,,0,2,3,"Want to add frustration and anxiety to your quarantine? Get a Rubik’s cube! Moving on... #rubikscube #toomuchtimeonmyhands #styx #quarantine #hobbies #puzzles #comedy #comediansofinstagram @erossica @kellieacochran @… https://www.instagram.com/p/B9-WW2lAlQp/?igshid=8ksbrz3xr6l5 …",,@erossica @kellieacochran @,#rubikscube #toomuchtimeonmyhands #styx #quarantine #hobbies #puzzles #comedy #comediansofinstagram,1241148015135555584,https://twitter.com/thekristinkey/status/1241148015135555584
2020-03-20 23:41:35,ameetchimote,AdamBakerTweets,1,0,0,"Most of mine are destroyed by deer and squirrels! Adds anger to my anxiety",,,,1241147910018019329,https://twitter.com/ameetchimote/status/1241147910018019329
2020-03-20 23:41:24,telkinsjr,richardwarnica,0,0,2,"That’s a lie. I’ve found it’s absolutely the BEST way to ramp up my anxiety.",,,,1241147863226335232,https://twitter.com/telkinsjr/status/1241147863226335232
2020-03-20 23:40:32,sak386,,1,0,1,"6. Also, believing in and praying to God (or a higher power) reduces anxiety and centers you. Because you know that He is watching over you and you are never alone. And you come to realize what is really important in life.",,,,1241147642408820736,https://twitter.com/sak386/status/1241147642408820736
2020-03-20 23:40:30,sak386,,1,0,0,"1. Message from wife to our children: Since COVID-19, has surfaced, the seriousness of our situation has increased and caused much anxiety. Now that we are all mandated to our homes and social distancing, I now realize this is the best action to dissipate this virus.",,,,1241147637123948547,https://twitter.com/sak386/status/1241147637123948547
2020-03-20 23:39:33,ijenns318,,0,0,1,"Yo negative people, take that bad energy away from me. We all know what’s happening right now but there’s no need to freak out and cause extra anxiety. I’m just trying to have good vibes and make the best of what I can, and so should everyone else",,,,1241147397524373505,https://twitter.com/ijenns318/status/1241147397524373505
2020-03-20 23:37:59,TheFFRealist,,6,14,25,"Between anxiety, work, and all that’s going on, I’m going to try and spread some good vibes like everyone else. Who are your three people whose tweets entertain you the most. I’ll start: @gkittle46 @FFHitman @EvanSowards",,@gkittle46 @FFHitman @EvanSowards,,1241147000818671617,https://twitter.com/TheFFRealist/status/1241147000818671617
2020-03-20 23:36:28,kmfalk,ThePubliusUSA,0,0,1,"I woke up with a horrible hangover and the worst anxiety I have ever had! https://twitter.com/ThePubliusUSA/status/1241085607553773569 …",,,,1241146622861438976,https://twitter.com/kmfalk/status/1241146622861438976
2020-03-20 23:35:32,LanaBoo52,starheal,0,0,0,"And the ones that are bof don’t know how tf to feel so imagine the anxiety https://twitter.com/starheal/status/1241025737932636160 …",,,,1241146385203957760,https://twitter.com/LanaBoo52/status/1241146385203957760
2020-03-20 23:34:16,rmurr1,,0,0,1,"Anyone else with anxiety and depression really struggling with all of this nonstop scary and negative news?",,,,1241146066923335680,https://twitter.com/rmurr1/status/1241146066923335680
2020-03-20 23:33:43,elHappyCoach,,0,0,0,"Ready to Uplift Consciusness or just simply Reduce Stress in Anxiety? Breathing is something you do automatic and by simply being aware of it and having the ability to consciously shift it when required, you can… https://www.instagram.com/p/B9-VmCdgshu/?igshid=sxsvmr49pshz …",,,,1241145927173165056,https://twitter.com/elHappyCoach/status/1241145927173165056
2020-03-20 23:29:44,MilamDyslexia,,1,0,13,"I’m sure I don’t need to explain that I use humor to reduce anxiety.... so #wfisdchat @WFISDschools @MilamBengals just wanted y’all to know “I miss y’all like Walmart shelves miss the toilet paper!”pic.twitter.com/b4MrEv9rew",,@WFISDschools @MilamBengals,#wfisdchat,1241144924680183817,https://twitter.com/MilamDyslexia/status/1241144924680183817
2020-03-20 23:28:09,James_The_Nerd,,0,0,0,"It’s the Last Friday I’m gonna be allowed here. Another beautiful sunset to calm my anxiety. pic.twitter.com/2VUVh7Ux1W – at Lake Riviera Park",,,,1241144528465276929,https://twitter.com/James_The_Nerd/status/1241144528465276929
2020-03-20 23:26:41,fitscillaa_,,0,0,1,"I feel a pain in my chest and it's probably just my anxiety but can't help and think it's the virus...",,,,1241144160951742464,https://twitter.com/fitscillaa_/status/1241144160951742464
2020-03-20 23:23:57,momentumbrew,,0,0,1,"In an effort to break up some of the anxiety/uncertainty we are seeing all over social media, we’d like an opportunity to share the #DailyPositiveMomentum. While we recognize it is a hard time for everyone, there is… https://www.instagram.com/p/B9-UkBYA59r/?igshid=1f1rnzmxphh49 …",,,#DailyPositiveMomentum,1241143471529844736,https://twitter.com/momentumbrew/status/1241143471529844736
2020-03-20 23:23:27,KevinFrankish,,2,14,54,"Join me and @DrKatyKamkar as we deal with the anxiety and fear surrounding social distancing and self isolation. FACEBOOK LIVE | First Aid For Your Mental Health | Tomorrow (Saturday) 7pm. | http://facebook.com/kevinfrankish pic.twitter.com/XchLxA4oPv",,@DrKatyKamkar,,1241143343888977921,https://twitter.com/KevinFrankish/status/1241143343888977921
2020-03-20 23:22:42,Karla4Houston,,0,0,2,"HAPPENING NOW Mayor’s Press Conference: A video and audio message is circulating on social media that falsely claims the COH is shutting down, creating a great deal of anxiety. Mayor Turner will address the rumors and discuss what he is doing to stop the message from circulating",,,,1241143157301161996,https://twitter.com/Karla4Houston/status/1241143157301161996
2020-03-20 23:21:22,nikkictl,,1,0,11,"pro tip: if you’re having an anxiety/panic attack, just let your Apple TV get to screensaver mode.. their graphics are very soothing.. and yes I’m speaking from experience",,,,1241142819026137088,https://twitter.com/nikkictl/status/1241142819026137088
2020-03-20 23:21:13,ayeitskaren55,hey_ciara,0,0,0,"This video gave me so much anxiety https://twitter.com/hey_ciara/status/1240349773812699137 …",,,,1241142783982874624,https://twitter.com/ayeitskaren55/status/1241142783982874624
2020-03-20 23:19:49,almamariex,,0,0,0,"My bottom lip is torn up from my anxiety. I hate it here",,,,1241142431996936200,https://twitter.com/almamariex/status/1241142431996936200
2020-03-20 23:17:59,LunarWilderness,,0,1,10,"Having anxiety disorders in the current state of the world sucks. Am I having difficulty breathing because I’m in a constant state of panic? Are my poops messed up for the same reason? Idk guess I’ll just die",,,,1241141968127889414,https://twitter.com/LunarWilderness/status/1241141968127889414
2020-03-20 23:17:33,tnbrdgr,eeberquist,0,0,0,"Absolutely go into the woods because I have anxiety but I’m also reckless so",,,,1241141858971062272,https://twitter.com/tnbrdgr/status/1241141858971062272
2020-03-20 23:16:07,johnlimdimas,LittleLeonessa,0,0,1,"Its perfect fine! You be you! I know it's very difficult for most people to overcome this, but to me as long as you accept the fact you have this camera anxiety, you've already won. After all that's what makes every #contentcreators unique ASF like you!",,,#contentcreators,1241141499934408704,https://twitter.com/johnlimdimas/status/1241141499934408704
2020-03-20 23:16:02,gogoadaggio,,0,0,0,"sorry guys on episode 2 now and im really having anxiety for these people proposing or even saying i love you??? also jessica is already annoying me",,,,1241141479344652290,https://twitter.com/gogoadaggio/status/1241141479344652290
2020-03-20 23:15:43,FrankieVizzle,,4,0,18,"I ate an almond while grocery shopping & it went down the wrong tube... I couldn’t stop coughing... definitely gave everyone around me an anxiety attack!",,,,1241141400118255616,https://twitter.com/FrankieVizzle/status/1241141400118255616
2020-03-20 23:15:42,yooooooooRIPPSH,,1,0,0,"*girl I haven’t seen in a month sees me* *hugs me, inducing major anxiety attack* *hugs me again 30 seconds later*",,,,1241141396310032387,https://twitter.com/yooooooooRIPPSH/status/1241141396310032387
2020-03-20 23:15:14,VincentLonga,went1955,0,0,3,"Reading this really helped my anxiety right now. https://twitter.com/went1955/status/1240523111814123526 …",,,,1241141276747038720,https://twitter.com/VincentLonga/status/1241141276747038720
2020-03-20 23:14:08,carlybella_,,0,0,2,"Alys*n St*ner’s live streams give me anxiety",,,,1241141001898676225,https://twitter.com/carlybella_/status/1241141001898676225
2020-03-20 23:13:28,jessica_lee1215,kar__LIT__a,1,1,3,"Parents, they sure know how to trigger our anxiety and self-doubt. Stay strong my queen, you are capable of doing anything you set your mind to!",,,,1241140831224020994,https://twitter.com/jessica_lee1215/status/1241140831224020994
2020-03-20 23:12:47,JulieLinden5,earthnamek,0,0,0,"I’m seventy with some fairly significant anxiety issues and PTSD. I do ok but I wouldn’t ever do a extenuating life saving methods if I got really sick. I wish there were a system there for you that would be more helpful. My daughter suggested a drive through cigarette store",,,,1241140660566142976,https://twitter.com/JulieLinden5/status/1241140660566142976
2020-03-20 23:11:32,sgaigexo,,0,0,0,"my anxiety has been thru the freakin’ roof today",,,,1241140347348168706,https://twitter.com/sgaigexo/status/1241140347348168706
2020-03-20 23:11:25,SEgeberg,__evelynsaenz,1,0,1,"I completely understand your anxiety. Sending you so much strength. Keep your distance from everyone!! Stay in & safe. praying for you girl. It’s so scary.",,,,1241140316310142976,https://twitter.com/SEgeberg/status/1241140316310142976
2020-03-20 23:10:53,sierrabwitchin,sierrabwitchin,0,0,1,"*not to trivialize the severity of the virus, but just to illustrate my level of anxiety",,,,1241140183409410049,https://twitter.com/sierrabwitchin/status/1241140183409410049
2020-03-20 23:08:58,PamGerity,politicalmath,0,0,0,"Yeah, this is causing a lot of anxiety in the population most at risk from the virus.",,,,1241139699034607621,https://twitter.com/PamGerity/status/1241139699034607621
2020-03-20 23:08:44,mustafarashed,nmarzano,0,0,2,"Anxiety fam.",,,,1241139640775643136,https://twitter.com/mustafarashed/status/1241139640775643136
2020-03-20 23:08:06,BestDeporter,,0,0,0,"Eternal Atake?? Nah, Eternal Anxiety",,,,1241139482029670406,https://twitter.com/BestDeporter/status/1241139482029670406
2020-03-20 23:06:25,NYFarmer,JaniceKimTV,0,1,8,"Totally! To not have a family for help. She rents a modest apartment from a friend. Much anxiety tonight in our area, for sure.",,,,1241139058212036610,https://twitter.com/NYFarmer/status/1241139058212036610
2020-03-20 23:06:19,madisonbatts,AprilDRyan,0,0,1,"Yes I am scared to death of this invisible virus. 61 yrs old with emphysema. Alone. Family in Ca. No savings. Trump adds to my anxiety daily because he's a liar and has no plan. I'm praying for everybody until #DrFauci & the medical community find a cure. Please keep 45* off TV!",,,#DrFauci,1241139035386580994,https://twitter.com/madisonbatts/status/1241139035386580994
2020-03-20 23:05:14,big_michie,,0,2,6,"I have anxiety about running out of things but I’m fighting my urges because I legit do have everything I need.",,,,1241138760290652161,https://twitter.com/big_michie/status/1241138760290652161
2020-03-20 23:03:15,theMHcomedian,,0,1,3,"Who cares for those who care for our fur babies? https://www.expertclick.com/NRWire/Releasedetails.aspx?id=229320 … #suicideprevention #mentalhealth #mentalhealthawareness #depression #anxiety #mentalillness #suicide #mentalhealthmatters #selfcare #ptsd #endthestigma #suicideawareness #selflove #depressionhelp",,,#suicideprevention #mentalhealth #mentalhealthawareness #depression #anxiety #mentalillness #suicide #mentalhealthmatters #selfcare #ptsd #endthestigma #suicideawareness #selflove #depressionhelp,1241138260400730114,https://twitter.com/theMHcomedian/status/1241138260400730114
2020-03-20 23:02:38,marybethliving7,PeterAlexander,0,1,0,"This was a gimme question and instead of taking opportunity to reassure he attacks. Proves all he wants is to calm the markets. No concern for people's anxieties. https://twitter.com/PeterAlexander/status/1241061139007574016 …",,,,1241138107203739648,https://twitter.com/marybethliving7/status/1241138107203739648
2020-03-20 23:00:59,BobbyJRockaway,,3,1,11,"Anybody else feel like they’re battling a never ending anxiety attack?",,,,1241137693205151760,https://twitter.com/BobbyJRockaway/status/1241137693205151760
2020-03-20 22:58:07,LT_4EverFreeFit,,0,0,0,"Click the link_tre It's not just as weight loss tea, it's a cleanse of the toxin in the body, it for skin, hair, nails, anxiety, clarity, its anti-inflammatory support compounds to help relieve joint and muscle… https://www.instagram.com/p/B9-Rm4FB9CK/?igshid=10xzhs3zz1u7f …",,,,1241136971067600897,https://twitter.com/LT_4EverFreeFit/status/1241136971067600897
2020-03-20 22:57:50,HighmillerCj,,1,1,0,"My anxiety has been horrible like off the charts horrible today I have taken my meds but it’s not helping pic.twitter.com/t4M2PWoRWR",,,,1241136899307311120,https://twitter.com/HighmillerCj/status/1241136899307311120
2020-03-20 22:56:47,rubyclaire63,Louis_Allday,0,0,0,"^^^^THIS Someone finally said perfectly what I’ve been feeling & what’s been contributing so greatly to my anxiety.",,,,1241136633417613312,https://twitter.com/rubyclaire63/status/1241136633417613312
2020-03-20 22:56:12,ReyJas,,0,0,0,"I’m just wondering if anyone else is fighting there anxiety pretty hard lately ? And please tell me , how do you deal ? @Chenango Forks, New York https://www.instagram.com/p/B9-RZD4Hujy2V_o08B-IQdg8uo1ZX_bCOkh1tk0/?igshid=hbzojzedcx2w …",,@Chenango,,1241136487531524096,https://twitter.com/ReyJas/status/1241136487531524096
2020-03-20 22:56:09,deidreDangg,,0,0,2,"You guys. I was a little winded and started feeling a little shortness of breathe and started to FREAK OUT!!! Hahahahaha any little symptom, and my anxiety runs",,,,1241136475988688904,https://twitter.com/deidreDangg/status/1241136475988688904
2020-03-20 22:55:41,karensuttonmd,,4,6,53,"Managing Anxiety COVID-19 Tips from HSS Psych Know how you respond to stress Take control, Take action Utilize and develop coping skills @hspecialsurgery @AOSSM_SportsMed @aaos_1 @ASESmembers @worldlaxsport @ILWomen @prowomenslax @USLacrosse #anxiety #covid_19 #hsspic.twitter.com/CshLHqmLph – at HSS Stamford Outpatient Center",,@hspecialsurgery @AOSSM_SportsMed @aaos_1 @ASESmembers @worldlaxsport @ILWomen @prowomenslax @USLacrosse,#anxiety #covid_19 #hsspic,1241136357428396034,https://twitter.com/karensuttonmd/status/1241136357428396034
2020-03-20 22:55:36,snowolf_x,,0,0,0,"ok seriously tho, #AnimalCrossingNewHorizons could NOT HAVE COME AT A BETTER TIME I have severe anxiety so this is the most calming thing I can think of to distract me",,,#AnimalCrossingNewHorizons,1241136336947601408,https://twitter.com/snowolf_x/status/1241136336947601408
2020-03-20 22:55:33,WillieSparks,,0,0,0,"Before all of the coronavirus mess, I was looking for ways to deal with stress & anxiety. I discovered the awesome benefits of CBD. I tend to get really bad anxiety which sometimes can trigger my mood swings.Those… https://www.instagram.com/p/B9-RUDgJmwJ/?igshid=i0ktk047ujm …",,,,1241136324482142209,https://twitter.com/WillieSparks/status/1241136324482142209
2020-03-20 22:54:34,TheFieldSpfd,,0,0,0,"40 Days of Praise: Day 5 Scriptures Adapted from ""Your Rx: 40 Scriptures that Combat Worry, Fear, Anxiety and Panic,"" by Dr Michelle Bengtson Scripture: Luke 12:25-26 What’s the use of worrying? What good does it… https://www.instagram.com/p/B9-RM1QpXNw/?igshid=1ipyvek3fp8k6 …",,,,1241136076779065351,https://twitter.com/TheFieldSpfd/status/1241136076779065351
2020-03-20 22:53:12,mayatalamantezz,,0,0,6,"please be extra sensitive and kind to ur peers with ocd or health anxiety, this is their worst nightmare",,,,1241135732372254722,https://twitter.com/mayatalamantezz/status/1241135732372254722
2020-03-20 22:52:20,Carleets,,0,0,2,"Still getting my sweat on every day, at home. The movement helps with the chaos, anxiety, and the fear that creeps in. These are some interesting times. Stay healthy and find the… https://www.instagram.com/p/B9-Q8kGAAh9GOkZZRvy5nrWVeEGb_EfPc2Qb0U0/?igshid=1v9k6ocgfd2oa …",,,,1241135513626726405,https://twitter.com/Carleets/status/1241135513626726405
2020-03-20 22:52:08,cheyenneloring,averygetscake,1,0,1,"it used to help with my anxiety so much as a kid and now i feel like i need it again",,,,1241135463974547465,https://twitter.com/cheyenneloring/status/1241135463974547465
2020-03-20 22:51:21,KatelynRST,,1,0,0,"My brain makes it hard to feel loved so when someone is distant and doesnt express their love my anxiety is like see no one can love you you stupid pos",,,,1241135265776717824,https://twitter.com/KatelynRST/status/1241135265776717824
2020-03-20 22:50:58,KennyLester13,,3,41,103,"NBC and Peter Alexander have spread fear and anxiety with a constant barrage of hyped stories about the Chinese Virus Now they ask the President to calm everyone down They play the victim when he calls them out on it. Typical liberal playbook",,,,1241135171342131200,https://twitter.com/KennyLester13/status/1241135171342131200
2020-03-20 22:47:19,Clarissa_Laskey,,8,6,57,"My 9 year old daughter deals with extreme anxiety & being out of school, away from friends + schedule has been tough on her. Today her teacher did a @zoom_us call with the class & then she and the girl 2 doors away blew bubbles to each other. I cried. #FridayThoughtspic.twitter.com/FEIPsdODVh",,@zoom_us,#FridayThoughtspic,1241134252563062785,https://twitter.com/Clarissa_Laskey/status/1241134252563062785
2020-03-20 22:47:07,rosentrain,,0,0,2,"We’re living in anxiety-inducing times. So make the decision to work out. Daily. I promise you’ll feel better.",,,,1241134200184504320,https://twitter.com/rosentrain/status/1241134200184504320
2020-03-20 22:45:56,LKaderlik,,0,0,3,"There should be a symptom checker called “is it corona virus or my extreme anxiety being 100X more extreme than usual.”",,,,1241133903504687105,https://twitter.com/LKaderlik/status/1241133903504687105
2020-03-20 22:45:02,GabeCanales,,0,2,3,"Media: Pls interview #MentalHealth experts sharing tips & demonstrating (breathing exercises,etc) HOW TO reduce #anxiety/ #stress. It’s a tough time for all. #coronavirus @KPRC2Dominique @sharronmelton01 @KPRC2Andy @rashivats @GinaGaston13 @lencannonKHOU @MelissAguilar #Houston",,@KPRC2Dominique @sharronmelton01 @KPRC2Andy @rashivats @GinaGaston13 @lencannonKHOU @MelissAguilar,#MentalHealth #anxiety #stress #coronavirus #Houston,1241133676051775488,https://twitter.com/GabeCanales/status/1241133676051775488
2020-03-20 22:44:15,latavia_nicole,bonitam08,0,0,0,"Oh it’s coming watch, after her anxiety wears off if she can find a good ass deal she’s getting it. Trust she has not stop looking",,,,1241133479686889472,https://twitter.com/latavia_nicole/status/1241133479686889472
