date,username,to,replies,retweets,favorites,text,geo,mentions,hashtags,id,permalink
2020-03-25 23:58:05,rosemcclainnn,,2,0,8,"Shortness of breath rn and it’s just my anxiety but it’s making me more anxious ha. I fucking hate it here.",,,,1242963999848894468,https://twitter.com/rosemcclainnn/status/1242963999848894468
2020-03-28 20:07:18,sergistack,,192,478,1084,"¿USAS GOOGLE CHROME? Lo siento por las mayúsculas, pero existe un nuevo navegador que es más rápido y más privado que Chrome (bloquea los anuncios y los rastreadores, lo cual ahorra tiempo de carga). La interfaz es exactamente igual que la de Chrome, Brave lo supera en todo.",,,,1243993087531266049,https://twitter.com/sergistack/status/1243993087531266049
2020-03-25 23:55:05,ShaunRas31,,0,0,0,"If you’re feeling whelmed or anxious, reach out to someone to talk. New Yorkers can call the #COVID19 Emotional Support Hotline at 1-844-863-9314. There you can schedule a time to talk with a #mentalhealth professional at no charge.pic.twitter.com/foMLuapYTD",,,#COVID19 #mentalhealth,1242963243984924673,https://twitter.com/ShaunRas31/status/1242963243984924673
2020-03-25 23:53:39,JadeRei,,1,0,0,"Transcribing the Ep 166, but had to take a break. I have been feeling ""bleh"" most of today. Not sure why. I'm anxious about... nothing? pic.twitter.com/gTaYFDC2GK",,,,1242962885044662279,https://twitter.com/JadeRei/status/1242962885044662279
2020-03-25 23:48:04,KyleJSwanson,,2,5,13,"“Do not be anxious about anything, but in everything by prayer and supplication with thanksgiving let your requests be made known to God. And the peace of God, which surpasses all understanding, will guard your hearts and minds in Christ Jesus” Philippians 4:6–7 #TruthToLiveBy",,,#TruthToLiveBy,1242961480741351425,https://twitter.com/KyleJSwanson/status/1242961480741351425
2020-03-25 23:43:49,sweetmelissas,,0,0,0,"Feeling anxious about #corona and in need of a good cry? May I recommend listening to “Fire and Rain” while cutting onions?",,,#corona,1242960408325033991,https://twitter.com/sweetmelissas/status/1242960408325033991
2020-03-25 23:32:50,everydayanjali,,0,0,0,"Watching @LoveisBlindShow and it’s making me way too anxious! and I’m on the first episode",,@LoveisBlindShow,,1242957647910821888,https://twitter.com/everydayanjali/status/1242957647910821888
2020-03-25 23:27:54,Rebecca_Alabama,,0,0,5,"Feeling a little anxious and overwhelmed. Here is a picture of my dog looking doofus-y. pic.twitter.com/qtCvQI0LaD",,,,1242956404090114053,https://twitter.com/Rebecca_Alabama/status/1242956404090114053
2020-03-25 23:25:13,Danniducci,,0,0,1,"not working has me anxious af how do you bitches do this everyday",,,,1242955728844922881,https://twitter.com/Danniducci/status/1242955728844922881
2020-03-25 23:11:49,eeiglesias,,1,0,3,"@PascoSheriff #9PMRoutine green in California.. this COVID-19 shelter in place is going to make me more anxious than what my current levels are at.. pic.twitter.com/8aPP3XrR41",,@PascoSheriff,#9PMRoutine,1242952359002562561,https://twitter.com/eeiglesias/status/1242952359002562561
2020-03-25 23:11:28,brandon_ishak_,,0,0,3,"The most consistent person in my life is the Duolingo owl and his thinly veiled threats to practice Dutch make me incredibly anxious",,,,1242952269139595265,https://twitter.com/brandon_ishak_/status/1242952269139595265
2020-03-25 23:11:24,Subatonics,,0,0,1,"All these until tomorrow posts give me anxious of something threatening is about to happen.",,,,1242952253431930881,https://twitter.com/Subatonics/status/1242952253431930881
2020-03-25 23:05:30,JustinTMichael,,3,0,37,"Stay connected. After talking to my parents on the phone for 2 hours yesterday & my friends for a few hours today, it’s crazy how much less anxious I feel. We’re not alone in this.",,,,1242950767889137664,https://twitter.com/JustinTMichael/status/1242950767889137664
2020-03-25 22:46:33,daniellab240,,0,0,1,"Can we please stop talking about COVID-19 24/7? It makes a lot of people anxious and scared and people with anxiety disorders it doesn’t help seeing all this everywhere.",,,,1242945998059532288,https://twitter.com/daniellab240/status/1242945998059532288
2020-03-25 22:42:31,steve_foxe,Mister_Walsh,1,1,15,"PROVIDENCE is one of the few horror comics I consider genuinely *scary*, as in parts of it made me anxious to turn the page. Some sequences in easy volumes of I AM A HERO are up there too. Most other great horror comics strike me as disturbing or unnerving more than SCARY.",,,,1242944984686477313,https://twitter.com/steve_foxe/status/1242944984686477313
2020-03-25 22:40:06,connectnowli,,0,1,1,"We've noticed during these anxious times that it helps to put words to what's troubling us...and perhaps to know that we, at International, are praying for you too. Why don't you give it a try. How can we pray for you? pic.twitter.com/V2aap1st0U",,,,1242944377250631681,https://twitter.com/connectnowli/status/1242944377250631681
2020-03-25 22:23:53,NicoleDrumroll,,1,0,1,"I don't know how long this has been going on but nothing about me has changed. I'm still the same lazy anxious person",,,,1242940293147656195,https://twitter.com/NicoleDrumroll/status/1242940293147656195
2020-03-25 22:17:46,_karlayadira,,0,0,3,"I know I’ve been bitching about having to work through this whole pandemic. I get seriously anxious sometimes. I am however grateful to still have a job and guaranteed hours while so many of my friends and loved ones have been laid off or are at home without pay...",,,,1242938755054473217,https://twitter.com/_karlayadira/status/1242938755054473217
2020-03-25 22:15:52,tracefayce86,,1,0,3,"Youtubers i watch during social distancing @RavenElyseTV @Jayjaysbeauty @JeffreeStar @Evettexo seriously have helped distract me from whats happening. It’s a unique and anxious time in history.",,@RavenElyseTV @Jayjaysbeauty @JeffreeStar @Evettexo,,1242938277142855685,https://twitter.com/tracefayce86/status/1242938277142855685
2020-03-25 22:14:52,girlfriendpasta,,0,0,1,"My sister got assigned to the COVID-19 testing wing and will be working directly with patients who have the virus I’m not anxious at all",,,,1242938025493102593,https://twitter.com/girlfriendpasta/status/1242938025493102593
2020-03-25 22:11:44,vincentturner22,,0,0,1,"My anxious brain after reading stories of people under 60 dying of the rona pic.twitter.com/quMrjT4mE7",,,,1242937235734962181,https://twitter.com/vincentturner22/status/1242937235734962181
2020-03-25 22:02:09,DotThrash,Eeezy_E,0,0,0,"Once that weather get nice. Niggas gonna start getting even more anxious",,,,1242934826598117382,https://twitter.com/DotThrash/status/1242934826598117382
2020-03-28 20:07:18,sergistack,,192,478,1084,"¿USAS GOOGLE CHROME? Lo siento por las mayúsculas, pero existe un nuevo navegador que es más rápido y más privado que Chrome (bloquea los anuncios y los rastreadores, lo cual ahorra tiempo de carga). La interfaz es exactamente igual que la de Chrome, Brave lo supera en todo.",,,,1243993087531266049,https://twitter.com/sergistack/status/1243993087531266049
2020-03-25 22:00:16,ladylilith93,,0,0,2,"Feeling super anxious today",,,,1242934352855486464,https://twitter.com/ladylilith93/status/1242934352855486464
2020-03-25 21:58:46,93tillsteez,,0,0,1,"Crush told me she’s taking this social distancing seriously that’s why I haven’t gotten a text in weeks and I totally understand!! So glad her Work husband has been there with here keeping her safe though and making her dinner. I know how anxious she’s been!",,,,1242933971878641664,https://twitter.com/93tillsteez/status/1242933971878641664
2020-03-25 21:57:48,biloobang,,0,0,0,"i hate the sad & anxious vibes i’ve gotten off of people these last few days",,,,1242933729489715201,https://twitter.com/biloobang/status/1242933729489715201
2020-03-25 21:56:59,theDiamondStar,,0,0,0,"During this pandemic, like many other stressful occasions written in the Bible, God does not want us to worry but to place our trust and faith in Him. He reminds us over and over again not to worry or be anxious.… https://www.instagram.com/p/B-LClj_nEiV/?igshid=ipobu6e0xq2v …",,,,1242933524581289991,https://twitter.com/theDiamondStar/status/1242933524581289991
2020-03-25 21:54:28,swifthargitay,,3,0,2,"no one cares about this lmao I don’t think anyone even reads what I tweet anymore because I’m a fucking mess but whatever. Pls comment things to make me smile because I’m really anxious these days and I feel like my life is falling apart.",,,,1242932890138226694,https://twitter.com/swifthargitay/status/1242932890138226694
2020-03-25 21:48:56,brianareyna01,,1,0,0,"If I ever don’t respond or leave you on seen just now it’s not you, it’s that I get real mf anxious texting & i hate it",,,,1242931498740842497,https://twitter.com/brianareyna01/status/1242931498740842497
2020-03-25 21:48:06,KellyRobNews,,0,3,11,"Sad, anxious, grateful, stressed, empathetic, confused, calm. just a bit of the range of emotions I’ve felt since starting coverage on the COVID19 outbreak. Today I add honored to the list. @SCSK12Unified and WMC teaming up to help the most vulnerable kidshttps://www.wmcactionnews5.com/2020/03/25/wmc-partners-with-shelby-county-schools-broadcast-home-lessons-students-during-covid-pandemic/ …",,@SCSK12Unified,,1242931288845287428,https://twitter.com/KellyRobNews/status/1242931288845287428
2020-03-25 21:17:01,iTold_U_ImChris,_rarestsoul,1,0,0,"It help me settle down but it can make me anxious in public",,,,1242923468322148352,https://twitter.com/iTold_U_ImChris/status/1242923468322148352
2020-03-25 21:10:57,MegzM4,RunhappyKat,1,0,1,"It was I have been reading your tweets about these current times and I feel what you’re feeling. It’s a never ending anxious nightmare. But I keep trying. I know you will too",,,,1242921940135927809,https://twitter.com/MegzM4/status/1242921940135927809
2020-03-25 21:09:52,___inCANdescent,VtheEsquire,1,13,14,"What made you anxious to get on here and say stealthing wasn’t “technically” against the law? https://twitter.com/VtheEsquire/status/1242866903577767937 …",,,,1242921667220901893,https://twitter.com/___inCANdescent/status/1242921667220901893
2020-03-25 20:58:11,RenisonELI,,0,0,0,"Stressed, anxious, worried? We are here to help you! 90 minute single counselling sessions are available with Student Services Counsellor Priscilla Sihn by video chat or phone. Contact Priscilla at esihn@uwaterloo.ca today! pic.twitter.com/d8cdk9SGgw",,@uwaterloo,,1242918725281595393,https://twitter.com/RenisonELI/status/1242918725281595393
2020-03-25 20:49:19,phonehomeee,madddieice,1,0,2,"every time i get anxious i just paint them it helps",,,,1242916495245672448,https://twitter.com/phonehomeee/status/1242916495245672448
2020-03-25 20:36:04,mwes10,johnwylie,2,0,0,"Let’s do all the things...NOW!!!! I’m anxious to see how many will go back to the Sunday show priority when this all ends and immediately forget the advantages digital created for enhancing relationships from Sunday to Sunday.",,,,1242913161151479810,https://twitter.com/mwes10/status/1242913161151479810
2020-03-25 20:32:56,pinchejoce,,0,0,3,"can az pls do SOMETHING im getting anxious",,,,1242912374253731840,https://twitter.com/pinchejoce/status/1242912374253731840
2020-03-25 20:30:11,zzsmiller,tgall1345,0,0,0,"They shall remain anxious!",,,,1242911681950429190,https://twitter.com/zzsmiller/status/1242911681950429190
2020-03-25 20:25:25,cinnamoronroll,,1,1,2,"I just think it’s funny how my medication for my anxiety makes me more anxious",,,,1242910479984533504,https://twitter.com/cinnamoronroll/status/1242910479984533504
2020-03-25 20:20:13,BatsyBelfry,,0,0,1,"""So when you get anxious feel free to grab my tail!""",,,,1242909170640261121,https://twitter.com/BatsyBelfry/status/1242909170640261121
2020-03-25 20:05:23,SocialWorkItOut,,2,0,2,"""Women giving birth at two leading New York City hospital networks are being told they must labor without spouses, partners or doulas by their side — leaving the expectant mothers anxious and frightened about their upcoming deliveries."" #COVID19https://www.nytimes.com/2020/03/24/parenting/coronavirus-labor-birth.html …",,,#COVID19https,1242905440247300097,https://twitter.com/SocialWorkItOut/status/1242905440247300097
2020-03-25 20:03:23,MaryLauzet,VABVOX,0,0,0,"This article is heartbreaking but also made me anxious. My husband and I could be Lustig. Or worse, her husband. We're raising our 14 yo grandson. God speed.",,,,1242904937006153728,https://twitter.com/MaryLauzet/status/1242904937006153728
2020-03-25 20:00:34,tafebellangere,,0,0,0,"Desperately anxious to finally get back to daddy. @Chicago O'Hare International Airport https://www.instagram.com/p/B-K1Q2HjOa0/?igshid=bgglafn7duda …",,@Chicago,,1242904229053968384,https://twitter.com/tafebellangere/status/1242904229053968384
2020-03-28 20:07:18,sergistack,,192,478,1084,"¿USAS GOOGLE CHROME? Lo siento por las mayúsculas, pero existe un nuevo navegador que es más rápido y más privado que Chrome (bloquea los anuncios y los rastreadores, lo cual ahorra tiempo de carga). La interfaz es exactamente igual que la de Chrome, Brave lo supera en todo.",,,,1243993087531266049,https://twitter.com/sergistack/status/1243993087531266049
2020-03-25 20:00:15,kimmie_kittykat,,0,0,0,"@LouMalnatis Are there still plans to open a new carry out & delivery location in Glendale, AZ? Just curious if and when that might be? That will be the closest location to me and I’m anxious to have Lou’s close to home!",,@LouMalnatis,,1242904148153995264,https://twitter.com/kimmie_kittykat/status/1242904148153995264
2020-03-25 19:57:49,Yariyarixo,,0,1,3,"I made a short video explaining my situation due to COVID-19. I’ve been very nervous and anxious about posting this but I hope this helps someone in a similar situation ______ LINK IN BIO for full vid. pic.twitter.com/oU8pzMSwCP",,,,1242903536486223874,https://twitter.com/Yariyarixo/status/1242903536486223874
2020-03-25 19:55:10,JenniferNorris2,littlesnoopy,0,0,2,"Mine too! I think maybe she’s feels better now that we are all anxious.",,,,1242902868807405568,https://twitter.com/JenniferNorris2/status/1242902868807405568
2020-03-25 19:48:26,jatieko,,0,0,0,"Another day, another walk in the books. It's keeping ALL of us from going crazy or being anxious....I'm thankful for our walks. #stayingsane #anxietyrelief #stressrelief #getoutside #dogbutts… https://www.instagram.com/p/B-Kz3j8BUjL/?igshid=1jgwx3esjacfw …",,,#stayingsane #anxietyrelief #stressrelief #getoutside #dogbutts,1242901174908530692,https://twitter.com/jatieko/status/1242901174908530692
2020-03-25 19:23:57,dewill90,Anxious_Lib,0,0,1,"Sorry for your loss. It's never easy. Keep yourself well!",,,,1242895011252973568,https://twitter.com/dewill90/status/1242895011252973568
2020-03-25 19:14:57,MichelleOnlock,,0,0,17,"I know that there is so much uncertainty in the world right now and everyone is anxious but as PGY5’s right now, we don’t even know where to place our anxieties",,,,1242892749503967239,https://twitter.com/MichelleOnlock/status/1242892749503967239
2020-03-25 19:09:27,lawrenciiaaa,,2,48,156,"I cannot focus for online classes and It’s making me anxious literally and I wanna screammmm lol. Anyone else ? Or is this just meee",,,,1242891365182251016,https://twitter.com/lawrenciiaaa/status/1242891365182251016
2020-03-25 19:07:40,IAmDeidre__,,0,0,0,"Even though I know everything is on Gods timing, sometimes I still get anxious and wonder when exactly is my time for certain things...",,,,1242890915334807552,https://twitter.com/IAmDeidre__/status/1242890915334807552
2020-03-25 19:05:55,fiercefab,cbcpodcasts,0,0,3,"Anxious orchid — a strictly indoor gardening podcast (Bright note: This is the real orchid that inspired the name. I thought she was dead but she was just sleeping! Look at all those other bulbs too. this one’s got potential!) pic.twitter.com/Bb36HNBlyU",,,,1242890472277803014,https://twitter.com/fiercefab/status/1242890472277803014
2020-03-25 19:01:47,alyssiaxoxoxo,,0,0,0,"Tomorrow I will start working from home, and I’m feeling very anxious about it.",,,,1242889435814993933,https://twitter.com/alyssiaxoxoxo/status/1242889435814993933
2020-03-25 18:50:32,AmazinglyCeCe,naima,0,0,0,"Whew! I don't think I can do it but I'm anxious to see everyone else's brackets https://twitter.com/naima/status/1242884044586655746 …",,,,1242886604907298816,https://twitter.com/AmazinglyCeCe/status/1242886604907298816
2020-03-25 18:49:43,jacquelineeegee,,1,0,2,"*sigh* I hope the phone call goes well... I’m not a big talker over the phone so, let’s see how this goes *feeling anxious*",,,,1242886397775638529,https://twitter.com/jacquelineeegee/status/1242886397775638529
2020-03-25 18:46:24,WhatKasey,bdebono1,0,0,0,"Haha- that is kinda what twitter is and kinda funny your complaining about my complaining. People are anxious and hoping our government would help people by worrying about one less thing-money. I also said that if I lose my job but it saves lives totally worth it. People over $$$",,,,1242885562672939008,https://twitter.com/WhatKasey/status/1242885562672939008
2020-03-25 18:44:11,AARPDC,,1,5,3,"Are you caring for a loved one and anxious about COVID-19? Visit the following link for helpful resources for family caregivers: http://aarp.org/caregiving/ @DCAgingNews",,@DCAgingNews,,1242885005661044742,https://twitter.com/AARPDC/status/1242885005661044742
2020-03-25 18:43:58,kimchocolate,,0,0,0,"i hate when someone texts me if they can ask me something and they proceed to spend their sweet time to ask me. ask me asap, i’m mad and anxious now",,,,1242884948513542144,https://twitter.com/kimchocolate/status/1242884948513542144
2020-03-25 18:43:05,salvy_ting,prettyrockyroad,1,0,0,"It’s being locked in the house. Makes me anxious and when I’m anxious i spend money. It’s so unhealthy",,,,1242884729357111298,https://twitter.com/salvy_ting/status/1242884729357111298
2020-03-25 18:29:30,RVoronaCote,,1,2,10,"I do want to mention, however, for those who also might be depressed or anxious, that it is not self-indulgent to pause before attempting to recalibrate. Sometimes we only have enough energy to make it from one moment to the next. You are allowed—encouraged—to take your time.",,,,1242881308914827264,https://twitter.com/RVoronaCote/status/1242881308914827264
2020-03-25 18:29:26,Cleemdawg,,1,1,1,"I'm honestly anxious",,,,1242881293932781568,https://twitter.com/Cleemdawg/status/1242881293932781568
2020-03-25 18:28:52,TatumMetzger,,0,0,0,"Can it be Friday yet?? Ugh!!! #anxious",,,#anxious,1242881151162888195,https://twitter.com/TatumMetzger/status/1242881151162888195
2020-03-25 18:28:30,JoeKarlsson1,,10,2,32,"Feeling too anxious and distracted to make any TikToks right now. It's hard for me to be very productive right now.",,,,1242881059777363970,https://twitter.com/JoeKarlsson1/status/1242881059777363970
2020-03-28 20:07:18,sergistack,,192,478,1084,"¿USAS GOOGLE CHROME? Lo siento por las mayúsculas, pero existe un nuevo navegador que es más rápido y más privado que Chrome (bloquea los anuncios y los rastreadores, lo cual ahorra tiempo de carga). La interfaz es exactamente igual que la de Chrome, Brave lo supera en todo.",,,,1243993087531266049,https://twitter.com/sergistack/status/1243993087531266049
2020-03-25 18:27:52,autism_mommie,dsmom58,1,0,2,"Always the hardest part for son. He gets very anxious when wait is long.",,,,1242880898741211142,https://twitter.com/autism_mommie/status/1242880898741211142
2020-03-25 18:04:20,navgirl63,blaxton_h,1,0,0,"It would be nice for this to be fully explained in a prime time broadcast for federal relief and then each state explaining theirs. I realize it’s a massive undertaking. That’s why folks are so anxious. Thanks!",,,,1242874978342768641,https://twitter.com/navgirl63/status/1242874978342768641
2020-03-25 17:57:03,RantyAmyCurtis,,1,1,10,"2/ I know I’m not alone in this because I’ve talked to others. I’ve said I’ve been low-key anxious since this all started. I mean this is the last four years:",,,,1242873143053737986,https://twitter.com/RantyAmyCurtis/status/1242873143053737986
2020-03-25 17:56:01,desertw0lf,VeggiePapi,0,0,7,"i am far too anxious for this mess and i hate myself for watching the whole thing https://twitter.com/VeggiePapi/status/1242684116023140352 …",,,,1242872881920397312,https://twitter.com/desertw0lf/status/1242872881920397312
2020-03-25 17:42:05,_DaeneRaaassss_,,0,0,0,"Boy listening to 911 calls makes me so anxious...",,,,1242869376480694272,https://twitter.com/_DaeneRaaassss_/status/1242869376480694272
2020-03-25 17:41:42,Lisapisa921,SpiritsPodcast,1,0,2,"I knew I could count on you guys!! Use the code but then also listen to the podcast. Because it’s fun and informational and definitely brings me joy in this anxious time.",,,,1242869282041520128,https://twitter.com/Lisapisa921/status/1242869282041520128
2020-03-25 17:39:28,benjancewicz,,1,0,0,"Mood: I think most of the time I focus on moments. Experiences, being with people, these are some of the most important things for me. But, I think when I’m under stress or anxious, I start collecting things. It’s a bad habit. I need to let things go.",,,,1242868718981521408,https://twitter.com/benjancewicz/status/1242868718981521408
2020-03-25 17:38:25,toriacurbelo,,0,0,0,"With everything going on in the world, now is a better time than ever to take care of yourself. Social distancing and self quarantine make us all feel many different things. We might feel restless, anxious, scared,… https://www.instagram.com/p/B-Kk_kZjOxl/?igshid=1w5c5bg3er42c …",,,,1242868456107708423,https://twitter.com/toriacurbelo/status/1242868456107708423
2020-03-25 17:34:43,bettyelfeo,,0,1,5,"i keep thinking about how i’ll be old one day with kids and forehead wrinkles and it makes me mad anxious no wonder millennials are fucking crazy",,,,1242867522640269313,https://twitter.com/bettyelfeo/status/1242867522640269313
2020-03-25 17:27:07,romeosidvicious,,1,0,3,"I am not an anxious person, in general. I have some weird anxiety but it's always over personal relationships. However I an rife with it right now. I'm thinking cutting back on the caffeine might help.",,,,1242865610452803587,https://twitter.com/romeosidvicious/status/1242865610452803587
2020-03-25 17:10:44,annnx_x,,0,0,0,"I’m so anxious",,,,1242861487108042752,https://twitter.com/annnx_x/status/1242861487108042752
2020-03-25 17:09:51,torchentertain,,0,0,0,"@BretBaier big fan. The bill is big on $$short on details. How do people and businesses access the funds. I am small business owner and can't wait months for SBA loan. I will be bankrupt. Please ask that question. Americans are anxious we need answers",,@BretBaier,,1242861265011101697,https://twitter.com/torchentertain/status/1242861265011101697
2020-03-25 17:08:04,taylorannesm95,SummerTelban,2,0,0,"I was just looking at this. I am really anxious!",,,,1242860815528669184,https://twitter.com/taylorannesm95/status/1242860815528669184
2020-03-25 16:58:16,Shes_so_Sandi,CH_JanetNA,0,0,7,"Thank you and every CH team member for working hard together, from ensuring payroll is completed, keeping our computers working, to supporting people at home through this anxious time... I am proud to be part of this amazing organization!",,,,1242858348304793605,https://twitter.com/Shes_so_Sandi/status/1242858348304793605
2020-03-25 16:55:39,felizcaridad,gjossiell,0,0,0,"I’m feeling extremely anxious today + I was supposed to be on that plane too. https://twitter.com/gjossiell/status/1242856740946935809 …",,,,1242857690201718789,https://twitter.com/felizcaridad/status/1242857690201718789
2020-03-25 16:53:18,MillyTamarez,,1,3,114,"ME: anxious. been practicing quarantine for 15 days. Going out every 3 days for a walk. Praying every day for the safety/protection of my parents who live in florida. MY DAD: pic.twitter.com/3tAQCEpw7s",,,,1242857100327424012,https://twitter.com/MillyTamarez/status/1242857100327424012
2020-03-25 16:50:56,bloomissnatural,,0,0,0,"All of our emotions and moods have been turned upside down and sideways these past couple of weeks. We are more anxious, our anxiety levels are all over the place, finding energy is extremely hard, focus seems like… https://www.instagram.com/p/B-Kez9nHPyU/?igshid=16m2y3gbf2zy2 …",,,,1242856503914237953,https://twitter.com/bloomissnatural/status/1242856503914237953
2020-03-25 16:43:10,AlexisRexx,,1,0,6,"Lockdown in LA means I haven’t washed my sheets in over 2 weeks now and I’m getting anxious about it. When this is all over I’m buying a 2nd set.",,,,1242854549888454656,https://twitter.com/AlexisRexx/status/1242854549888454656
2020-03-25 16:37:39,JimHoltan,StienstraTom,0,0,0,"It seems we’re always anxious to assign blame quickly rather than stepping back and looking at the situation. We should value those who bring us information in crisis times. Emotions are very powerful.",,,,1242853160323936257,https://twitter.com/JimHoltan/status/1242853160323936257
2020-03-25 16:31:55,MelyndaE,,0,0,4,"No longer anxious about the 2 possible exposures last wk-this wk has brought more sick colleagues that are being refused tests because they can’t say they’ve been exposed to a positive case. WE WORK IN A HOSPITAL. Anxiety seems to dissipate when you’re in the eye of the storm.",,,,1242851717005352960,https://twitter.com/MelyndaE/status/1242851717005352960
2020-03-28 20:07:18,sergistack,,192,478,1084,"¿USAS GOOGLE CHROME? Lo siento por las mayúsculas, pero existe un nuevo navegador que es más rápido y más privado que Chrome (bloquea los anuncios y los rastreadores, lo cual ahorra tiempo de carga). La interfaz es exactamente igual que la de Chrome, Brave lo supera en todo.",,,,1243993087531266049,https://twitter.com/sergistack/status/1243993087531266049
