date,username,to,replies,retweets,favorites,text,geo,mentions,hashtags,id,permalink
2020-03-25 16:25:49,Kansasgirlinca,,0,0,0,"When my anxious thoughts multiply within me, Your consolations delight my soul. Psalms 9… https://bible.com/verse-of-the-day/psa.94.19/52895 …pic.twitter.com/RIFxlcPoLU",,,,1242850183055982593,https://twitter.com/Kansasgirlinca/status/1242850183055982593
2020-03-25 16:25:36,RadioChio,marcblackwell,0,0,2,"Hey Marc, thank you. We have to offer each other hope in an anxious time. There’s a lot of noise, a lot of stress. But we’ve made it through tougher times and we will get through this. Stay safe!",,,,1242850130077691904,https://twitter.com/RadioChio/status/1242850130077691904
2020-03-25 16:22:26,LindsayMyersLB,,0,0,0,"Acceptance. This is something I've been working on. The new normal is what I've come to terms with. Of course I'm still stressed about work and money. Of course I'm still anxious about the situation of the world… https://www.instagram.com/p/B-KcTJih4ux/?igshid=1nu2y9mks8355 …",,,,1242849331499188226,https://twitter.com/LindsayMyersLB/status/1242849331499188226
2020-03-25 16:22:12,lmcgaughy,713AstrosFan,0,0,4,"We’re looking into that:https://www.dallasnews.com/news/politics/2020/03/25/are-gun-retailers-essential-some-question-whether-shops-can-be-shut-down-during-shelter-in-place/ …",,,,1242849273718411264,https://twitter.com/lmcgaughy/status/1242849273718411264
2020-03-25 16:19:48,IsacWithOneA,,0,0,5,"Im waiting for my niece to text me about how much longer will we be out from work, she knew before I did that Disneyland was closing ‘CAUSE DISNEY LIKES TO TWEET ITS NEWS BEFORE TELLING It’s employees. So come on little Ayleen text me, im too anxious!",,,,1242848669436497925,https://twitter.com/IsacWithOneA/status/1242848669436497925
2020-03-25 16:15:15,JoanHangarter,,0,0,0,"Are you feeling unsettled? Anxious? Concerned about the future. Have questions? D.M. me and lets talk! This is my specialty to help you clarity, review, understand and let go of any fears about the future and move… https://www.instagram.com/p/B-KbeK1K9u7/?igshid=140uedxhlrkw6 …",,,,1242847526639861761,https://twitter.com/JoanHangarter/status/1242847526639861761
2020-03-25 15:59:07,SoJoBmanUtefan,,0,0,6,"Welp... Been a pretty anxious last 36 hours... my wife who has been frontline at Costco, sometimes at the membership shop door, is sick. She was able to get tested this morning. I am home on sick time from work. 24 -48 hours for test results. Prayers and good vibes appreciated!",,,,1242843464150048771,https://twitter.com/SoJoBmanUtefan/status/1242843464150048771
2020-03-25 15:53:18,iam_Mariah_J,,4,0,3,"AYE! When y’all feel anxious due to either dwelling in the past and/or looking into the unknown/future, how do you re-ground yourself?",,,,1242842001512583170,https://twitter.com/iam_Mariah_J/status/1242842001512583170
2020-03-25 15:52:24,dandlionalchemy,,0,1,0,"greetings- gig economy trades / offerings: Reiki / astrology/ tarot readings - . feeling anxious? or feeling activated? . . . #Reiki #tarot #astrology #readings #channel @Los Angeles, California https://www.instagram.com/p/B-KY3KxhzzW/?igshid=1i79o3m43kogx …",,@Los,#Reiki #tarot #astrology #readings #channel,1242841773736710148,https://twitter.com/dandlionalchemy/status/1242841773736710148
2020-03-25 15:41:42,702GRACECITY,,0,0,0,"When my anxious thoughts multiply within me, YOUR consolations delight my soul. Psalms 94:19 NASB https://www.bible.com/100/psa.94.19.nasb … #YouVersion #BibleVerseOfTheDay… https://www.instagram.com/p/B-KXo36JQR8cOdEWYNRjWKk4HXsD-9U0Jc9liE0/?igshid=1nk21opc18hof …",,,#YouVersion #BibleVerseOfTheDay,1242839083052826626,https://twitter.com/702GRACECITY/status/1242839083052826626
2020-03-25 15:40:26,AliciaRealtorFL,,0,0,1,"Trying to enjoy the present without anxious dependence about the future. #doyourpart #keepyourdistance #adventureswithmargaux #orangebikes #miamilife @Downtown Miami https://www.instagram.com/p/B-KXfjsgV38/?igshid=854w0laip42f …",,@Downtown,#doyourpart #keepyourdistance #adventureswithmargaux #orangebikes #miamilife,1242838763266400258,https://twitter.com/AliciaRealtorFL/status/1242838763266400258
2020-03-25 15:40:07,702GRACECITY,,0,0,0,"When my anxious thoughts multiply within me, YOUR consolations delight my soul. Psalms 94:19 NASB https://www.bible.com/100/psa.94.19.nasb … #YouVersion #BibleVerseOfTheDay #PsalmsNinetyFourNineteen #NASB https://www.bible.com/100/psa.94.19.nasb …pic.twitter.com/e7dpl1sFHZ",,,#YouVersion #BibleVerseOfTheDay #PsalmsNinetyFourNineteen #NASB,1242838683150999553,https://twitter.com/702GRACECITY/status/1242838683150999553
2020-03-25 15:36:38,AGlibs,,2,1,33,"Now, will be the only time in my life, that my generalized anxiety is socially acceptable & is not considered an overreaction. Not leaving my house? Good job! Id expect to be very anxious, but I feel validated. So bizzare #mentalhealth",,,#mentalhealth,1242837804964548608,https://twitter.com/AGlibs/status/1242837804964548608
2020-03-25 15:32:06,eyesopenstan,,1,6,105,"I need to thank @girlwithnojob and her sister Jackie for giving @themorningtoast every day right now. It’s become my way of grounding my day. I wake up anxious, not know what changes I will need to adapt to in this world but listening to the Toast puts me back into a calm mind!",,@girlwithnojob @themorningtoast,,1242836663543291905,https://twitter.com/eyesopenstan/status/1242836663543291905
2020-03-25 15:31:57,guccihaa,,0,0,0,"i like to listen to this whenever i feel anxious https://music.apple.com/us/album/ordinary-pleasure/1438769910?i=1438769912 …",,,,1242836628780879872,https://twitter.com/guccihaa/status/1242836628780879872
2020-03-25 15:19:22,donna35850,,0,0,3,"I know your Anxious & Depressed but without God. You will be miserable #MrsDonna",,,#MrsDonna,1242833460160614400,https://twitter.com/donna35850/status/1242833460160614400
2020-03-25 15:19:12,617eagle,,0,0,0,"@SpeakerPelosi I am anxious to see what kind of nonsense you and your minions tack onto the bill@once it gets to the House. Probably something like snail darter protection or abortion funding",,@SpeakerPelosi @once,,1242833420008542209,https://twitter.com/617eagle/status/1242833420008542209
2020-03-25 15:13:07,CONTEMPRA_INN,Antheia0,0,2,3,"#Peaceful Thoughts “If you are #depressed you are living in the #past if you are #anxious you are living in the #future, if you are at #peace, you are living in the #present.” — #LaoTzu #Quote @j_ahlia @CONTEMPRA_INNhttps://twitter.com/Antheia0/status/1242793308218220544 … – at Contempra Inn",,@j_ahlia @CONTEMPRA_INNhttps,#Peaceful #depressed #past #anxious #future #peace #present #LaoTzu #Quote,1242831888601022464,https://twitter.com/CONTEMPRA_INN/status/1242831888601022464
2020-03-25 15:12:13,milt_betteridge,stumpteacher,0,0,2,"The human connection is vital. Students are anxious and this will get worse the longer schools are closed.",,,,1242831663538802688,https://twitter.com/milt_betteridge/status/1242831663538802688
2020-03-25 15:09:37,eazy_baker,,0,0,0,"I just woke up so anxious",,,,1242831008245972993,https://twitter.com/eazy_baker/status/1242831008245972993
2020-03-28 20:07:18,sergistack,,192,478,1084,"¿USAS GOOGLE CHROME? Lo siento por las mayúsculas, pero existe un nuevo navegador que es más rápido y más privado que Chrome (bloquea los anuncios y los rastreadores, lo cual ahorra tiempo de carga). La interfaz es exactamente igual que la de Chrome, Brave lo supera en todo.",,,,1243993087531266049,https://twitter.com/sergistack/status/1243993087531266049
2020-03-25 15:03:56,RyanMotsinger,,0,0,0,"Overwhelmed? Worried about the future? Fearful? Anxious? My journey with all those emotions has been a long one, and I’m not done yet. Here’s the first of 2 articles I wrote last year that may encourage you.… https://www.instagram.com/p/B-KTUUqBs6P/?igshid=1e6c0qneij4hs …",,,,1242829577497411585,https://twitter.com/RyanMotsinger/status/1242829577497411585
2020-03-25 14:53:43,KeithWaid,,1,0,0,"Our job is to communicate happiness, love, hope, and if applicable ... worry. We’re reminded of how to take care off the first three throughout the Bible, but the last 1 is best addressed in Philippians 4:6-7 “be anxious about nothing” ... I know I hear you now ...",,,,1242827005055336450,https://twitter.com/KeithWaid/status/1242827005055336450
2020-03-25 14:51:15,LoveQueenKiea,,0,0,0,"I really wanna what I’m having cause I’m so anxious to know",,,,1242826386689097729,https://twitter.com/LoveQueenKiea/status/1242826386689097729
2020-03-25 14:49:20,Karlaaaisabel_,,1,0,1,"Basically started becoming anxious and felt like I needed validation from everyone and from my significant other. Sex is meant to bond you with your husband so I had a VERY toxic 3 year relationship on and off because I was attached to him physically. And I felt empty",,,,1242825904511950848,https://twitter.com/Karlaaaisabel_/status/1242825904511950848
2020-03-25 14:45:23,looking4jasmine,,0,0,0,"Anyone in Tucson want an employee? I’m a hard worker and it’s not safe for me to go back to my current job (it’s not essential and a call center so germs everywhere) but I’m anxious about it I love to work but I can’t handle a job I’m on my feet 8-16 hours straight anymore.",,,,1242824907504771072,https://twitter.com/looking4jasmine/status/1242824907504771072
2020-03-25 14:35:58,PebbieDaver,,0,0,3,"Lots of things to be anxious about right now but one of them is hoping I don’t get tagged in the push-up challenge bc I can’t do 10 push-ups.",,,,1242822540722163716,https://twitter.com/PebbieDaver/status/1242822540722163716
2020-03-25 14:30:48,RuffBuff81,,24,4,139,"Rough last 24hrs. NG finally out. Hopefully getting discharged today (and no, it has nothing to do with COVID-19). Anxious to get back to my girls. pic.twitter.com/UHGeNtbIWs – at Samaritan Medical Center",,,,1242821238403235840,https://twitter.com/RuffBuff81/status/1242821238403235840
2020-03-25 14:16:29,TheODDSock1,,0,0,0,"When my anxious thoughts multiply within me, Your comforts delight me. Psalms 94:19 AMP https://bible.com/bible/1588/psa.94.19.AMP …",,,,1242817637970821122,https://twitter.com/TheODDSock1/status/1242817637970821122
2020-03-25 14:14:14,Shackelford1055,KJTorrance,0,0,1,"Anxious Rice Cakes https://twitter.com/KJTorrance/status/1242609004607569926 …",,,,1242817067948158976,https://twitter.com/Shackelford1055/status/1242817067948158976
2020-03-25 14:11:49,FayeKnuze,EricTrump,0,0,0,"Hey dummy— a couple weeks ago @realDonaldTrump was telling a concerned and anxious country that COVID-19 was “just a bad flu” and that the number of US cases was at 25 and “going down”. Shame on YOU dummy.",,@realDonaldTrump,,1242816462844235777,https://twitter.com/FayeKnuze/status/1242816462844235777
2020-03-25 14:10:22,NedSyble,,0,0,1,"When my anxious thoughts multiply within me, Your consolations delight my soul. Psalms 94… https://bible.com/verse-of-the-day/psa.94.19/2921 …pic.twitter.com/Ey206XifNv",,,,1242816097038065664,https://twitter.com/NedSyble/status/1242816097038065664
2020-03-25 14:05:17,NAMIJCIowa,,0,0,0,"Its okay to be anxious right now, we are sending love to our University of Iowa students right now! Check out some of our dedicated U of I walk teams http://www.namiwalks.org/johnsoncountyia #NAMIWalks #namijcpic.twitter.com/rP0dmSdWVw",,,#NAMIWalks #namijcpic,1242814818731675650,https://twitter.com/NAMIJCIowa/status/1242814818731675650
2020-03-25 13:55:16,AustraliaUN,,0,1,4,"We understand this is an anxious time for Australians abroad, including many who call New York home. Australians remaining in the are strongly encouraged to follow the direction of local authorities. Info for NY residents is available at: https://coronavirus.health.ny.gov/home",,,,1242812296298192897,https://twitter.com/AustraliaUN/status/1242812296298192897
2020-03-25 13:51:28,ladydbaggs,,0,0,0,"When my anxious thoughts multiply within me, Your consolations delight my soul. Psalms 9… https://bible.com/verse-of-the-day/psa.94.19/49565 …pic.twitter.com/staD7LxDio",,,,1242811339942264833,https://twitter.com/ladydbaggs/status/1242811339942264833
2020-03-25 13:38:10,ljtolley,HCookAustin,0,0,2,"Anxious Coffee",,,,1242807993042960385,https://twitter.com/ljtolley/status/1242807993042960385
2020-03-25 13:35:10,MaryMamms,,0,0,0,"I know our current situation has many of us feeling anxious followed by waves of fear and I’m there with you.⁣ ⁣ If possible, I want you to try and get a little fresh air today. 1 minute is all I ask. ⁣ ⁣ Try one of… https://www.instagram.com/p/B-KJJ3FJBUm/?igshid=10f9zgj9l0br3 …",,,,1242807236642168833,https://twitter.com/MaryMamms/status/1242807236642168833
2020-03-25 13:27:08,davethegr8one,AbleLikes,0,0,2,"I'm learning, anxious to get better at it...",,,,1242805215302205440,https://twitter.com/davethegr8one/status/1242805215302205440
2020-03-25 13:03:18,crumpdaddy,,0,0,1,"When my anxious thoughts multiply within me, Your comforts delight me. Psalms 94:19 AMP https://bible.com/verse-of-the-day/psa.94.19/10775 …pic.twitter.com/QhtplXqqW7",,,,1242799218680627201,https://twitter.com/crumpdaddy/status/1242799218680627201
2020-03-25 13:01:58,UtahEmergency,UtahEmergency,0,35,73,"If you are still feeling anxious after our earthquakes, consider calling the Disaster Distress Helpline 1-800-985-5990. Or text TalkWithUs to 66746 to connect with a trained crisis counselor. https://www.samhsa.gov/find-help/disaster-distress-helpline …https://twitter.com/UtahEmergency/status/1241930196065738756 …",,,,1242798881806487552,https://twitter.com/UtahEmergency/status/1242798881806487552
2020-03-25 12:59:36,YeahHeyItsSteve,mitch_osborne,1,0,1,"Yeah, my brother was just laid off and has a one year old at home. Again, it’s not perfect, but the extended UI was the main thing I was worried about and they made that happen. So I’m feeling a bit less anxious for him at least in the short term.",,,,1242798286752415745,https://twitter.com/YeahHeyItsSteve/status/1242798286752415745
2020-03-28 20:07:18,sergistack,,192,478,1084,"¿USAS GOOGLE CHROME? Lo siento por las mayúsculas, pero existe un nuevo navegador que es más rápido y más privado que Chrome (bloquea los anuncios y los rastreadores, lo cual ahorra tiempo de carga). La interfaz es exactamente igual que la de Chrome, Brave lo supera en todo.",,,,1243993087531266049,https://twitter.com/sergistack/status/1243993087531266049
2020-03-25 12:56:31,jackferguson92,,0,0,0,"Allow these moments we are going through to define you as being: Generous over selfish Courageous over living fearfully Peaceful over anxious #ABLE #DefineYourself #VIRTUE #WednesdayWisdom",,,#ABLE #DefineYourself #VIRTUE #WednesdayWisdom,1242797510973775878,https://twitter.com/jackferguson92/status/1242797510973775878
2020-03-25 12:47:18,Kaimosi2,,0,0,2,"When my anxious thoughts multiply within me, Your comforts delight me. Psalms 94:19 AMP https://bible.com/bible/1588/psa.94.19.AMP …",,,,1242795190940659712,https://twitter.com/Kaimosi2/status/1242795190940659712
2020-03-25 12:47:05,JMGreen04,,0,0,0,"I’m getting very eager and anxious about closing on this house!... I’m really hoping this all works out smoothly pic.twitter.com/99rbqMh7mp",,,,1242795139157934081,https://twitter.com/JMGreen04/status/1242795139157934081
2020-03-25 12:46:04,StoicStolas,safexcamp,1,0,1,"Depressed and anxious as fuck https://twitter.com/safexcamp/status/1242603659487297537 …",,,,1242794883787689985,https://twitter.com/StoicStolas/status/1242794883787689985
2020-03-25 12:35:56,mermandicorn,,1,5,28,"good morning to the restless, the anxious, the lonely, the ones set apart. you are not alone. your feelings are valid, and you are meant for something bigger. here is your reminder to have faith",,,,1242792330425294848,https://twitter.com/mermandicorn/status/1242792330425294848
2020-03-25 12:31:50,blkmpwr,,0,0,2,"Whenever I am anxious and worried, you comfort me and make me glad. Psalms 94:19 GNB https://bible.com/bible/296/psa.94.19.GNB …",,,,1242791298601349123,https://twitter.com/blkmpwr/status/1242791298601349123
2020-03-25 12:28:58,DanGiancolaBTO,,0,0,0,"Goodmorning beauties!!! Today is going to be an amazing day!!! Feeling anxious or slightly depressed because if this stressful situation then we need to get you up and moving we need you… https://www.instagram.com/p/B-KBlHpDBIxD3F6pKwO16jmqR3gbHweUoYcJDw0/?igshid=1wgwyq1kgkj1h …",,,,1242790576648384512,https://twitter.com/DanGiancolaBTO/status/1242790576648384512
2020-03-25 12:25:50,christo4ferris,mikebrow,0,0,1,"Has opposite effect... people know it is bad... hiding reality makes them more anxious",,,,1242789789776203777,https://twitter.com/christo4ferris/status/1242789789776203777
2020-03-25 12:22:31,AMAwithAMA,kateygoalie,1,0,2,"I’m going to pass your kind works on to our amazing staff. They’re often anxious like everyone is out there but are such committed public servants & know they are critical to getting essential workers to the frontlines.",,,,1242788953503215621,https://twitter.com/AMAwithAMA/status/1242788953503215621
2020-03-25 12:21:36,thehannahasanah,,0,0,0,"Does anyone remember what we used to talk about before the #coronavirus hit? Asking for a friend Like most, if not all of you, there’s a lot running through my mind right now. No matter how anxious we get, we must… https://www.instagram.com/p/B-KAvM-Hms1/?igshid=1ssc2gc6v9euc …",,,#coronavirus,1242788724607500291,https://twitter.com/thehannahasanah/status/1242788724607500291
2020-03-25 12:04:04,tbengrimm,,1,0,3,"Heading in to day 14, we have had rifs/rafs/tits&tats & I’ve been feeling increasingly anxious & uncomfortable. We’ve reached out to friends, lipsynced, watch movies, & played video games; yet a poorly worded sentence or weird look can send one of us spiraling in fear & sadness.",,,,1242784310559637504,https://twitter.com/tbengrimm/status/1242784310559637504
2020-03-25 11:45:03,KTFBurnsDC,Rtfdfireman1185,0,1,1,"Do not be anxious about anything, but in every situation, by prayer and petition, with thanksgiving, present your requests to God. Philippians 4:6 - https://www.biblegateway.com/passage?search=Philippians%204:6&version=NIV …",,,,1242779527841013769,https://twitter.com/KTFBurnsDC/status/1242779527841013769
2020-03-25 11:44:58,roAnne,t0nit0ne,0,0,0,"I can't stand those ppl. Make me anxious af. https://twitter.com/t0nit0ne/status/1242580703902085121 …",,,,1242779506605252611,https://twitter.com/roAnne/status/1242779506605252611
2020-03-25 11:21:20,introvertlawyer,,0,1,4,"I know we are all struggling to get, and keep, our bearings. Cultivating moments of optimism, let’s ponder ways to create hope for anxious students, businesses, and admin staff. Some ideason virtual summer internship programs—to keep people working & optimize unsung strengths",,,,1242773556435521536,https://twitter.com/introvertlawyer/status/1242773556435521536
2020-03-25 11:13:02,davidbtowner,,0,1,1,"Philippians 4:6 “Do not be #anxious about anything, but in everything by #prayer and supplication with #thanksgiving let your requests be made known to God.” One way to get out of the #Coronavirus doldrums is to #pray for others. It will keep your focus out & up rather than in.pic.twitter.com/q9Ds0G3aU3",,,#anxious #prayer #thanksgiving #Coronavirus #pray,1242771467504431108,https://twitter.com/davidbtowner/status/1242771467504431108
2020-03-25 11:06:34,RockCollageJJP,,0,0,0,"Hey Loves! ⁣⁣ ⁣⁣ What do we know about anxiety?⁣⁣ ⁣⁣ 56% of people in the U.S. think we are more anxious today than 5 years ago.⁣⁣ ⁣⁣ Well for starters, anxiety is the anticipation of whats to come or fear of… https://www.instagram.com/p/B-J4JncHfrW/?igshid=1ughebswizqp8 …",,,,1242769839942291457,https://twitter.com/RockCollageJJP/status/1242769839942291457
2020-03-25 10:47:05,RCWVsocial,,0,0,0,"“When my anxious thoughts multiply within me, Your consolations delight my soul.” Psalms 94:19 @Renewal Chapels https://www.instagram.com/p/B-J17DfJCbI/?igshid=175p8ocxsuwv9 …",,@Renewal,,1242764936872251392,https://twitter.com/RCWVsocial/status/1242764936872251392
2020-03-25 10:43:00,jamesmarable4,,0,0,0,"When my anxious thoughts multiply within me, Your consolations delight my soul. Psalms 9… https://bible.com/verse-of-the-day/psa.94.19/49565 …pic.twitter.com/cS2xHonMFp",,,,1242763911222513665,https://twitter.com/jamesmarable4/status/1242763911222513665
2020-03-25 10:42:53,_absmith92,,1,0,6,"First night at our house and I woke up at 4 with a heavy feeling on my chest. Now I’m super anxious and feel sick. I just want to be home but at the same time it’s extremely hard right now.",,,,1242763880218189824,https://twitter.com/_absmith92/status/1242763880218189824
2020-03-25 10:01:52,damwop2,HoarseWisperer,2,0,4,"Anxious, scared, still working, confused......... https://twitter.com/HoarseWisperer/status/1242608573781286912 …",,,,1242753561450201088,https://twitter.com/damwop2/status/1242753561450201088
2020-03-28 20:07:18,sergistack,,192,478,1084,"¿USAS GOOGLE CHROME? Lo siento por las mayúsculas, pero existe un nuevo navegador que es más rápido y más privado que Chrome (bloquea los anuncios y los rastreadores, lo cual ahorra tiempo de carga). La interfaz es exactamente igual que la de Chrome, Brave lo supera en todo.",,,,1243993087531266049,https://twitter.com/sergistack/status/1243993087531266049
2020-03-25 09:43:42,d_e_miller,,0,0,1,"So my quarantine was only 24 hours before my work changed position and called me back. I got really anxious in that short time.. I feel for some of you who been doing this for weeks..",,,,1242748986823491585,https://twitter.com/d_e_miller/status/1242748986823491585
2020-03-25 09:34:51,hannnnnnahhhhhh,,0,0,0,"why am I anxious to run around neighborhood in daytime. ugh I hate",,,,1242746761652973568,https://twitter.com/hannnnnnahhhhhh/status/1242746761652973568
2020-03-25 09:15:31,4ryss4,VeggiePapi,1,0,4,"damn i was enjoying my high too now i’m anxious lmao https://twitter.com/VeggiePapi/status/1242684116023140352 …",,,,1242741893127114752,https://twitter.com/4ryss4/status/1242741893127114752
2020-03-25 08:59:14,Mookavelli23,,0,0,0,"Tha day before we get ready to leave to tha next city I can never sleep! I’m always anxious & excited when I think about what’s in store.",,,,1242737797221548033,https://twitter.com/Mookavelli23/status/1242737797221548033
2020-03-25 08:00:30,KellyC1021,,0,0,2,"All last week I was so nervous and anxious about this whole pandemic... but now that I've been home and able to ground and center myself, I feel much better",,,,1242723016808599553,https://twitter.com/KellyC1021/status/1242723016808599553
2020-03-25 07:50:21,mercedesswalsh,,0,0,1,"I don’t know if anyone else is like this but I’ve noticed that every time I’m really stressed or really anxious I get one single GIANT pimple and I feel like it’s the world saying fuck ur anxiety here’s something visual to worry about too",,,,1242720464134258689,https://twitter.com/mercedesswalsh/status/1242720464134258689
2020-03-25 07:50:03,EddRiivera,,0,0,0,"Great anxiety woke me up and my depression was like oh we are doing this, now I’m here awake overthinking shit and feeling anxious AF",,,,1242720387596562432,https://twitter.com/EddRiivera/status/1242720387596562432
2020-03-25 07:13:55,AlhuaQ,,0,0,0,"@real_defender I am anxious. The United States lacks masks and thermometers. A friend sent it to me. I don't know if I can help the United States. I don't know English and I don't know if these certificates are really fake. pic.twitter.com/bxncGWDKMC",,@real_defender,,1242711295108902912,https://twitter.com/AlhuaQ/status/1242711295108902912
2020-03-25 07:12:54,mombosss,,1,0,2,"Caronavirus has literally turned me into an anxious mess. Every night for the past 3 days I have been up til 2 or 3. I’m either up cleaning and bleaching everything down or doing school work. I’m so over it!!! My pregnant body needs some real sleep!",,,,1242711039373950976,https://twitter.com/mombosss/status/1242711039373950976
2020-03-25 07:06:02,DrDiva82,CaslerNoel,0,0,0,"SERIOUSLY?? #45 has NEVER hid who or what he is! People were just too anxious to put this sociopathic/homophobic/racist/misogynistic/ignorant PUNK ASS BITCH in office! He's always been in plain sight bt for whtevr reason millions voted him in & IGNORED evry horrible thing he did! https://twitter.com/CaslerNoel/status/1242552787835199498 …",,,#45,1242709309353611265,https://twitter.com/DrDiva82/status/1242709309353611265
2020-03-25 07:03:13,bad_stronger,Connor___W,1,0,0,"I meant more of the overwhelming and anxious feeling that something was not right with you and you should hide sksksksksk",,,,1242708600197468160,https://twitter.com/bad_stronger/status/1242708600197468160
2020-03-25 06:46:21,Echos_Voice,,3,0,0,"Can’t sleep. Too anxious about this stupid virus, money, the world. If anyone is awake, send happy things.",,,,1242704355431780353,https://twitter.com/Echos_Voice/status/1242704355431780353
2020-03-25 06:45:55,jessicalee1000,,0,1,6,"this whole self isolation thing isn’t good for • people who are easily anxious • people who live alone • people who constantly overthink • people who are impatient • people who depend on daily routines oh wait I’m describing myself",,,,1242704245117333504,https://twitter.com/jessicalee1000/status/1242704245117333504
2020-03-25 06:42:11,PhatFlightin_,,0,0,0,"I suffer from anxiety so it’s been hard for my to fall asleep...I’m always anxious and overthinking these late nights",,,,1242703309242236929,https://twitter.com/PhatFlightin_/status/1242703309242236929
