date,username,to,replies,retweets,favorites,text,geo,mentions,hashtags,id,permalink
2020-03-26 14:57:59,StephInMI,JadziaDani,0,0,3,"I'm half as far along as you are, but this is *so* relatable. My anxiety had been there so long I didn't even notice it... until it melted away in the first ten days. Thank you for this!!",,,,1243190466222395393,https://twitter.com/StephInMI/status/1243190466222395393
2020-03-26 14:55:26,dreamerxtian,,0,1,1,"Imagine living with anxiety, uncertainty, and fear. Oh wait... that is literally what an immigrant’s life is living in the US. I think we might have the upper hand on this crisis. #immigrant #Latinos #DACA #COVIDー19",,,#immigrant #Latinos #DACA #COVIDー19,1243189826972610560,https://twitter.com/dreamerxtian/status/1243189826972610560
2020-03-26 14:55:11,warlockthoth137,,1,0,0,"Waiting for the bus. My children do NOT feel comfortable being by themselves on the bus to which she started to have anxiety and that's why I stand by my kids. We didn't even last one stop before we got kicked off the bus. We were just trying to get some food and it's just me....",,,,1243189761575211010,https://twitter.com/warlockthoth137/status/1243189761575211010
2020-03-26 14:54:26,TheBiggggGuy,shelby60235316,1,0,0,"I saw a guy put hand sanitizer on his face at the grocery store the other day, no joke... I thought it was funny at first but then felt sorry for him and the anxiety he must be feeling, he wasn’t in the vulnerable population either.",,,,1243189575184506881,https://twitter.com/TheBiggggGuy/status/1243189575184506881
2020-03-26 14:52:13,thealisonjane,,0,0,0,"Wow, I’m really enjoying all of these corona-related anxiety dreams.",,,,1243189016444522496,https://twitter.com/thealisonjane/status/1243189016444522496
2020-03-26 14:51:43,IfYouSeekTrey,,1,0,2,"Maybe after all this social distancing my social anxiety will go away",,,,1243188891588403201,https://twitter.com/IfYouSeekTrey/status/1243188891588403201
2020-03-26 14:50:39,CarlitaS07,,1,0,2,"I’ve thought a lot about this principle in the last couple of weeks as I’ve seen loved ones lose jobs, spend hundreds to stock up on needed medications, or who now live with the exhausting feelings of uncertainty and anxiety. The effects of this #COVID19 pandemic reach ...2/",,,#COVID19,1243188622049730561,https://twitter.com/CarlitaS07/status/1243188622049730561
2020-03-26 14:50:04,princesshoped,,0,0,0,"Anxiety sucks",,,,1243188473294737408,https://twitter.com/princesshoped/status/1243188473294737408
2020-03-26 14:48:30,AMIKellyMac,Pfield1961,0,0,0,"We’ve talked about some of these concerns on our show #KellyCo a lot lately. It’s a challenge many in our low vision and Blind community have shared lately. A lot of anxiety created. Plus knowledge that we are all responsible to create social distance.",,,#KellyCo,1243188080170995712,https://twitter.com/AMIKellyMac/status/1243188080170995712
2020-03-26 14:48:03,VTDiva01,,6,2,8,"I believe what I have is just that - exhaustion and maybe a little touch of a stomach bug. Nothing to worry about but I wouldn’t normally call out under these conditions. Scary times. Hoping to go back tomorrow! There’s way too much anxiety in the air",,,,1243187969567137792,https://twitter.com/VTDiva01/status/1243187969567137792
2020-03-26 14:47:29,hi_andrea_here,,0,0,1,"Low key getting tired of waking up every morning with anxiety. This spring break is wack.",,,,1243187824192442369,https://twitter.com/hi_andrea_here/status/1243187824192442369
2020-03-26 14:43:23,elchefe,TobyCouchman,1,0,13,"Oh, they have anxiety, but it’s about brown people.",,,,1243186793509511168,https://twitter.com/elchefe/status/1243186793509511168
2020-03-26 14:41:09,ThisistherealAE,Mojo7oh,0,0,1,"I’m pretty sure that he had a severe case of stage fright/ anxiety. Horrific feeling. I could be mistaken",,,,1243186231531503617,https://twitter.com/ThisistherealAE/status/1243186231531503617
2020-03-26 14:40:26,PrestonFassel,LeighMonsonPBF,1,0,0,"I think some folks on my timeline have been projecting their own anxieties/biases onto the show; I’ve seen more than a few people talk about Picard being reconceptualized as a “privileged boomer” and reading a contemporary RNC metaphor into him, which is what had me iffy",,,,1243186049142194176,https://twitter.com/PrestonFassel/status/1243186049142194176
2020-03-26 14:40:20,MeharryMedical,,0,6,7,"Lloyda Williamson, M.D., D.F.A.P.A. Chair and Professor Psychiatry of Meharry Medical College shares encouragement and guidelines on ways we can cope with mental stress and anxiety during the Covid-19 outbreak. full story on https://www.instagram.com/tv/B-MuWDhFIfM/?igshid=epjbybo6gkzy … #MentalHealth #COVID19pic.twitter.com/qA249Bsuhi",,,#MentalHealth #COVID19pic,1243186027138887680,https://twitter.com/MeharryMedical/status/1243186027138887680
2020-03-26 14:37:37,MayeTheSiren,,0,0,0,"I really got numb to shit that fucks with my anxiety and I love it here",,,,1243185341454000128,https://twitter.com/MayeTheSiren/status/1243185341454000128
2020-03-26 14:36:58,AskDrGreg,,0,0,0,"I-CAN’T-STAND-IT-ITIS: Saying “I can’t stand it!” will lead to frustration, anger, and especially anxiety. 1. SAYING IT CREATES IT. Don’t brainwash yourself, rather ask yourself questions to free yourself: “Can you… https://www.instagram.com/p/B-M023IjxKC/?igshid=4ol1llce2aba …",,,,1243185179591614466,https://twitter.com/AskDrGreg/status/1243185179591614466
2020-03-26 14:36:03,EmmaGmusic,,0,0,0,"#newmusicalert These are weird times: full of self doubt, fear, unease and anxiety. BUT these are also times of resilience, positivity, hope and bravery. It's a time for the champion in us all to step up and have… https://www.instagram.com/p/B-M049ppPVl/?igshid=88wy6q27kkow …",,,#newmusicalert,1243184949601189895,https://twitter.com/EmmaGmusic/status/1243184949601189895
2020-03-26 14:35:53,SWytovich,diovassallo,1,0,6,"We’re okay. All of my jobs went remote, which is great, but I feel like I’m drowning with all the additional work that comes with that. Dennis is still working out in the field, so that doesn’t do anything for my anxiety or his.",,,,1243184905229602817,https://twitter.com/SWytovich/status/1243184905229602817
2020-03-26 14:35:38,cole_sgva,,0,0,0,"I’m so tired! Of waking up with anxiety every day!",,,,1243184842226819074,https://twitter.com/cole_sgva/status/1243184842226819074
2020-03-26 14:32:44,crose___,,1,2,24,"Horses in pastures with halters on give me anxiety",,,,1243184111784689665,https://twitter.com/crose___/status/1243184111784689665
2020-03-26 14:30:11,ToriSkorich,,1,0,2,"I’m super happy my dad is home but now my anxiety on",,,,1243183473495543808,https://twitter.com/ToriSkorich/status/1243183473495543808
2020-03-26 14:29:01,LoneWolfNYC,,0,0,6,"Isolation Anxiety #SocialDistancing #NewProfilePicpic.twitter.com/0K73T3MbCw",,,#SocialDistancing #NewProfilePicpic,1243183178057240577,https://twitter.com/LoneWolfNYC/status/1243183178057240577
2020-03-26 14:26:57,evascalzo,,0,0,2,"Is it possible I’ve been anxiety shopping at my favorite romance bookstores during the #quaratine? Yes, yes it is. But today’s #bookmail from @therippedbodice includes an old, old favorite that established my love of… https://www.instagram.com/p/B-Mz4OqgZiH/?igshid=rka8hclh1bkv …",,@therippedbodice,#quaratine #bookmail,1243182658844229633,https://twitter.com/evascalzo/status/1243182658844229633
2020-03-26 14:25:50,BroadAndMarket,BroadAndMarket,0,0,2,"Future: you are going to face some roadblocks and this card warns that you might not be fully tapping into your inner strength. Do not let fear or anxiety paralyze you. Summon your inner resolve to break through the walls that you feel are closing in.",,,,1243182376546701313,https://twitter.com/BroadAndMarket/status/1243182376546701313
2020-03-26 14:24:18,Morells09,OnlyOneTeeta,0,0,0,"@thatfina I have never had so much anxiety in under 2 minutes of my life until now",,@thatfina,,1243181989546598402,https://twitter.com/Morells09/status/1243181989546598402
2020-03-26 14:23:09,CMoldmakers,GailNow,0,2,1,"Some good info from @CMHAWECB locally. We know anxiety is a major concern. Contact @kwillism if you want more info for your workplace ownership, management team, HR or staff. #mentalhealth #YQGhttps://twitter.com/GailNow/status/1243179750467780608 …",,@CMHAWECB @kwillism,#mentalhealth #YQGhttps,1243181701221748736,https://twitter.com/CMoldmakers/status/1243181701221748736
2020-03-26 14:22:58,DebarringtonH,Kgar_Horrible,0,0,1,"Thanks for warning me. It WOULD be too much for my anxiety levels.",,,,1243181656749506560,https://twitter.com/DebarringtonH/status/1243181656749506560
2020-03-26 14:22:49,_malvarado_,ChrisRGun,0,0,0,"i’m running for president because of my anxiety about this situation https://twitter.com/ChrisRGun/status/1242879068267134976 …",,,,1243181617486716930,https://twitter.com/_malvarado_/status/1243181617486716930
2020-03-26 14:21:59,theliammalone,,4,0,7,"I’m going to try to ride my bike all day and blow off some stress & anxiety. Let me know if you want to join for some miles",,,,1243181409809969154,https://twitter.com/theliammalone/status/1243181409809969154
2020-03-26 14:20:59,wright_dc,realjuliasong,0,0,0,"You really have social anxiety? Would never have guessed.",,,,1243181156213932034,https://twitter.com/wright_dc/status/1243181156213932034
2020-03-26 14:20:50,SOCHmh,,0,3,4,"I'm practicing social distancing... Can I go out for exercise? Here's the answer: https://www.cbc.ca/news/health/coronavirus-exercise-covid-19-guidelines-1.5509056 … #COVID2019 #exercise #mentalhealth #anxiety #SocialDistanacing @DoSAAonline @SouthAsianMH @macnursing @farooqnaeem7 @premstateofmind @GursharanVirdee @MentalHealthTO",,@DoSAAonline @SouthAsianMH @macnursing @farooqnaeem7 @premstateofmind @GursharanVirdee @MentalHealthTO,#COVID2019 #exercise #mentalhealth #anxiety #SocialDistanacing,1243181117508853763,https://twitter.com/SOCHmh/status/1243181117508853763
2020-03-26 14:19:10,ingram_johnna,,0,0,0,"#anxiety #anxietyrelief #joy @Benton Center, New York https://www.instagram.com/p/B-My_UhjeDwwdEeJvyHyMgfP08rHZjduxdIGqE0/?igshid=1jwnibgtiz34u …",,@Benton,#anxiety #anxietyrelief #joy,1243180697558437888,https://twitter.com/ingram_johnna/status/1243180697558437888
2020-03-26 14:19:08,loudabooo,,0,0,0,"I was one of those people and all it did was give me anxiety. But you gotta shut media off at some point for a little bit. Stay clean, stay safe and you’ll be fine",,,,1243180690243563524,https://twitter.com/loudabooo/status/1243180690243563524
2020-03-26 14:17:54,_risss_,jaasmineeem,0,2,1,"It’s literally my toughest decision, but the coffee/anxiety wins every time https://twitter.com/jaasmineeem/status/1243179211084435458 …",,,,1243180378438893568,https://twitter.com/_risss_/status/1243180378438893568
2020-03-26 14:16:48,digitalstarseed,tellymund0,0,0,1,"Meditation! Tho last night took me 30 minutes because I had really bad anxiety but eventually, it got me to fall asleep.",,,,1243180102793428993,https://twitter.com/digitalstarseed/status/1243180102793428993
2020-03-26 14:15:31,_blake69_,,0,1,0,"Having Anxiety during this type of event is really fucking with me",,,,1243179782373650434,https://twitter.com/_blake69_/status/1243179782373650434
2020-03-26 14:13:52,danielleuihlein,,0,0,0,"#friends #friendstv #theonewiththequarantine #corona #corona2020 #covid #covid_19 #covıd19 #socialdistancing #selfisolation #anxiety #stress #depression @Lake Grove, New York https://www.instagram.com/p/B-MyYbClHk6/?igshid=1s5zpr0b93qih …",,@Lake,#friends #friendstv #theonewiththequarantine #corona #corona2020 #covid #covid_19 #covıd19 #socialdistancing #selfisolation #anxiety #stress #depression,1243179365388693505,https://twitter.com/danielleuihlein/status/1243179365388693505
2020-03-26 14:13:50,malinutt10,,1,0,0,"Math: The struggle is real. Anyone that doesn’t have a learning disorder can’t possibly understand how painful it is. Trying to help Aedan means I have to go back 45 years. Just trying to remind myself of simple things brings anxiety many never know. Now do this while working,",,,,1243179355259326467,https://twitter.com/malinutt10/status/1243179355259326467
2020-03-26 14:12:42,evanphillips45,AndrewYang,0,0,2,"Andrew Yang just summed up all my stress and anxiety in a single tweet. https://twitter.com/AndrewYang/status/1243176361272979457 …",,,,1243179070692737026,https://twitter.com/evanphillips45/status/1243179070692737026
2020-03-26 14:12:03,crimsonruari,UrsulaV,0,0,7,"Anxiety 2020, now with Pandemic Mechanics!",,,,1243178906389286912,https://twitter.com/crimsonruari/status/1243178906389286912
2020-03-26 14:09:50,pose4thecanon,xobcrbie,0,0,2,"Still can’t believe she tried that social anxiety bullshit",,,,1243178349301837828,https://twitter.com/pose4thecanon/status/1243178349301837828
2020-03-26 14:09:37,urnextmistakee,urnextmistakee,0,0,19,"uh so if you liked this you should message me, my anxiety doesn’t want me to message people first today https://twitter.com/urnextmistakee/status/1242883980527112195 …",,,,1243178293714735107,https://twitter.com/urnextmistakee/status/1243178293714735107
2020-03-26 14:06:32,Chefjuanmora,,0,0,2,"Not driving to Milwaukee today has me bummed out. The anxiety of traffic, time to light the grill, how many beers can we drink before we go in, getting in before the line is too long, seeing the field, the craft beer area, watching players warm up and seeing my fellow @Cubs fans",,@Cubs,,1243177518267543552,https://twitter.com/Chefjuanmora/status/1243177518267543552
2020-03-26 14:06:13,Kollision_Ent,,0,0,0,"In the multitude of my anxieties within me, Your comforts delight my soul. Psalms 94:19 @YouVersion #StepInYourWarRoom #watchgodwork #baptism #faith #renewed #restored #humble #warrior #purpose #godisgood #life #rebirth #TuffMusik #prayer #christian #bornagain #artistpic.twitter.com/9UwvZLmyuX",,@YouVersion,#StepInYourWarRoom #watchgodwork #baptism #faith #renewed #restored #humble #warrior #purpose #godisgood #life #rebirth #TuffMusik #prayer #christian #bornagain #artistpic,1243177441612509184,https://twitter.com/Kollision_Ent/status/1243177441612509184
2020-03-26 14:06:00,lov3yourself88,,0,0,15,"Good morning beautiful people. Wish you guys nothing but the BEST of today. Anxiety was up the roof last night & couldn’t sleep. Decided to check my email & one thing led to another to another NO REGRETS @EthanDolan @GraysonDolanpic.twitter.com/5BZZE4fHtq",,@EthanDolan @GraysonDolanpic,,1243177386289451010,https://twitter.com/lov3yourself88/status/1243177386289451010
2020-03-26 14:05:36,_southern_spice,,0,0,0,"Y'all don't know anxiety or fear til you got a cat in your lap and you not sure if that sneeze you feel coming on is gonna make said cat shred your legs when they launch off or they just gonna sit still and look at you annoyed",,,,1243177286595227650,https://twitter.com/_southern_spice/status/1243177286595227650
2020-03-26 14:05:03,w_hemsworth,,0,0,0,"The business of life should not preoccupy us with its anxiety and pride, so that we no longer strive with all the love of our heart to be like our Redeemer, and to follow his example.-St. Leo the Great",,,,1243177144609456130,https://twitter.com/w_hemsworth/status/1243177144609456130
2020-03-26 14:03:10,BroadAndMarket,BroadAndMarket,1,0,0,"Present: this is the card of delay and postponement. You are feeling overwhelmed by stress and anxiety. This too shall pass. Future: you will face hardship, but remember this is only temporary. You will have access to plenty of help and support, but must be willing to ask.",,,,1243176672620425217,https://twitter.com/BroadAndMarket/status/1243176672620425217
2020-03-26 14:01:05,BroadAndMarket,refreshmyjawn,1,0,0,"Past: you’ve had a lot of raw emotions which you’ve been able to master. You’ve overcome your fear and anxieties and have found a courage you didn’t realize you had in you. pic.twitter.com/3D1LwjXoPq",,,,1243176149372592128,https://twitter.com/BroadAndMarket/status/1243176149372592128
2020-03-26 14:00:34,wrtrgrl77,kathrynw5,0,0,0,"Great. A new anxiety to add to my list. https://twitter.com/kathrynw5/status/1242908072609288194 …",,,,1243176019378528256,https://twitter.com/wrtrgrl77/status/1243176019378528256
2020-03-26 13:59:48,melmounttt,,0,1,3,"My anxiety is literally ruining my life",,,,1243175826268487681,https://twitter.com/melmounttt/status/1243175826268487681
2020-03-26 13:59:47,pale_ginger35,rachelgoodstein,0,0,0,"This. So much. #Anxiety https://twitter.com/rachelgoodstein/status/1243007419233570817 …",,,#Anxiety,1243175822527266816,https://twitter.com/pale_ginger35/status/1243175822527266816
2020-03-26 13:59:43,KobelDave,,0,0,0,"COVID-19 causing you to confront your own mortality? Having an existential crisis? Check out Tanner’s work about Existential Anxiety! Thinking Time With Tanner Ep. 1 Existential Anxiety and Authenticity https://youtu.be/P3kHoxHNGxE via @YouTube",,@YouTube,,1243175805154451459,https://twitter.com/KobelDave/status/1243175805154451459
2020-03-26 13:59:04,LheimIndustries,,0,0,0,"Being still is so important during these times. If you find your self waking up in the morning in fear or filled with anxiety. STOP. Pray first, before rolling out of bed. Reacting is never a good thing. When you are at Peace = You are in Power. #remember",,,#remember,1243175640209207296,https://twitter.com/LheimIndustries/status/1243175640209207296
2020-03-26 13:57:18,BetsyEllsworth,,0,0,0,"Therapist Julia Samuel on how to manage anxiety and grief during coronavirus https://www.ft.com/content/3b429e0a-6e2a-11ea-9bca-bf503995cd6f?segmentid=acee4131-99c2-09d3-a635-873e61754ec6 …",,,,1243175194874843138,https://twitter.com/BetsyEllsworth/status/1243175194874843138
2020-03-26 13:57:12,ehogshead,,0,1,3,"2. @MsShtyrkaloLaw @MrGilroyLaw @uchelawnjoku your compassionate leadership decreases my anxiety which allows me to focus on giving support to our students. Thank you for your model of leadership, your grace, your vast knowledge, and beautiful hearts. #pedagogyoflove #iloveyoupic.twitter.com/uIeo0W1DpG",,@MsShtyrkaloLaw @MrGilroyLaw @uchelawnjoku,#pedagogyoflove #iloveyoupic,1243175171516780548,https://twitter.com/ehogshead/status/1243175171516780548
2020-03-26 13:55:33,mahoganycurlsx,Mufaa6,0,0,0,"my anxiety level was so high watching this from north carolina https://twitter.com/Mufaa6/status/1242854619178467328 …",,,,1243174754212855813,https://twitter.com/mahoganycurlsx/status/1243174754212855813
2020-03-26 13:55:01,doriginal,,0,0,0,"Anxiety is a fucking bitch",,,,1243174621534474240,https://twitter.com/doriginal/status/1243174621534474240
2020-03-26 13:54:45,DrPeteMarcelo,,0,4,6,"Sitting in one our offices. #mcm #bertoia #design #architecture #midcentury #onthefarm #miesvanderohe #www.drpetemarcelo.org #anxiety #health #stress #counseling #therapy #mentalhealth #psychologist #Huntley #il #Dr Pete Marcelo Psychologist and Counseling Services of Huntleypic.twitter.com/1xLyA37ejj – at Dr. Pete Marcelo Psychologist and Counseling Services of Huntley IL",,,#mcm #bertoia #design #architecture #midcentury #onthefarm #miesvanderohe #www #anxiety #health #stress #counseling #therapy #mentalhealth #psychologist #Huntley #il #Dr,1243174553976811527,https://twitter.com/DrPeteMarcelo/status/1243174553976811527
2020-03-26 13:54:44,CreativeMcGill1,,0,0,1,"I know some of us make this distance learning experience look easy, however we have our moments of anxiety, frustration and fear with this new normal. Technology can be overwhelming, being in the house can be… https://www.instagram.com/p/B-MwMY7nwEo/?igshid=20fam5gxbxoy …",,,,1243174551246254080,https://twitter.com/CreativeMcGill1/status/1243174551246254080
2020-03-26 13:53:05,CaliSergent,,0,0,0,"When I Was Working I Was Happy w/No Anxiety Now I Been Home w/ anxietyOn 100",,,,1243174133204205568,https://twitter.com/CaliSergent/status/1243174133204205568
2020-03-26 13:52:42,DrSamiSchalk,,2,1,62,"You know it’s bad when my mother who barely uses social media shares a post from the local fire department on how to handle an anxiety attack.",,,,1243174039079788545,https://twitter.com/DrSamiSchalk/status/1243174039079788545
2020-03-26 13:50:33,CarolineCullins,,0,0,10,"It's about that time where I slip back into depression/anxiety and lose 25 lbs again lol I'm fine tho",,,,1243173499138686982,https://twitter.com/CarolineCullins/status/1243173499138686982
2020-03-26 13:49:21,SOCHmh,,0,0,3,"Don't underestimate the power of your breath #mh #mentalhealth #mentalillness #bellletstalk #sochmentalhealth #soch #southasianmentalhealth #Covid_19 #anxiety #socialdistancing #SelfIsolation #breathe #mindfulness #stillnesspic.twitter.com/0LDYUMgBVz",,,#mh #mentalhealth #mentalillness #bellletstalk #sochmentalhealth #soch #southasianmentalhealth #Covid_19 #anxiety #socialdistancing #SelfIsolation #breathe #mindfulness #stillnesspic,1243173193944371200,https://twitter.com/SOCHmh/status/1243173193944371200
2020-03-26 13:48:12,Nite5ky,,0,1,9,"Fear and anxiety many times indicates that we are moving in a positive direction, out of the safe confines of our comfort zone, and in the direction of our true purpose. #morningrun #thursdaythoughts #atlantapic.twitter.com/xG3x8mL7Jb – at Piedmont Park",,,#morningrun #thursdaythoughts #atlantapic,1243172908136050692,https://twitter.com/Nite5ky/status/1243172908136050692
2020-03-26 13:43:40,HCISDBehavior,Ms_J_Huston,0,0,4,"Do you find yourself anxious or suffering from anxiety during these uncertain times? The follow is a wonderful grounding technique that definitely helps! I just did it and feel more centered #mentalhealth #focushttps://twitter.com/Ms_J_Huston/status/1243158757993046017 …",,,#mentalhealth #focushttps,1243171765376954374,https://twitter.com/HCISDBehavior/status/1243171765376954374
2020-03-26 13:43:27,ravensimoneee,,1,0,2,"Why does college give me so much anxiety, why am I like thiiiiiss",,,,1243171711459221506,https://twitter.com/ravensimoneee/status/1243171711459221506
2020-03-26 13:42:22,rockernatnat,,0,0,1,"Today’s current mood is brought to you by anxiety induced stomach issues. Burping away as I drive to work.",,,,1243171439353778176,https://twitter.com/rockernatnat/status/1243171439353778176
2020-03-26 13:41:48,RunnertheFirst,DC_PoliceDogs,0,0,0,"Separation anxiety. https://twitter.com/DC_PoliceDogs/status/1242911143867355138 …",,,,1243171296000839681,https://twitter.com/RunnertheFirst/status/1243171296000839681
2020-03-26 13:41:15,DeaconsNDragons,,1,0,4,"Update: It was the anxiety. But it’s better now!",,,,1243171156795904001,https://twitter.com/DeaconsNDragons/status/1243171156795904001
2020-03-26 13:37:02,lindseymaggard,,0,0,3,"Harry Potter consistently on TV these days really calming the anxiety of millennials in the best way",,,,1243170095221833729,https://twitter.com/lindseymaggard/status/1243170095221833729
2020-03-26 13:35:53,chrystal_kruzic,kaitlynbristowe,0,0,0,"I’ve been having anxiety lately too. I work in the ER & we’re doing okay for now, but there’s concern for running out of things. Also I’m anxious bc I can’t visit home (CA) anytime I want right now. It’s a weird time for everyone & that helps me get thru it. We’re in it 2gether",,,,1243169805475221504,https://twitter.com/chrystal_kruzic/status/1243169805475221504
2020-03-26 13:35:47,9misslou,,0,0,0,"I just had a whole ass anxiety attack and ripped my room apart to find some shit that was sitting on the dresser.",,,,1243169779659280385,https://twitter.com/9misslou/status/1243169779659280385
2020-03-26 13:34:38,lacy_nic,,1,0,7,"I have anxiety bc i should be boozing for the tribe and it’s hittin the 60s WE ARE FINE",,,,1243169491384664064,https://twitter.com/lacy_nic/status/1243169491384664064
2020-03-26 13:34:13,GretchenWylder,,4,2,20,"Anyone else been wide awake at 5:30am riddled with anxiety for the last 10 consecutive days?",,,,1243169386187218944,https://twitter.com/GretchenWylder/status/1243169386187218944
2020-03-26 13:32:01,markbarnes19,RavesiWeinstein,0,1,2,"#Congrats Christine. I’m so proud of you and this book, which is timely and so needed. Your honesty, experience, and expertise about #anxiety will make educators better and will, ultimately, change kids’ and adults’ lives.",,,#Congrats #anxiety,1243168835194310657,https://twitter.com/markbarnes19/status/1243168835194310657
2020-03-26 13:31:05,beardedphotog24,,0,0,1,"Good read for my photography friends and for everyone else to know one of the reasons photography is so important to me #anxiety #photographer##photographer #mentalhealth #MentalHealthAwareness https://digital-photography-school.com/3-ways-photography-can-ease-anxiety/ …",,,#anxiety #photographer # #photographer #mentalhealth #MentalHealthAwareness,1243168597779898368,https://twitter.com/beardedphotog24/status/1243168597779898368
2020-03-26 13:31:01,stayyg0lden,,0,0,0,"im having the absolute worst ongoing anxiety attack of my life",,,,1243168582613307392,https://twitter.com/stayyg0lden/status/1243168582613307392
2020-03-26 13:26:26,Branbav,,0,0,0,"Yeeeeeeee I’m having anxiety attacks in the morning over nothing",,,,1243167430068842500,https://twitter.com/Branbav/status/1243167430068842500
2020-03-26 13:19:21,WildnWonderful7,,1,0,2,"I’ve been waiting to go back to flagging all winter, now I’m here and I have such anxiety about it, I hate this",,,,1243165646776647680,https://twitter.com/WildnWonderful7/status/1243165646776647680
2020-03-26 13:15:53,clclyne,jarhartz,1,0,14,"Yes, and beyond access and ability at this moment to humanity. There is much fear and anxiety about what’s happening, impossible for us as educators to gauge what the atmosphere is like in each student’s, and educator’s house. The priority now should be connection.",,,,1243164773333770241,https://twitter.com/clclyne/status/1243164773333770241
