date,username,to,replies,retweets,favorites,text,geo,mentions,hashtags,id,permalink
2020-03-26 05:01:40,hannahkrill,helloitskyliee,1,0,1,"I relate to this a LOT on the anxiety side! Something that has helped me over the past few days is taking my temperature. ~98.6 and we are golden I feel like I would know if I had a fever, but the visual confirmation helps! Love a good placebo!",,,,1243040397724696576,https://twitter.com/hannahkrill/status/1243040397724696576
2020-03-26 05:00:41,Taye1k,,0,0,0,"Money heist giving me hella anxiety",,,,1243040150734733314,https://twitter.com/Taye1k/status/1243040150734733314
2020-03-26 04:59:49,evelyndesy,,0,0,0,"My anxiety has been kicking in these past two weeks and it needs to stop. I haven't felt this way in over a year.",,,,1243039934027452418,https://twitter.com/evelyndesy/status/1243039934027452418
2020-03-26 04:59:19,Elizabethann1,,0,0,1,"Yes I know anxiety has the same symptoms. I’m thinking for people actually sick who can’t find meds or thermometers anywhere",,,,1243039809926389760,https://twitter.com/Elizabethann1/status/1243039809926389760
2020-03-26 04:59:12,HoneyGirl0711,,1,0,0,"I am very grateful my job gave me w@h equipment to continue servicing my Dr. offices and patients. Between getting their meds out and worrying about home and this virus my nerves and anxiety were overwhelming. Set up took forever and I still have a phone issue but Im home finally",,@h,,1243039778691522560,https://twitter.com/HoneyGirl0711/status/1243039778691522560
2020-03-26 04:59:10,shortieelow,,0,0,0,"“We need to talk” gives me the worst anxiety",,,,1243039771754184704,https://twitter.com/shortieelow/status/1243039771754184704
2020-03-26 04:59:10,_CHMST,,1,1,4,"Maybe my creativity flows when I have a constant lingering feeling of anxiety? It's like my brain is overloading and making music is the only way to calm it Im cool widdit",,,,1243039769883484161,https://twitter.com/_CHMST/status/1243039769883484161
2020-03-26 04:58:52,KelburnRecovery,,0,0,0,"Panicking from #covid_19 ? we are here to help you to manage your anxiety. we’re committed to continuing to serve our community by doing everything possible to make treatment available during this difficult time. http://www.kelburnrecoverycentre.com & talk to our professional consultant.pic.twitter.com/1YbR25FVpl",,,#covid_19,1243039694469783552,https://twitter.com/KelburnRecovery/status/1243039694469783552
2020-03-26 04:58:49,jamescfoote,,1,0,5,"Dear @hulu: I humbly write to inform you that the COMMERCIALS ARE TOO DAMN LOUD. I mean that in the nicest way possible. Because I love you. But, I get anxiety trying to find the remote in time to mute the tv going to a commercial break. But thanks for everything else!",,@hulu,,1243039681757020160,https://twitter.com/jamescfoote/status/1243039681757020160
2020-03-26 04:55:46,kneeekole,JobelleIsKewl,1,0,1,"Omg it makes me feel a lot better I’m not alone in this. It feels like a rollercoaster of anxiety. You’re right we can get through this",,,,1243038916606713856,https://twitter.com/kneeekole/status/1243038916606713856
2020-03-26 04:55:10,lilg540,BrerDani,1,0,1,"So jelly!!! But also not because so much ANXIETY lol",,,,1243038763451682817,https://twitter.com/lilg540/status/1243038763451682817
2020-03-26 04:52:19,BHFx90,,0,1,2,"The word anxiety didn’t exist before 2016 I swear",,,,1243038048247377921,https://twitter.com/BHFx90/status/1243038048247377921
2020-03-26 04:48:24,MCovino10,,0,0,1,"It used to give me comfort having so many friends in the medical field... now it just gives me tremendous anxiety",,,,1243037059696275456,https://twitter.com/MCovino10/status/1243037059696275456
2020-03-26 04:44:41,AntMillerJr,,0,1,4,"Overthinking & anxiety should be a drug",,,,1243036126673350656,https://twitter.com/AntMillerJr/status/1243036126673350656
2020-03-26 04:44:27,Audfowl,,0,0,9,"Everything hurts and I don’t care. The sunshine was worth it. Sweated out the anxiety of the day. #fitleaders #fanaticdisciplinechallenge pic.twitter.com/RKAFRn6slh",,,#fitleaders #fanaticdisciplinechallenge,1243036068733124608,https://twitter.com/Audfowl/status/1243036068733124608
2020-03-26 04:42:44,carlthegrape,Clayitoo,1,0,1,"As Above So Below is good! The setting is so creepy. I like The VVitch- it's just really tense the whole time. It Follows is also one of my faves. I think the whole concept is really creepy. I also gotta say I do love the Blair Witch Project. That movie gave me so much anxiety",,,,1243035634622742529,https://twitter.com/carlthegrape/status/1243035634622742529
2020-03-26 04:38:45,Official_fonso,,0,0,0,"I hate this, my sleep schedule is completely out of whack, my depression, feeling lonely, anxiety, are increasingly on rise. A mandatory paid is not cool, can't wait to get back to work, doing community service projects.",,,,1243034633773645826,https://twitter.com/Official_fonso/status/1243034633773645826
2020-03-26 04:38:42,EChristensen_,AlexGoldApel,1,0,2,"Thank you for continuing to press on this issue, @AlexGoldApel. Without a doubt, internship uncertainty is adding to the anxiety of thousands of students and recent graduates across the country.",,@AlexGoldApel,,1243034621710938114,https://twitter.com/EChristensen_/status/1243034621710938114
2020-03-26 04:38:36,ceeburgsss,,0,0,3,"I hate that my anxiety is back I was doing so good",,,,1243034596582678529,https://twitter.com/ceeburgsss/status/1243034596582678529
2020-03-26 04:37:56,Anne_Bivalent,girldrawsghosts,0,0,0,"Anxiety is a bitch and Xanax is the best",,,,1243034425304272904,https://twitter.com/Anne_Bivalent/status/1243034425304272904
2020-03-26 04:36:51,AnjunaKadeM,,4,0,5,"I’m also just so worried that something might happen and I won’t be able to help my Grandma. The anxiety is eating me alive.",,,,1243034155253764096,https://twitter.com/AnjunaKadeM/status/1243034155253764096
2020-03-26 04:35:28,mario_arencibia,JayDizzyD,1,0,1,"I feel you bro I suffer from high anxiety",,,,1243033806199611393,https://twitter.com/mario_arencibia/status/1243033806199611393
2020-03-26 04:31:59,rodbunnyslay,,0,0,6,"Staying up watching #LivingSingle is such an anxiety reducer. pic.twitter.com/KuluAXZ5Bn",,,#LivingSingle,1243032929879687169,https://twitter.com/rodbunnyslay/status/1243032929879687169
2020-03-26 04:30:21,mfd214,,1,0,3,"I really hate this quarantine. I hate the corona virus like my anxiety is up cause I’m alone cause my gf is essential. But i can’t go to the store cause I hate large groups of people. I’ve legit played COD from the time i get up to bed cause I have someone to talk to.",,,,1243032517885734912,https://twitter.com/mfd214/status/1243032517885734912
2020-03-26 04:28:45,NicolePalacio85,JeffreeStar,0,0,0,"So far just took my anxiety meds and trying to keep my son blood sugar levels stable. Just another sleepless night.",,,,1243032113902952448,https://twitter.com/NicolePalacio85/status/1243032113902952448
2020-03-26 04:28:42,PeterVerry,ATLnewsgirl,0,0,1,"Not only is this video adorable but it also actually put me at peace. Nice break from the string of anxiety-filled days. (Thanks for sharing @SarahSpain)https://twitter.com/ATLnewsgirl/status/1242933758409486336 …",,@SarahSpain,,1243032104113496064,https://twitter.com/PeterVerry/status/1243032104113496064
2020-03-26 04:25:48,EricaLiv_,,1,2,4,"My anxiety is so bad tonight",,,,1243031372215746566,https://twitter.com/EricaLiv_/status/1243031372215746566
2020-03-26 04:21:58,ayeesydney13,,0,1,14,"why even take my anxiety meds when i could simply pick at my nails until they bleed",,,,1243030410377998336,https://twitter.com/ayeesydney13/status/1243030410377998336
2020-03-26 04:21:42,LaIndiiuu,,1,0,0,"Bruh ! Having anxiety is such a pain in the ass!!! I’ve been trying ... for 3 hours to calm it down by doing breathing exercises ... I’m over it ... it’s time to smoke ...",,,,1243030343218798592,https://twitter.com/LaIndiiuu/status/1243030343218798592
2020-03-26 04:21:38,Jahypimentel,,0,0,0,"Interrupt ANXIETY with GRATITUDE Be patient. The best is yet to come Things will NOT be the same, but a new normal will be established The best is yet to come. Be patient May we be open to the teachings life… https://www.instagram.com/p/B-Lum0OjyVy/?igshid=x6eax48vkxbv …",,,,1243030325392965635,https://twitter.com/Jahypimentel/status/1243030325392965635
2020-03-26 04:20:31,KaitlinRosexo,,0,0,0,"My mind has gone dark the past few days. I currently don’t know what to do. I am scared. No terrified. It seems like nothing can calm my anxiety.",,,,1243030043640676354,https://twitter.com/KaitlinRosexo/status/1243030043640676354
2020-03-26 04:19:14,Isadora_Cintron,,0,0,1,"Anxiety #NYCLockdown #COVID2019 #missmyfriends #missmyfamily #StayHome #CoronavirusNewYork",,,#NYCLockdown #COVID2019 #missmyfriends #missmyfamily #StayHome #CoronavirusNewYork,1243029719395770369,https://twitter.com/Isadora_Cintron/status/1243029719395770369
2020-03-26 04:18:21,Kay__Stackss,,1,0,2,"I am so ready for my son to be at the age where he can talk cause when he gets sick my anxiety be at an all times high tryna figure out what’s wrong",,,,1243029498779574273,https://twitter.com/Kay__Stackss/status/1243029498779574273
2020-03-26 04:16:47,ohh_dallas,,1,0,0,"My Anxiety Is Through The Roof Anybody Have Any Tips ? Please",,,,1243029105379082242,https://twitter.com/ohh_dallas/status/1243029105379082242
2020-03-26 04:14:34,aleciampaglio,,0,0,5,"Stopped playing #ACNH for 45 minutes and had a anxiety attack about something in the news...guess I’d better keep playing then",,,#ACNH,1243028545825157120,https://twitter.com/aleciampaglio/status/1243028545825157120
2020-03-26 04:13:57,kaameely,,0,0,0,"hate anxiety",,,,1243028392418717696,https://twitter.com/kaameely/status/1243028392418717696
2020-03-26 04:13:25,AnneMFinn,Stowydad,2,0,2,"That is a silver lining! Let’s also be aware that for some the forced slowdown is causing anxiety, conflict and grief. I hope the majority are having the experience you are.",,,,1243028255046873095,https://twitter.com/AnneMFinn/status/1243028255046873095
2020-03-26 04:11:51,lilwarriorellie,,0,0,0,"Uhhmmm.. Hi, anxiety.. pic.twitter.com/wMBG2KsczE",,,,1243027864829620224,https://twitter.com/lilwarriorellie/status/1243027864829620224
2020-03-26 04:09:39,taylurrrrp,,0,0,1,"My anxiety has been pretty high since this whole quarantine thing, I can’t focus on reading at all, basically just watching movies constantly to keep my mind busy.",,,,1243027310220959745,https://twitter.com/taylurrrrp/status/1243027310220959745
2020-03-26 04:03:47,amsimmonss,justsomeone8888,0,0,1,"Deadass I got anxiety lookin at it",,,,1243025831921885185,https://twitter.com/amsimmonss/status/1243025831921885185
2020-03-26 04:01:28,bekkssssss,,0,0,0,"i have too much anxiety to sleep in complete darkness what makes anyone think i’m actually out in public at this time",,,,1243025247907045378,https://twitter.com/bekkssssss/status/1243025247907045378
2020-03-26 03:59:04,TheTeeta,Petelaflame,1,0,2,"That gave me anxiety",,,,1243024644556369920,https://twitter.com/TheTeeta/status/1243024644556369920
2020-03-26 03:58:48,m00ndazzee,,0,2,6,"how am i supposed to focus on school when the crippling anxiety of impending doom rushes through my head every second of every day!!! ha ha ha !!!!",,,,1243024577413795840,https://twitter.com/m00ndazzee/status/1243024577413795840
2020-03-26 03:57:03,clarr_care_serv,,0,0,0,"When anxiety was great within me, your consolation brought me joy. Psalms 94:19 NIV https://bible.com/verse-of-the-day/psa.94.19/49565 …pic.twitter.com/psp9V0KXCu",,,,1243024137934815237,https://twitter.com/clarr_care_serv/status/1243024137934815237
2020-03-26 03:57:02,burrannedee,,0,0,0,"I was having a really bad anxiety filled night until a cute little old lady came in, I wrist banded her, and she complimented my glasses and wished me good health in times like these",,,,1243024133421780992,https://twitter.com/burrannedee/status/1243024133421780992
2020-03-26 03:54:43,Kayleighfuj,,0,0,0,"Really not appreciating how my anxiety has been manifesting lately...",,,,1243023553001189377,https://twitter.com/Kayleighfuj/status/1243023553001189377
2020-03-26 03:54:42,whitewavvve,,1,0,5,"Man this quarantine really making my anxiety reattach itself to my own inner fat phobia",,,,1243023546810597379,https://twitter.com/whitewavvve/status/1243023546810597379
2020-03-26 03:51:04,OPM_Jose,,0,0,1,"Anxiety is the new norm I guess",,,,1243022634616360960,https://twitter.com/OPM_Jose/status/1243022634616360960
2020-03-26 03:50:54,kaylaepling,,2,5,13,"Having bad anxiety is the worst thing in the world.",,,,1243022590232363008,https://twitter.com/kaylaepling/status/1243022590232363008
2020-03-26 03:50:25,eegorebeaver,,0,0,0,"#anxiety was eating at me like rats gnawing on your toes when you're limbs are secured to each corner of a four poster bed in an old dilapidated, almost haunted house, like a cross between the house Norman Bates… https://www.instagram.com/p/B-LrB77BZlr/?igshid=6c357ln48knf …",,,#anxiety,1243022468509503499,https://twitter.com/eegorebeaver/status/1243022468509503499
2020-03-26 03:48:09,Painizslov3,,0,0,0,"how the fuck am I supposed to stop touching my face I have a NOSE RING and ANXIETY",,,,1243021896679071744,https://twitter.com/Painizslov3/status/1243021896679071744
2020-03-26 03:45:43,CaponeTeaches,,3,0,7,"Yesterday, the first friend-of-a-friend died. Today, a friend is (probably?) dying. Things are getting sadder quickly. At some point, the kids are going to experience the same, and none of us will be able to carry on as usual. The anxiety is getting to me.",,,,1243021287712149504,https://twitter.com/CaponeTeaches/status/1243021287712149504
2020-03-26 03:43:14,robbie_wiles,,0,0,0,"In the multitude of my anxieties within me, Your comforts delight my soul. https://www.bible.com/114/psa.94.19.nkjv …",,,,1243020659241951235,https://twitter.com/robbie_wiles/status/1243020659241951235
2020-03-26 03:43:05,Vampirella1916,caitlinpeluffo,0,0,0,"Noooooo I missed it.. gotta thank my late night anxiety for messing up my day https://twitter.com/caitlinpeluffo/status/1242876950244401153 …",,,,1243020624693473285,https://twitter.com/Vampirella1916/status/1243020624693473285
2020-03-26 03:42:38,Janislandgirl,davidaxelrod,0,1,1,"Just stop airing his daily campaign rally disguised as a CV19 briefing. He just makes stuff up & sings his praises anyway. He adds to everyone’s anxiety. Gov Cuomo is the one I’m listening to now",,,,1243020509513519106,https://twitter.com/Janislandgirl/status/1243020509513519106
2020-03-26 03:40:53,bad_stronger,,1,0,33,"how the hell am I expected to sit down and work on an ethics essay when everyone is dying and I already know that nothing is real, I have anxiety",,,,1243020071506763781,https://twitter.com/bad_stronger/status/1243020071506763781
2020-03-26 03:37:52,anna_malave94,,0,0,0,"it’s that time where i’d usually be crying in the shower because of anxiety but i didn’t do that today so it’s time for the breakdown hours and like fuck anxiety please go away ...",,,,1243019312715182080,https://twitter.com/anna_malave94/status/1243019312715182080
2020-03-26 03:37:32,Chrisfabs,,0,0,0,"Today we were told that we are to wear 1 mask for 8 hours (unless it becomes grossly soiled) and then take them off without ripping them and put them in a bin to be sterilized and reused... to say my anxiety is high would be an understatement.",,,,1243019228501794816,https://twitter.com/Chrisfabs/status/1243019228501794816
2020-03-26 03:36:40,tokyodrippin,,1,0,7,"real anxiety hours pic.twitter.com/7QlGZ3aPyg",,,,1243019010423361537,https://twitter.com/tokyodrippin/status/1243019010423361537
2020-03-26 03:33:21,_e_o_g_,,0,0,1,"Surry has a Coronavirus case.. well. My anxiety just sky rocketed.",,,,1243018173550678021,https://twitter.com/_e_o_g_/status/1243018173550678021
2020-03-26 03:33:00,JenMichelleCrow,kariholley,0,0,1,"Thanks! It’s my brave face for today. Masking the anxiety rolling beneath. Feeling a bit better talking it out.",,,,1243018087970017280,https://twitter.com/JenMichelleCrow/status/1243018087970017280
2020-03-26 03:31:11,WoodsPatty,,0,0,1,"By the time I leave work, I'm sick with anxiety. My hands are raw from bleaching everything. I'm scared to walk into my own house in case COVID-19 is clinging to me.",,,,1243017627192213504,https://twitter.com/WoodsPatty/status/1243017627192213504
2020-03-26 03:30:40,SandraDsAdvent1,,0,0,0,"I’m filled with anxiety because I’m not as filled with anxiety as I think I should be during a pandemic. I know the virus is bad. But I’m over here like, ‘meh’. I’m probably definitely getting the coronavirus tomorrow . #COVID2019 #SocialDistancing #StayHome #myemptynestlife",,,#COVID2019 #SocialDistancing #StayHome #myemptynestlife,1243017500180328456,https://twitter.com/SandraDsAdvent1/status/1243017500180328456
2020-03-26 03:30:08,laylalexisdead,quenblackwell,0,0,0,"or constant anxiety attacks, yes continue? https://twitter.com/quenblackwell/status/1242944970295857152 …",,,,1243017362930089989,https://twitter.com/laylalexisdead/status/1243017362930089989
2020-03-26 03:28:17,dbgrimes1,,0,0,0,"When my anxieties multiply, your comforting calms me down. Psalms 94:19 CEB ...Your comforting calms me down. https://bible.com/bible/37/psa.94.19.CEB … #keokuk #mississippiriver @Lock Number 19 https://www.instagram.com/p/B-LogIaHXkV/?igshid=yg7gu75zur1d …",,@Lock,#keokuk #mississippiriver,1243016898737922048,https://twitter.com/dbgrimes1/status/1243016898737922048
2020-03-26 03:28:00,Veronica1776,JeffreeStar,0,0,0,"My anxiety and catastrophic thinking are at an all time high. I feel like screaming most of the time. I am trying to not lose my shit but, it’s hard. A teen with autism, a baby with Down syndrome and a daughter that is also frustrated is sometimes too much. #staysafe",,,#staysafe,1243016828856614912,https://twitter.com/Veronica1776/status/1243016828856614912
2020-03-26 03:26:51,big__germ,,0,0,4,"My anxiety showing up after a great day pic.twitter.com/UMp81JqW85",,,,1243016536547151872,https://twitter.com/big__germ/status/1243016536547151872
2020-03-26 03:25:45,sugarrbloss3m,,0,0,0,"I am trying so hard to manage my anxiety through this shit with trying my best to keep a daily routine but is seriously the hardest thing when it feels like my life has no structure at all anymore.",,,,1243016263359762433,https://twitter.com/sugarrbloss3m/status/1243016263359762433
2020-03-26 03:25:44,lasuprema,,0,0,2,"Going to HEB was anxiety-enhancing, but I won’t have to go back for a while and I got to wait in line under this beautiful #sycamore. #sycamoressmelllikesummer @Mueller, Austin https://www.instagram.com/p/B-LoNkll9RulhSAyljTLBCT5q9vrnbi18ynH4M0/?igshid=k9kcnvc438q8 …",,@Mueller,#sycamore #sycamoressmelllikesummer,1243016258368360448,https://twitter.com/lasuprema/status/1243016258368360448
2020-03-26 03:24:21,honeybabynina,,1,0,2,"Niggas fucked up in the crib having anxiety attacks",,,,1243015909008003074,https://twitter.com/honeybabynina/status/1243015909008003074
2020-03-26 03:24:19,johnndavis,CBCCanada,0,0,0,"20200325: Nicole Mortillaro : 'I've never been so stressed': Health-care workers in COVID-19 battle face PTSD, mental health issues [""Front-line workers have higher risk of symptoms of depression, anxiety, study says"" https://twitter.com/CBCCanada/status/1242731478976475136 …",,,,1243015899352834048,https://twitter.com/johnndavis/status/1243015899352834048
2020-03-26 03:23:51,CruelPhilosophr,,1,0,0,"So to help me deal with my anxiety and stress I decided to write down how I'm feeling. Might do this every day if it helps. So with that, I present to you: ""Forever Quarantined"" by the CruelPhilosophr #COVID2019 #StayHome #nycshutdownpic.twitter.com/ZuVOjVlSj0 – at bronx new york",,,#COVID2019 #StayHome #nycshutdownpic,1243015782168133632,https://twitter.com/CruelPhilosophr/status/1243015782168133632
2020-03-26 03:23:19,sincerelysione,,0,0,5,"Me: starts conversation when not suffering from overwhelming anxiety Person: responds Me: doesn’t respond because anxiety is back Me 3 days later: sends tiktok that made me laugh & think of them.",,,,1243015648285868033,https://twitter.com/sincerelysione/status/1243015648285868033
2020-03-26 03:22:36,NotThatRudy,OnlyOneTeeta,0,0,2,"The anxiety this video gave me https://twitter.com/OnlyOneTeeta/status/1242816478849662985 …",,,,1243015468211994625,https://twitter.com/NotThatRudy/status/1243015468211994625
2020-03-26 03:22:24,rocketlovebot,,0,0,2,"super wild how my anxiety decreased immensely when I changed my diet to accommodate my food texture issues which ties into my ocd stuff. completely bananas!",,,,1243015416793796608,https://twitter.com/rocketlovebot/status/1243015416793796608
2020-03-26 03:22:15,manthapaige13,,3,0,21,"i searched my indirects and i made myself sad. i fucking know better by now. i know how bad it is for my mental health and my anxiety. fuck",,,,1243015382505578497,https://twitter.com/manthapaige13/status/1243015382505578497
2020-03-26 03:21:26,theoriginalle__,dopekidsheldon,0,2,2,"This could really go both ways. Either way it gives me anxiety https://twitter.com/dopekidsheldon/status/1242664454447382530 …",,,,1243015173687951360,https://twitter.com/theoriginalle__/status/1243015173687951360
2020-03-26 03:20:58,JJRodV,,1,1,28,"I’m grateful for mental health professionals. I hope that more access to therapists will be available during and after this pandemic. This is a wildly anxiety producing time, and collectively we’ll need to attend to our mental/emotional health alongside our physical health.",,,,1243015058554265600,https://twitter.com/JJRodV/status/1243015058554265600
2020-03-26 03:19:33,MiScottDavis,,1,0,2,"Sometimes all it takes is a few good minutes with a furry friend to make your anxiety decrease. #Stevie #QuarantineLifepic.twitter.com/hqizQ2p73T",,,#Stevie #QuarantineLifepic,1243014700486537217,https://twitter.com/MiScottDavis/status/1243014700486537217
2020-03-26 03:19:29,JJRodV,,0,0,8,"I’m so profoundly grateful for therapists. Today I was reflecting on how, amidst important spikes in fear/anxiety, I’ve had tools to engage this moment. If we would have been living through this three years ago....I’m not sure what I would have done....",,,,1243014684531470337,https://twitter.com/JJRodV/status/1243014684531470337
2020-03-26 03:18:53,_nickmartinez__,,0,0,1,"Who would’ve thought that a system that puts profit over people and reduces them to replaceable cogs in a life sucking capitalist machine would cause so much anxiety and depression",,,,1243014533880438784,https://twitter.com/_nickmartinez__/status/1243014533880438784
2020-03-26 03:17:04,nancyblanchard,brockmcginnis,0,0,1,"I just wish it wasn’t so built up/crowded by the Lakeshore area, it was slways nice to see the water from the Gardner. If anyone had anxiety, they wouldn’tlast in TO. Way too crowded with high rises.",,,,1243014077644849154,https://twitter.com/nancyblanchard/status/1243014077644849154
2020-03-26 03:16:44,KurtEarl14,,1,0,4,"It's ok to mourn the loss of these things. It's ok to swirl through anger, sadness, fear, depression, and anxiety. That's pretty normal at this point. What's not ok is letting a virus that attacks your body attack your soul.",,,,1243013990550319104,https://twitter.com/KurtEarl14/status/1243013990550319104
2020-03-26 03:16:42,amandaaddleman,,0,0,0,"These little beacons of hope for us. If it weren’t for the constant thrum of anxiety about all this, I think I might enjoy the slower paced day to day. There are a lot of beautiful moments these days - even though I… https://www.instagram.com/p/B-LnLJrg5R0/?igshid=9c7epmy6rqvi …",,,,1243013983361208320,https://twitter.com/amandaaddleman/status/1243013983361208320
2020-03-26 03:14:51,AudreyOnAir,,4,0,30,"Putting my phone on DND and turning on my favorite playlist while coloring has helped my anxiety SO MUCH pic.twitter.com/Isng1FdH4e",,,,1243013518326001664,https://twitter.com/AudreyOnAir/status/1243013518326001664
2020-03-26 03:14:28,RealKieranLyons,,3,0,8,"Good night, friend. Try to stay positive and lessen your anxiety. I need you to be kind and a bright light in a sea of darkness. Thank you for making my day, we'll try again tomorrow. Sleep well and in peace.",,,,1243013421009899520,https://twitter.com/RealKieranLyons/status/1243013421009899520
2020-03-26 03:13:53,IsaiahLCarter,,1,0,0,"I really could use someone to talk to right now, because I am scared, and my anxiety is flaring up a bit...",,,,1243013273680781312,https://twitter.com/IsaiahLCarter/status/1243013273680781312
2020-03-26 03:13:05,blkjak8426,Ivana_Knapp,0,0,1,"I toked 20 min about 4-5 hrs for pain(migraine) and anxiety pic.twitter.com/1drghaThs1",,,,1243013072152924160,https://twitter.com/blkjak8426/status/1243013072152924160
2020-03-26 03:12:33,apckrfan,JayDizzyD,1,0,1,"Stress, a drastic change in “normalcy”, and anxiety don’t mix well. My daughter had a prett bad day Monday. ... I don’t know what to say, other than take care of you.",,,,1243012941462503424,https://twitter.com/apckrfan/status/1243012941462503424
2020-03-26 03:06:27,johnndavis,CBCOttawa,0,0,0,"20200325: Haneen Al-Hassoun : Help lines inundated as anxiety over pandemic builds [""Agencies reporting rise in calls coupled with difficulty finding volunteers"" https://twitter.com/CBCOttawa/status/1242788617682137094 …",,,,1243011404841582593,https://twitter.com/johnndavis/status/1243011404841582593
2020-03-26 03:03:04,AGlibs,alainaPWRCHK,1,0,3,"Most people that I know with generalized anxiety disorders feel weirdly calm. Me included. I made a post earlier saying i feel like my fears were almost validated.",,,,1243010552026324993,https://twitter.com/AGlibs/status/1243010552026324993
2020-03-26 03:02:45,yo_noels,HiBritneyMonae,1,0,0,"the ferocity cures my anxiety each time",,,,1243010474570125312,https://twitter.com/yo_noels/status/1243010474570125312
