date,username,to,replies,retweets,favorites,text,geo,mentions,hashtags,id,permalink
2020-03-26 19:59:03,angig81,,0,0,1,"My anxiety was about to be through the roof right now thinking my washing machine was broken",,,,1243266231966273538,https://twitter.com/angig81/status/1243266231966273538
2020-03-26 19:58:34,shannenrhian,,0,0,2,"John Mayer tunes curing my anxiety today",,,,1243266111870828544,https://twitter.com/shannenrhian/status/1243266111870828544
2020-03-26 19:56:52,taylor_veronia,,1,0,0,"My anxiety has been like 9.5/10 for the past 6 wks. I’m fucking over it.",,,,1243265686014754819,https://twitter.com/taylor_veronia/status/1243265686014754819
2020-03-26 19:56:18,MorganCeili,,0,0,3,"This is our reality, and the president thinks we want to close down to hurt his re-election campaign. I’m so overcome with anxiety from being at work and exposed, simultaneously depressed by what’s happening right now.",,,,1243265540140830720,https://twitter.com/MorganCeili/status/1243265540140830720
2020-03-26 19:54:40,peggrammer,,0,0,1,"I still haven't adjusted to this new normal. I'm starting to get anxiety attacks, getting paranoid. I need to get myself together.",,,,1243265130353303554,https://twitter.com/peggrammer/status/1243265130353303554
2020-03-26 19:52:21,Ashwigles,,0,0,0,"Bro, anxiety quarantine clean is a new type of clean. pic.twitter.com/aGfQIYIwCp",,,,1243264545898016768,https://twitter.com/Ashwigles/status/1243264545898016768
2020-03-26 19:52:06,KellyAKramer12,,0,0,1,"As if my anxiety isn’t already bad, some guy who was honking at my @Uber driver for no reason spit at us, and the windows were down of course. I want to cry.",,@Uber,,1243264485609046018,https://twitter.com/KellyAKramer12/status/1243264485609046018
2020-03-26 19:51:27,whatthechuck99,,0,0,0,"I'm pretty sure my anxiety is rising as exponentially as the confirmed cases of #COVID2019 – at Five Oaks Park",,,#COVID2019,1243264322547208193,https://twitter.com/whatthechuck99/status/1243264322547208193
2020-03-26 19:49:41,EMajec,,0,0,0,"I was going to start my Jiujitsu training this week, but Corona. Read this instead. I recommend this book to anyone fighting anxiety or depression, studying martial arts, looking to build courage and confidence, or interested in Buddhism, Confucianism, or D(T)oasim. pic.twitter.com/wXgv84f72w",,,,1243263876172369920,https://twitter.com/EMajec/status/1243263876172369920
2020-03-26 19:49:41,KoryOnTheRadio,,0,0,3,"Nothing triggers my anxiety quite like needing to pee.",,,,1243263875966885889,https://twitter.com/KoryOnTheRadio/status/1243263875966885889
2020-03-26 19:48:55,CGCWriting,,0,0,1,"Okay ... I am supposed to be resting. I have to stop reading the news, it’s giving me anxiety. Too many people dying or dead.",,,,1243263683708571649,https://twitter.com/CGCWriting/status/1243263683708571649
2020-03-26 19:48:35,iamsamrazafar,,0,0,1,"Going Live on this amazing webinar by @Anxiety_Canada at 4pm! Please join us!https://anxietycanada.zoom.us/j/676793368",,@Anxiety_Canada,,1243263600258678786,https://twitter.com/iamsamrazafar/status/1243263600258678786
2020-03-26 19:46:48,RNAwesomeSauce,,1,0,3,"FINALLY occ health called back and I’m gonna be tested 10 am tomorrow from my car. Ready for my nose to be super invaded. Today working on being shit faced from wine cause my anxiety is off the chain if I’m honest.",,,,1243263149601624066,https://twitter.com/RNAwesomeSauce/status/1243263149601624066
2020-03-26 19:45:55,TheTurfDunedain,TurfgrassZealot,0,0,1,"Trying is better than bad. Been fighting my own anxieties this past week but I'm trying to work through them. It's crazy out there!! I did shave again. My 7th year in a row. I'm now a Knight Of The Bald Table, lol. And after the past week, I'm even happier I did it.",,,,1243262929027227648,https://twitter.com/TheTurfDunedain/status/1243262929027227648
2020-03-26 19:45:45,FragrantFC,,0,0,6,"Going for a walk was supposed to relieve my anxiety but too many people and defeated the purpose",,,,1243262885679243264,https://twitter.com/FragrantFC/status/1243262885679243264
2020-03-26 19:43:41,Sp1ffyJ1ffy,,0,0,0,"Guys I accidentally picked up the wrong can of vegetables when I was at the store yesterday but I had touched them and didn’t want to leave it for someone else to touch so I bought it in case anyone wants to know where my anxiety is at.",,,,1243262365971484676,https://twitter.com/Sp1ffyJ1ffy/status/1243262365971484676
2020-03-26 19:42:17,tutilanena,,0,1,0,"i get anxiety just thinking about going to work",,,,1243262015231217667,https://twitter.com/tutilanena/status/1243262015231217667
2020-03-26 19:40:00,willow760306,codeofvets,1,0,2,"Absolutely 100% hate it as I’m dealing with my anxiety being raised due to being worried that with myself will get this crap seeing as I have a compromised immune system and I’m a single mother",,,,1243261440984846336,https://twitter.com/willow760306/status/1243261440984846336
2020-03-26 19:39:01,OsiMizrahi,,0,0,0,"COVID-19 is a wake up call! I look at this time is a wake up call. The level of anxiety and the fear of the unknown is triggering our senses. What do you do in a time like this and what are your tools to cope? How… https://www.instagram.com/p/B-NXiIADA2-/?igshid=10wgwb5cqwz21 …",,,,1243261189955731462,https://twitter.com/OsiMizrahi/status/1243261189955731462
2020-03-26 19:39:00,robynarnone,,0,0,0,"MADE IN THE USA Improve your health routine by incorporating Green Flame Hemp Gummies into your day. Keep your body balanced, decrease anxiety and depression, and reduce inflammation with the ease and convenience… https://www.instagram.com/p/B-NXlh2j8EA/?igshid=1lk3b0skdetda …",,,,1243261188399607809,https://twitter.com/robynarnone/status/1243261188399607809
2020-03-26 19:38:19,Jshene15,TheBuckeyeBlitz,1,0,1,"Honestly, we need something like sports to help ease the panic/anxiety/fear that’s very present at this time IMO. I think we’re still a ways off before the college football season is cancelled, but this is something that isn’t going away for a while & the worst is yet to come.",,,,1243261015787048961,https://twitter.com/Jshene15/status/1243261015787048961
2020-03-26 19:37:33,LionLifeP,,0,2,3,"Man.. That last hour of work have my anxiety thru the roof!!",,,,1243260823058952192,https://twitter.com/LionLifeP/status/1243260823058952192
2020-03-26 19:36:11,ImaMfLady,,1,1,3,"Anxiety is wanting to talk to you but not having any words to contribute to the conversation.",,,,1243260480845733889,https://twitter.com/ImaMfLady/status/1243260480845733889
2020-03-26 19:34:18,AlastairBitsoi,,0,0,2,"These earthquake aftershocks give me more anxiety than COVID-19...right now.",,,,1243260004473253888,https://twitter.com/AlastairBitsoi/status/1243260004473253888
2020-03-26 19:34:14,devonthesavage,,0,0,0,"i'm just trying distance myslf frm anxiety",,,,1243259989701136384,https://twitter.com/devonthesavage/status/1243259989701136384
2020-03-26 19:33:30,Bananadogs3,DrPhil,0,0,1,"To @DrPhil Watching your Coronavirus show right now-talking about “anxiety thru the roof” Well let me tell you something. MY anxiety has ALREADY BEEN thru the roof ever since 11/8/16, when the Electoral College, NOT THE PEOPLE, voted DJT into office as President of the USA. https://twitter.com/DrPhil/status/1243240439710224384 …",,@DrPhil,,1243259804069629955,https://twitter.com/Bananadogs3/status/1243259804069629955
2020-03-26 19:30:50,TheyHateNoel,,1,0,1,"I need an powerline ethernet adapter and Walmart don't have any. Idk if Amazon is counting that as a priority... don't wanna waste money if they not finna ship it asap. My anxiety",,,,1243259134230790145,https://twitter.com/TheyHateNoel/status/1243259134230790145
2020-03-26 19:29:00,jamesmfee,shawnblanc,0,0,0,"That stupid mouse trackball gives me anxiety every time I see it!",,,,1243258671452180480,https://twitter.com/jamesmfee/status/1243258671452180480
2020-03-26 19:28:51,termas_heckles,,0,0,7,"In good quarantine news, i can watch true crime again because it doesn’t give me anxiety anymore because i never leave the house :)",,,,1243258633049104384,https://twitter.com/termas_heckles/status/1243258633049104384
2020-03-26 19:28:29,chinapoblana13,,0,0,0,"How are my fellow scorpios dealing with their anxiety this quarantine season? #Scorpios #QuarantineLife #OverThinking",,,#Scorpios #QuarantineLife #OverThinking,1243258542469021699,https://twitter.com/chinapoblana13/status/1243258542469021699
2020-03-26 19:28:12,Coloredeyesmark,MarcoPollo7593,1,0,1,"Good to hear!! Anxiety is at an all time high!! No need for any more",,,,1243258469714722817,https://twitter.com/Coloredeyesmark/status/1243258469714722817
2020-03-26 19:27:04,cpeterson2233,,4,0,30,"I have anxiety for my past self about this game right now.",,,,1243258183533068290,https://twitter.com/cpeterson2233/status/1243258183533068290
2020-03-26 19:23:39,PennyMuetzel,realDonaldTrump,0,0,3,"Can you (emphasis on YOU) please stop doing these? It’s sad that the person we should be able to turn to in this crisis for strength and leadership creates more feelings of anxiety than feelings of comfort and unity.",,,,1243257326045454339,https://twitter.com/PennyMuetzel/status/1243257326045454339
2020-03-26 19:22:12,LonnieKevnClark,,1,1,1,"https://www.facebook.com/United.State.of.Americas/ … https://www.facebook.com/100023984316312/posts/679575279518610/ … Portions of the @UnitedStates of America were ""grounded"" today Thursday March 26th 2020 due to heightened anxieties & overwhelming fears brought on by the #COVID19 #CoronaVirus. When HIV & AIDS was released in the 70s & ...pic.twitter.com/aNuJfYmk33",,@UnitedStates,#COVID19 #CoronaVirus,1243256960478261250,https://twitter.com/LonnieKevnClark/status/1243256960478261250
2020-03-26 19:21:57,celestehave,darbyk18,1,0,0,"True, most likely not on that part since they’re not on social media I’m sure their anxiety levels are at a much more calm level than ours hahahahaha",,,,1243256895730843649,https://twitter.com/celestehave/status/1243256895730843649
2020-03-26 19:16:23,RachGoodwin17,,0,0,1,"Feeling pretty good considering I’ve had like 4 anxiety attacks in 2 days Also, I’m not sure if it’ll ever NOT faze me when I’m just wearing my designs all the time. pic.twitter.com/2JHYmqSlAn",,,,1243255494027939840,https://twitter.com/RachGoodwin17/status/1243255494027939840
2020-03-26 19:16:02,LadyCrusaders14,,0,2,16,"Get some fresh air! Spending time outdoors can help relieve stress and anxiety, improve your mood, and boost feelings of happiness. Just ask Colin Cleary ‘21 & Timmy Cleary ‘24 who decided that it's never too early to start training for cross-country season! #crusadersleadthewaypic.twitter.com/ey0y0o3dDH",,,#crusadersleadthewaypic,1243255407575027720,https://twitter.com/LadyCrusaders14/status/1243255407575027720
2020-03-26 19:15:15,kookid_deee,,0,0,0,"i hate that “i got a question” message be having a nigga anxiety thru the roof",,,,1243255209452765185,https://twitter.com/kookid_deee/status/1243255209452765185
2020-03-26 19:13:16,EdBCollie,TheClayThompson,6,0,3,"*anxiety attack* https://twitter.com/TheClayThompson/status/1242786799593967622 …",,,,1243254711957979137,https://twitter.com/EdBCollie/status/1243254711957979137
2020-03-26 19:12:29,wellnesspamama,,0,0,0,"During these challenging times of uncertainty and overwhelming anxiety, a lot can be coming up for us that we are struggling to manage. For me, the feelings of uncertainty, isolation and anxiety, bring up the dark… https://www.instagram.com/p/B-NTbdSgiLN/?igshid=5t6dm2hpeps …",,,,1243254515807256579,https://twitter.com/wellnesspamama/status/1243254515807256579
2020-03-26 19:08:13,JUSTpolishedbyJ,,0,0,0,"Missing my fav. coworkers!!!! Treat time, is all the time! Did you know that bringing your pets to work lowers employees anxiety and brings them closer together? Builds sense of community and strengthen teams.… https://www.instagram.com/p/B-NUERTBu-m/?igshid=12mw3eutygjs1 …",,,,1243253439678894087,https://twitter.com/JUSTpolishedbyJ/status/1243253439678894087
2020-03-26 19:07:23,norakgalley,,4,0,25,"did anyone else leave school early with a stomachache at least once a week in elementary school and then later in life realize it was just anxiety?? Just me ?",,,,1243253232983564288,https://twitter.com/norakgalley/status/1243253232983564288
2020-03-26 19:07:20,Hip_Arriaga,,1,1,3,"I mean do y’all gotta give me anxiety on purpose or nah? pic.twitter.com/jEqur4b9D7",,,,1243253216718065664,https://twitter.com/Hip_Arriaga/status/1243253216718065664
2020-03-26 19:06:58,X0_TheHost,,0,1,3,"If you are experiencing anxiety at these times I highly recommend doing yoga",,,,1243253128235024384,https://twitter.com/X0_TheHost/status/1243253128235024384
2020-03-26 19:06:03,tylersadvary,,0,0,1,"The amount of anxiety running through my veins... pic.twitter.com/92eRMPWszS",,,,1243252894159298562,https://twitter.com/tylersadvary/status/1243252894159298562
2020-03-26 19:05:41,keith72504,nidhiprakash,24,17,150,"These are all the horrors and fears most liberals had on the morning of November 9, 2016 when we woke up to Donald Trump being POTUS. Now the crying and anxiety is real. I still remember the media saying liberals were overreacting and what's the worst thing that can happen.",,,,1243252804619288579,https://twitter.com/keith72504/status/1243252804619288579
2020-03-26 19:02:11,SeniorServiceSW,,0,0,0,"These simple tips will help you ease your coronavirus anxiety, relax and put things in a better perspective — in between washing your hands, of course. #WashYourHands #StayHome #SeniorServicesSWMIhttps://nyti.ms/3aeo7nB",,,#WashYourHands #StayHome #SeniorServicesSWMIhttps,1243251923014352896,https://twitter.com/SeniorServiceSW/status/1243251923014352896
2020-03-26 19:01:01,MicroJustyna,,2,0,38,"This vicious cycle of: i have anxiety because I’m not productive and I’m not productive because I have anxiety, is really going to break me. Staying inside as much as I can but I had to get out today, just to look at the waterStay healthy everyone, physically and mentally! pic.twitter.com/qkMuN3t9HL",,,,1243251628200902658,https://twitter.com/MicroJustyna/status/1243251628200902658
2020-03-26 18:58:43,embarnes__,,0,0,8,"“so I thought that I had cured my anxiety, turns out I actually just started doing yoga and smoking weed”",,,,1243251049089175552,https://twitter.com/embarnes__/status/1243251049089175552
2020-03-26 18:57:58,npi___,Dino86417347,0,0,0,"Yes, that was more to my point Dino, everyone is struggling with anxiety & financial issues. I was merely highlighting that airline staff are no different to other industries/businesses impacted by #CV19 and that we should afford them the same compassion & understanding",,,#CV19,1243250862300041217,https://twitter.com/npi___/status/1243250862300041217
2020-03-26 18:57:20,Javier4Florida,,0,1,3,"Uncertain times like these can be stressful, causing anxiety and even depression. Make sure to make time to relax and focus on you. Reach out to those you trust. We might all be separated but we can still support each other. #stayhealthy #stayhomepic.twitter.com/hvOu92BDWJ",,,#stayhealthy #stayhomepic,1243250702408978432,https://twitter.com/Javier4Florida/status/1243250702408978432
2020-03-26 18:53:01,LOVINGitLALA,,0,0,3,"Decided to watch love is blind. As dumb as it is, it has distracted me from my anxiety all day so thank youuu",,,,1243249616012877828,https://twitter.com/LOVINGitLALA/status/1243249616012877828
2020-03-26 18:52:55,itskyleerivera,,0,0,0,"Being a #GroceryWorker and having anxiety is not fun during this time... my anxiety is through the roof and I’m controlling it the best I can.",,,#GroceryWorker,1243249589844656128,https://twitter.com/itskyleerivera/status/1243249589844656128
2020-03-26 18:52:43,im_emma_nicole,book_germ,0,0,0,"Accepting anxiety part 2",,,,1243249539986919424,https://twitter.com/im_emma_nicole/status/1243249539986919424
2020-03-26 18:52:41,HubbarttJen,mkemom,1,0,0,"That’s great she’s being active. My teen was not in a great state last night and has been hiding even more in her room. Not much creativity or productivity. It’s hard with that plus I’m managing work crises and anxiety.",,,,1243249530813980673,https://twitter.com/HubbarttJen/status/1243249530813980673
2020-03-26 18:51:26,K8Pardon,showupforthis,0,0,4,"It doesn’t help the anxiety and dread, even if the person wasn’t an intimate. This is a terrible time, and we’re all going to have lasting effects from it. Feel what you need to feel, Gin. pic.twitter.com/Tujkxp433x",,,,1243249215888818177,https://twitter.com/K8Pardon/status/1243249215888818177
2020-03-26 18:48:29,BoozyBillsBabe,,3,1,14,"Anxiety is great because I have barely eaten today and yet I want to throw up.",,,,1243248474948358151,https://twitter.com/BoozyBillsBabe/status/1243248474948358151
2020-03-26 18:48:14,KateNeal28,,0,0,4,"Chest is heavy .. gonna log off, watch some movies, paint, & try to recenter ... anxiety during all this shit is not a healthy combo. Sick of feeling like this.",,,,1243248410049863688,https://twitter.com/KateNeal28/status/1243248410049863688
2020-03-26 18:45:46,itsmercedeswhte,Georgeism_,1,0,1,"Going to grocery stores give me sooo much anxiety",,,,1243247792996433926,https://twitter.com/itsmercedeswhte/status/1243247792996433926
2020-03-26 18:45:22,BlakeWeir88,,3,0,7,"I impulsively bought air pod pros during a night of sleep deprivation and anxiety. They came in the mail today and I had completely forgot about them. I’m not going to look at my credit card statement today.",,,,1243247689808203782,https://twitter.com/BlakeWeir88/status/1243247689808203782
2020-03-26 18:43:06,icthus34,TheDrPhilShow,0,0,0,"Please address those who have pre existing anxiety and OCD, along with prior heart and stroke issues, and nearly 70 years old. Isolation in Colorado can increase these risks.",,,,1243247121261682690,https://twitter.com/icthus34/status/1243247121261682690
2020-03-26 18:43:01,natstorrs,,0,0,0,"All I can say is: thank GOD for nature over these past weeks. I’ve never been more grateful to be able to get outside for brief hikes alone. It has calmed anxiety, lifted depression, and refocused me on how to make… https://www.instagram.com/p/B-NRL3upduy/?igshid=i0tsyl88xk1j …",,,,1243247101154398208,https://twitter.com/natstorrs/status/1243247101154398208
2020-03-26 18:42:15,EricGD_MfSpitta,,5,0,1,"Question for people with anxiety: What is helping you the most in coping with this quarantine?",,,,1243246906790338562,https://twitter.com/EricGD_MfSpitta/status/1243246906790338562
2020-03-26 18:40:22,IsabelleKellogg,,0,0,0,"We are all struggling with anxiety and uncertainty. Find something that brings you a little joy and hope. For me, it’s these Italian Easter treats eatalyflatiron #truenewyorker #kelloggdynasty #discoveryoftheday… https://www.instagram.com/p/B-NQ4e7FAmM/?igshid=174jx64gfeoae …",,,#truenewyorker #kelloggdynasty #discoveryoftheday,1243246433031069697,https://twitter.com/IsabelleKellogg/status/1243246433031069697
2020-03-26 18:39:30,vizzinia11,,0,0,3,"my anxiety normally: my anxiety after getting told i’m an essential worker at my nursing home and i have to try visit all the residents in the facility while i’m there:",,,,1243246215778664449,https://twitter.com/vizzinia11/status/1243246215778664449
2020-03-26 18:37:42,macyouthere,Haleaaa2,1,1,3,"This is anxiety to a T https://twitter.com/Haleaaa2/status/1243242843294126081 …",,,,1243245762462584836,https://twitter.com/macyouthere/status/1243245762462584836
2020-03-26 18:37:13,AshleaDavis,RevSarahLocke,1,0,2,"This. I manage ok for a few and then have a low day. It’s hard to live at this level of anxiety and I’m on medication. https://twitter.com/RevSarahLocke/status/1243053003093037057 …",,,,1243245640051757056,https://twitter.com/AshleaDavis/status/1243245640051757056
2020-03-26 18:32:50,HeyBMcCormick,,0,0,2,"WFH Day 9: how's your grays sitch? Here's mine. Hard to say if it's from stress and anxiety or just me getting older.... pic.twitter.com/UXrMBNTXxI",,,,1243244535234379778,https://twitter.com/HeyBMcCormick/status/1243244535234379778
2020-03-26 18:29:30,anaxm__,,0,0,1,"Sooo I think my blunt gave me an anxiety or panic attack last night and now I’m scared hahahahaha",,,,1243243697904349185,https://twitter.com/anaxm__/status/1243243697904349185
2020-03-26 18:28:34,azeliaevelyn,,1,0,0,"Quick story short last year was a tough year for me I thought to my self why me why do I have to go through this it was tough i was depressed my anxiety was horrible I went to a retreat because god was calling me this retreat saved me I came out a new person god gave me a purpose",,,,1243243462457266176,https://twitter.com/azeliaevelyn/status/1243243462457266176
2020-03-26 18:28:10,sss_ej,,0,0,0,"I’ve been avoiding my official transcript from my BS cause of the anxiety, or thinking my gpa was too low for competitive ass grad school. I got one “C” .... All this drama, over one C",,,,1243243362578137088,https://twitter.com/sss_ej/status/1243243362578137088
2020-03-26 18:23:53,isabeltelise,,0,0,0,"I finally got outside. The sun and air felt great!!! Enjoy the beauty if the sunshine if it’s out there!! #staysafe #coronavirus #covıd19 #thenewnormal #passingtime #needmoreideas #anxiety #breathe #sunshine @… https://www.instagram.com/p/B-NO_eCHaGo/?igshid=l4ahn6z8xnsv …",,@,#staysafe #coronavirus #covıd19 #thenewnormal #passingtime #needmoreideas #anxiety #breathe #sunshine,1243242282733703168,https://twitter.com/isabeltelise/status/1243242282733703168
2020-03-26 18:21:42,blackbettyblog,,0,0,0,"The homeless people are like, Where is everyone? Don’t worry I’m going back to self isolate — which is bad for my anxiety btw.",,,,1243241735347527680,https://twitter.com/blackbettyblog/status/1243241735347527680
2020-03-26 18:21:27,fridakinss,,0,0,2,"Playing hide and seek with my kids and it’s actually giving me anxiety LMFAOOOO fuck I hate this game",,,,1243241671778762753,https://twitter.com/fridakinss/status/1243241671778762753
2020-03-26 18:20:12,ledsofa,tcboyle,0,0,0,"I’m tempering my political rage & quarantine anxiety w/ AM desert hikes, grading my grad students thoughtful leadership answers to GOT, your novel & a few others; shooting hoops with my sons, & reading at night, w/ a few sips of bourbon. Not a bad apocalypse...at least for now.",,,,1243241357554008064,https://twitter.com/ledsofa/status/1243241357554008064
2020-03-26 18:17:12,VillageCigarHQ,,0,0,0,"VCH Patchogue COVID-19 Rescue Fund: During this time we hope everyone is safe and positive in the direction we are going. We understand that anxiety, worries and stress might be a big factor affecting all of us.… https://www.instagram.com/p/B-NOOnop4_p/?igshid=z113g2qbx24l …",,,,1243240602608766976,https://twitter.com/VillageCigarHQ/status/1243240602608766976
2020-03-26 18:15:26,AnthonyDriven,,0,0,0,"All we know is a change is coming. I wish us All Love, Hope, Joy, Peace, Kindness and Unity. We're ALL going through the same feelings of anxiety and fear but if we remember to focus on unity and positive affirmations we just might change devastation to Victory! #Affirmationspic.twitter.com/wsl2fCIxhy",,,#Affirmationspic,1243240157052100610,https://twitter.com/AnthonyDriven/status/1243240157052100610
2020-03-26 18:15:22,tngolfer,NatashaBertrand,0,0,0,"I agree. The media is sensationalizing the crisis. Causing every high anxiety person with the sniffles to panic and seek medical attention placing undue stress on the system and health care workers",,,,1243240141948432386,https://twitter.com/tngolfer/status/1243240141948432386
2020-03-26 18:13:14,pvand1,Chica_LeoLatina,0,0,0,"Live in the present or you can drive yourself over the edge. Enjoy the here and now. You are causing yourself needless anxiety. I do understand though.",,,,1243239603785494528,https://twitter.com/pvand1/status/1243239603785494528
2020-03-26 18:10:58,liannag,,0,0,1,"My anxiety about what’s going on is making me shop more frivolously than usual. Come to mama new shoes and inflatable swimming pool",,,,1243239031577677833,https://twitter.com/liannag/status/1243239031577677833
2020-03-26 18:09:05,lirpav73,,0,0,0,"@zanelowe Thank You Thank You Thank You! My anxiety has been through the roof all week, but for the last two hours I have relaxed and felt peace. I need this whole playlist ASAP @Harry_Styles You make the world a better place...",,@zanelowe @Harry_Styles,,1243238559420764160,https://twitter.com/lirpav73/status/1243238559420764160
2020-03-26 18:08:43,YvonneSdgurl,,3,1,18,"Some ways we love to torture Blaine in fics Abusive father Homophobic father Neglectful mother Failure to protect by mother Cancer Head injury with brain damage Coma POW Abused slave Sexual abuse/assault Statuatory rape/manipulation Depression Anxiety Losing Kurt",,,,1243238467028447233,https://twitter.com/YvonneSdgurl/status/1243238467028447233
2020-03-26 18:08:35,_absmith92,,0,0,2,"Just got a burst of anxiety.",,,,1243238431981015045,https://twitter.com/_absmith92/status/1243238431981015045
2020-03-26 18:07:16,layneelkins,,0,0,8,"i had a really bad dream and woke up having a panic attack due to the anxiety of our current situation and the uncertainty of the coming months … but i’m not gonna dwell on it. going to have some cereal, open the blinds, and play animal crossing to distract myself",,,,1243238100274417664,https://twitter.com/layneelkins/status/1243238100274417664
2020-03-26 18:07:07,LndsyFree,,1,0,0,"Been in a major anxiety/financial induced depression since August of last year. No amount of sleep is restful. Too morose to care about showering. Gained 50 lbs. Living in a disastrously messy space. & let me tell you that was a fun vacation compared to where I'm at these days",,,,1243238064635305985,https://twitter.com/LndsyFree/status/1243238064635305985
